id,title,score,url,created_utc,num_comments,views,week,popularity
784gt7,Carmelo puts OKC up by 1 before Wiggins wins it at the buzzer,27816,https://streamable.com/3t2tl,1508721935,1987,513598,2017-42,2.872686801750138
78cysm,Jordan Bell SELF ALLEY OOP And-1,17274,https://streamable.com/rvev1,1508813464,1684,588525,2017-43,2.468518298187572
77amvr,Markelle Fultz first 2 free-throws of his career,12210,https://streamable.com/gjj42,1508369772,1572,358023,2017-42,1.838437915116034
79127z,Blake Griffin wins the game with the buzzer beater 3 pointer,10655,https://streamable.com/zx0bi,1509078928,1273,359793,2017-43,1.635064248847431
7ahc4y,Damian Lillard game winner,13943,https://streamable.com/mfea8,1509685614,1239,245861,2017-44,1.5425693179481972
78sas3,Eric Gordon beats the 6ers at the buzzer,11534,https://streamable.com/flyqg,1508980843,980,323610,2017-43,1.4577254657185004
774l1e,Durant Misses Game Winner By Faction of a Second - TNT,8130,https://streamable.com/g2xdi,1508304562,1122,321840,2017-42,1.4038068551384062
78kxkz,Blake Griffin ends Rudy Gobert's life with the nasty poster dunk,8802,https://streamable.com/uofu3,1508900100,819,375998,2017-43,1.3674976984704454
77jj56,Patrick Beverley going at Lonzo Ball and welcoming him to the league,6800,https://streamable.com/qsv9k,1508469697,912,318959,2017-42,1.2454103931437173
7a8blu,Ben Simmons NASTY DUNK!,7315,https://streamable.com/ba6j7,1509586713,626,287914,2017-44,1.0672388155116452
77xb99,Markelle Fultz horrible free throw attempt,3419,https://streamable.com/olcno,1508634438,930,251747,2017-42,1.0187163725060975
7a04y4,Westbrook to Adams - NBATV,7400,https://streamable.com/qkryq,1509496059,454,231545,2017-44,0.887951825178326
77qgzg,Lebron James blocks Giannis then drills a wide open 3 on the next play,6074,https://streamable.com/vz14d,1508548094,557,221234,2017-42,0.8745982884021912
7989nb,Steph gets John Wall to take the bait and makes him pay!,5796,https://streamable.com/vewnp,1509165140,412,257535,2017-43,0.8533110292706859
7aod4c,LeBron with a pinpoint behind the back pass to the ref after a foul.,5017,https://streamable.com/bxmhj,1509765156,271,241702,2017-44,0.7274414663308744
7anyyt,Porzingis with a spectacular block on one end and a spectacular dunk on the other end!,5010,https://streamable.com/wvsir,1509760256,363,171199,2017-44,0.6536946684012565
77t7j7,De'Aaron Fox with Kameha shot,3547,https://streamable.com/bc9m8,1508590707,523,147841,2017-42,0.6419333889583674
79ea05,Donovan Mitchell flies for the unbelievable putback slam,4564,https://streamable.com/3dld7,1509245411,302,142196,2017-43,0.5576803548514981
7ao7ux,Manu pulls out a ferocious dunk at 40 years young,4652,https://streamable.com/xt0dz,1509763289,308,126254,2017-44,0.5367755701218583
777kle,Kevin Love's absolutely ridiculous pass last night,4339,https://streamable.com/b350f,1508342875,296,130085,2017-42,0.5259932925002515
7a0omq,"Nothing stops Me7o, not even Giannis",2707,https://streamable.com/5bq1d,1509501884,386,134176,2017-44,0.5195677143507842
77x3vz,James Johnson dunks Victor Oladipo into oblivion,4062,https://streamable.com/q4luu,1508631929,255,140140,2017-42,0.5124859589211489
79dfdg,Beautiful ball movement by the Pelicans,4652,https://streamable.com/xt67c,1509234440,265,117936,2017-43,0.5010012666210883
79dsz1,Ben Simmons with a ridiculous wrap-around pass to Embiid,2552,https://streamable.com/dek38,1509239122,290,153644,2017-43,0.498760649052613
7bhv7g,Cody Zeller gets blocked 4 times in a row,3724,https://streamable.com/sz1jz,1510103817,277,131126,2017-45,0.4960903901292927
78t513,John Wall explodes past Lonzo,2848,https://streamable.com/wn9qu,1508990350,331,130109,2017-43,0.49004632331532244
7autuo,Steph Curry with the fake shot pass to Javale McGee,1911,https://streamable.com/0y0r0,1509846001,149,201150,2017-44,0.4854755550651211
77am7w,[Highlight] John Wall bodies TJ McConnell and dunks it!,3143,https://streamable.com/bwz0i,1508369576,360,88165,2017-42,0.44397689723554956
77xh86,Marc Gasol nasty move on Klay Thompson followed by a 3,4034,https://streamable.com/hutup,1508636464,284,88660,2017-42,0.43860129106926027
78zzr8,Irving gets free and floats it in with some wicked handle on Brogdon - TNT,3101,https://streamable.com/ej6cb,1509066005,309,98668,2017-43,0.4346464511569287
7anpcg,LeBron jumps over Beal,2389,https://streamable.com/hbjg8,1509757210,299,116644,2017-44,0.4345611166951694
77ikxl,KP send Melo back to NYC with the block,2949,https://streamable.com/sclco,1508459048,161,145040,2017-42,0.4334914174822816
78tdve,[HIGHLIGHT] Durant to Curry for the DEEP three to take the lead!,2219,https://streamable.com/fqibs,1508993524,362,99339,2017-43,0.4307515973050371
7844f7,Andre Roberson tries to compete with Fultz,2019,https://streamable.com/hijqb,1508718181,384,83963,2017-42,0.408507125900996
79sm7n,Andrew Wiggins huge dunk in the clutch vs the Heat,3267,https://streamable.com/l64qv,1509415186,250,91586,2017-44,0.39888776143646026
77qglc,Kyle Korver goes on a 9-0 run,3178,https://streamable.com/4jw7l,1508547972,274,82286,2017-42,0.3919644569915537
7ant4m,J. J. Redick circus 3 vs the Pacers,3451,https://streamable.com/9s7fn,1509758361,271,75312,2017-44,0.38841917456366803
78jwmi,Jaylen Brown throws down the thunderous reverse dunk on the fast break,2810,https://streamable.com/84s8y,1508889249,280,84857,2017-43,0.38612283725970986
7bhm6g,Giannis gives Lebron a taste of his own medicine,2246,https://streamable.com/g9yp8,1510101373,233,106289,2017-45,0.37860945269355883
79kmi7,KD with the Space Jam dunk!,2363,https://streamable.com/kqz0q,1509326729,177,118251,2017-43,0.3749578639512417
7afv0h,Danny Green with the poster on KD!,2528,https://streamable.com/vvxpt,1509668713,253,89496,2017-44,0.37027888101905543
79jry4,Victor Oladipo hit the 3 over LaMarcus Aldridge to give the Pacers the lead with 10.3 seconds left,2596,https://streamable.com/zrfxs,1509317575,365,52767,2017-43,0.3666813348969512
77jhu1,Blake Griffin posterizes Julius Randle,2241,https://streamable.com/tij8q,1508469289,230,86090,2017-42,0.34259848953146754
7av1ba,Anthony Davis smart play to keep the possession,2385,https://streamable.com/6pvv5,1509848505,220,85518,2017-44,0.34177073218838716
77jk8a,Patrick Beverley pretty move and NASTY block,2975,https://streamable.com/xkrfx,1508470071,167,88689,2017-42,0.34169621554541135
79s6o7,Porzingis ends the half in EPIC FASHION,1983,https://streamable.com/n5tj5,1509411077,222,92277,2017-44,0.33980980463644544
783y2g,Karl-Anthony Towns fucking hammers it down,2249,https://streamable.com/02831,1508716369,222,85875,2017-42,0.33849460360246286
78s18q,LeBron doing LeBron things,1682,https://streamable.com/29x26,1508977970,200,104373,2017-43,0.3384698043026535
77jneg,"Patrick ""1st Team All-Defense"" Beverley steals it from Lonzo for the easy basket",1983,https://streamable.com/qrhpd,1508471176,207,95025,2017-42,0.3369300360578504
7b5p9d,Westbrook with the strong defensive effort on Lillard.,1223,https://streamable.com/ypqxn,1509980964,359,62087,2017-45,0.3301378274596636