id,title,score,url,created_utc,num_comments,week
772v5s,Gordon Hayward Breaks His Leg *GRAPHIC*,34194,https://streamable.com/j4yf3,1508285853,6439,2017-42
77ch9a,Every Phoenix Suns player starts running at the exact same moment,31631,https://gfycat.com/PrestigiousWeeGreyhounddog,1508390979,620,2017-42
77amvr,Markelle Fultz first 2 free-throws of his career,12210,https://streamable.com/gjj42,1508369772,1572,2017-42
77n82a,Rookie Jonathon Isaac realizes he forgot his jersey in his 1st NBA Game.,9490,https://streamable.com/dilzk,1508516930,333,2017-42
774l1e,Durant Misses Game Winner By Faction of a Second - TNT,8130,https://streamable.com/g2xdi,1508304562,1122,2017-42
77els5,"Paul Pierce on Embiid: ""I’m tired of getting a little taste of him. I want the whole load.""",7721,https://streamable.com/p605e,1508422144,767,2017-42
77jj56,Patrick Beverley going at Lonzo Ball and welcoming him to the league,6800,https://streamable.com/qsv9k,1508469697,912,2017-42
77qgzg,Lebron James blocks Giannis then drills a wide open 3 on the next play,5950,https://streamable.com/vz14d,1508548094,544,2017-42
77qt68,Kyrie’s response to fan asking him “Where’s Lebron?”,5806,https://streamable.com/8so7i,1508552090,687,2017-42
77aomj,Boston Celtics open home opener with a message from Gordon Hayward,4701,https://streamable.com/4katd,1508370283,284,2017-42
777kle,Kevin Love's absolutely ridiculous pass last night,4339,https://streamable.com/b350f,1508342875,296,2017-42
77b5vv,Tony Allen gets a standing ovation in Memphis when he enters the game,3203,https://streamable.com/2gzbk,1508375262,175,2017-42
77am7w,[Highlight] John Wall bodies TJ McConnell and dunks it!,3143,https://streamable.com/bwz0i,1508369576,360,2017-42
77r363,Dwight Howard receives his 5th foul and shows his appreciation,3099,https://streamable.com/y53ar,1508555674,246,2017-42
77qglc,Kyle Korver goes on a 9-0 run,3091,https://streamable.com/4jw7l,1508547972,272,2017-42
77jk8a,Patrick Beverley pretty move and NASTY block,2975,https://streamable.com/xkrfx,1508470071,167,2017-42
77liaw,[Inside The NBA] Chuck gets roasted as he has a weird stutter and a lisp at the same time,2951,https://streamable.com/wclzp,1508499409,173,2017-42
77ikxl,KP send Melo back to NYC with the block,2949,https://streamable.com/sclco,1508459048,161,2017-42
776l40,"After putting up 29 Pts, 16 Rebs, and 9 Asts in the season opener, LeBron's reaction: ""I'm outta shape.""",2866,https://streamable.com/kufcl,1508333925,333,2017-42
77ijky,Enes Kanter gets a huge ovation on his return to OKC,2714,https://streamable.com/62bbf,1508458664,188,2017-42
773099,[NBAonTNT] Celtics huddle together after gruesome Hayward injury.,2592,https://streamable.com/qrhhy,1508287211,312,2017-42
77r9s5,"Lakers Corey Brewer calling for the ball for a good 15 seconds, but to no avail",2510,https://streamable.com/n3v7g,1508558119,228,2017-42
773ol1,Kyrie Irving misses a potential game-winning three against LeBron James - TNT,2360,https://streamable.com/ydfum,1508294034,376,2017-42
77jhu1,Blake Griffin posterizes Julius Randle,2241,https://streamable.com/tij8q,1508469289,230,2017-42
77t7j7,De'Aaron Fox with Kameha shot,2215,https://streamable.com/bc9m8,1508590707,394,2017-42
77qv32,Demarcus Cousins gets under Green's skin resulting in a technical on Draymond,2159,https://streamable.com/3t72x,1508552758,497,2017-42
7740gj,James Harden step-back three on Steph Curry to end the first quarter - TNT,2114,https://streamable.com/ku506,1508297587,219,2017-42
77qxu8,KD gets 2 blocks and the rebound wearing one shoe,2008,https://streamable.com/vhrqc,1508553724,150,2017-42
77jneg,"Patrick ""1st Team All-Defense"" Beverley steals it from Lonzo for the easy basket",1983,https://streamable.com/qrhpd,1508471176,207,2017-42
772x08,[Highlight] Derrick Rose crosses up Kyrie and finishes at the rim,1972,https://streamable.com/n8sgq,1508286337,189,2017-42
7776yj,"LeBron on Kyrie being booed: ""That was nothing. I've experienced boos before. That was like a pat on the back. That was nothing.""",1819,https://streamable.com/b9i54,1508339600,265,2017-42
773c2r,LeBron spin and two-hand dunk,1815,https://streamable.com/7f8uk,1508290420,110,2017-42
77bb57,Giannis dunks on Baynes again. This time with the lob,1815,https://streamable.com/j4zwy,1508376841,179,2017-42
77bnzx,Dejounte Murray earning some brownie points with Pop during a Spurs huddle,1793,https://streamable.com/175cn,1508380742,253,2017-42
77efh0,Terrence Ross No Look Pass To Vucci Mane,1671,https://gfycat.com/bewitcheddefinitiveharrierhawk,1508420371,136,2017-42
77b236,Dennis Smith Jr. soars high and gets his first NBA basket off the alley-oop!,1650,https://streamable.com/onsyi,1508374132,119,2017-42
77oq3e,[Video] Kawhi Leonard climbing these stairs quite gingerly. Looks like he may be out longer than expected...,1595,https://streamable.com/iqrq4,1508530336,347,2017-42
77j0fz,"""Aww shit getta fuck outta here""",1554,https://streamable.com/qxmmy,1508463796,112,2017-42
77mhxg,"Last night, Michael Beasley hurt himself and could only hop on one leg before he came out shortly after. That didn’t stop the GOAT from calling for the ball though.",1542,https://streamable.com/oi8a5,1508510379,108,2017-42
77awmq,Aaron Gordon pulling a TMac!,1506,https://streamable.com/dwbzi,1508372543,94,2017-42
77qp7g,D'Angelo Russell breaking ankles,1492,https://streamable.com/cfqvl,1508550726,229,2017-42
77bgm7,Hassan Whiteside drops his first career three-pointer,1479,https://streamable.com/22nrb,1508378472,148,2017-42
773nsd,Wade tosses the familiar alley oop to LeBron,1386,https://streamable.com/ljvfw,1508293799,87,2017-42
77iqle,"Kevin Harlan exclaims, ""Yikes"" as Felton's lob to Grant fails - TNT",1321,https://streamable.com/9730r,1508460782,96,2017-42
77r5ls,"DRose comments on the personal foul by Monroe that led to his ankle sprain: ""I think I'm the only person in the league that isn't getting that call for a flagrant. For sure I'm the only player. Go back and look at the history, it's there.""",1321,https://streamable.com/2u6xl,1508556569,306,2017-42
77q1s9,Kyrie Irving gets booed in Philly,1309,https://streamable.com/ayv8g,1508543262,287,2017-42
777nsv,Baynes hits Crowder with unseen 5th appendage,1302,https://streamable.com/1zql1,1508343571,126,2017-42
777lya,Kyrie hugging LeBron's children after the game last night,1231,https://streamable.com/jjpd1,1508343167,220,2017-42
77b91z,Oubre's MONSTER putback slam!,1151,https://streamable.com/qu0ve,1508376197,60,2017-42
77qfcn,CJ Mccollum catches fire and scores 12 straight for the Blazers from all over the floor,1143,https://streamable.com/tx6i9,1508547585,128,2017-42
77iw93,"Paul George with a steal, and a dunk to beat the buzzer at the half - TNT",1141,https://streamable.com/1dchs,1508462497,82,2017-42
772tuw,Jaylen Brown SOARS and throws it down,1109,https://streamable.com/jg4od,1508285522,63,2017-42
77354w,Lebron with an incredible pass to Crowder,1058,https://streamable.com/xylap,1508288560,149,2017-42
77imbi,OG Anunoby's first NBA basket is a spin move and dunk,1025,https://streamable.com/gmy94,1508459473,107,2017-42
773zaa,Eric Gordon drives and posterizes Jordan Bell! - TNT,1015,https://streamable.com/6o65w,1508297217,97,2017-42
77bmal,A nice looking family taking in the Spurs game,1012,https://streamable.com/k0y1h,1508380210,90,2017-42
,,,,,,2017-42
