id,title,score,url,created_utc,num_comments,views
7e1eai,Marc Gasol t'd up for kicking Capela's shoe out of bounds (ft. Lil Jon),1801,https://streamable.com/y6eia,1511107211,294,70359
77bnzx,Dejounte Murray earning some brownie points with Pop during a Spurs huddle,1793,https://streamable.com/175cn,1508380742,253,66728
7dbv9c,Siakam's funny face after shove from AD,1782,https://streamable.com/cg040,1510832754,106,76838
7dpfyj,Kevin Love literally doesn’t even jump for the opening tip against Deandre Jordan,1777,https://gfycat.com/TepidBlaringDuck,1510966597,250,277347
79lylg,"The Cavs bench clears out after loss without shaking hands, again",1771,https://streamable.com/pzm87,1509344126,491,44473
7cq1rz,"KD didn't like when a reporter said Draymond ""hollered"" at him in Sacramento last year. Reporter: ""What word would you use?"" Durant: ""Well, we motherfucked each other.""",1754,https://streamable.com/8d1o6,1510605309,460,25128
7cvzfk,"Iman Shumpert keeping it real after his 0 Pts, 0 Asts, 5 TOs, 4 Rebs, 3 fouls in 20 minutes performance against the Knicks",1743,https://streamable.com/pvk57,1510670262,225,57434
7bkoph,Nikolai Jokic with the on-brand response to “MVP” chants after his career night.,1718,https://streamable.com/chguh,1510139747,140,55627
7bi9oe,Wade with a huge block on Antetokounmpo,1713,https://streamable.com/aixjj,1510107737,189,68867
78s18q,LeBron doing LeBron things,1682,https://streamable.com/29x26,1508977970,200,104396
77efh0,Terrence Ross No Look Pass To Vucci Mane,1676,https://gfycat.com/bewitcheddefinitiveharrierhawk,1508420371,134,91648
7cjh23,Thaddeus Young rips his jersey in frustration,1668,https://streamable.com/31tkg,1510533736,239,56165
7btyef,Dirk Nowitzki's Academy for Awkward Basketball,1667,https://streamable.com/6vgdb,1510240980,88,23993
798ck8,Kevon Looney puts Kelly Oubre Jr on a poster! - NBATV,1665,https://streamable.com/uyomh,1509166393,157,60977
7dx4gq,Dario Saric rejects Kevin Durant at the rim,1656,https://streamable.com/xgg21,1511052425,90,97334
77b236,Dennis Smith Jr. soars high and gets his first NBA basket off the alley-oop!,1650,https://streamable.com/onsyi,1508374132,119,51454
7937tq,Impressive lock down on Giannis by a rookie,1650,https://streamable.com/tppzq,1509110781,221,73099
7e5xfq,Mudiay stops a 5-1 Lakers fastbreak - SSN,1650,https://streamable.com/ppe7l,1511148227,99,68266
7cthwq,Ben Simmons nasty reverse oop,1641,https://streamable.com/mgrzt,1510637503,166,58427
79z6wv,Kevin Love trimmed his beard &amp; he now looks 10 years younger.,1636,https://streamable.com/89cq7,1509486881,175,48750
79tk2u,Jordan Bell GETS UP for the impressive putback slam,1631,https://streamable.com/9gfnb,1509425098,227,52124
7dhb6u,Jaylen Brown gets a steal off Curry and throws it down! - TNT,1622,https://streamable.com/ansx8,1510882321,139,29453
785b82,Anthony Davis blocks Lonzo Ball,1607,https://streamable.com/zot3g,1508731735,152,80008
77oq3e,[Video] Kawhi Leonard climbing these stairs quite gingerly. Looks like he may be out longer than expected...,1595,https://streamable.com/iqrq4,1508530336,347,77000
7cd5us,Giannis with putback dunk on Lonzo Ball,1595,https://streamable.com/lzz6g,1510458207,92,96549
7c6f4s,Neon Dion completely takes over and buries the Jazz,1581,https://streamable.com/ns2pa,1510374689,157,46255
7cd081,Stephen Curry nutmegs Ben Simmons but Draymond Green doesn't finish the play,1574,https://streamable.com/uyfcr,1510456273,83,70307
7ccnu3,"Dejounte runs into Pop on the sideline, Manu can't contain his enjoyment",1567,https://streamable.com/vbq6d,1510452157,68,88242
7anrfm,Doug McDermott massive reverse poster and staredown on Josh Jackson,1566,https://streamable.com/pi0mb,1509757828,174,68444
77xq40,Curry tossing his mouthpiece (h/t:@vineydelnegro),1561,https://streamable.com/vxko1,1508639548,330,186797
790fsh,Kyrie Irving freezes Giannis with the hesitation and floats the lay up just out of his reach,1561,https://streamable.com/76imc,1509071082,138,69769
77qp7g,D'Angelo Russell breaking ankles,1560,https://streamable.com/cfqvl,1508550726,237,63633
77j0fz,"""Aww shit getta fuck outta here""",1554,https://streamable.com/qxmmy,1508463796,112,96419
78m6tc,Look at how effortlessly LeBron makes this cross court pass to Crowder,1554,https://streamable.com/d37mt,1508917232,322,80606
7da13v,Kuzma tries throwing it down on Embiid! - ESPN,1548,https://streamable.com/k816j,1510806991,279,86535
78k2zp,Klay Thompson's pregame ritual: Reading the newspaper.,1546,https://streamable.com/4eapq,1508890973,179,29318
77mhxg,"Last night, Michael Beasley hurt himself and could only hop on one leg before he came out shortly after. That didn’t stop the GOAT from calling for the ball though.",1542,https://streamable.com/oi8a5,1508510379,108,71860
7cnrtj,"Dennis Rodman on if he would ever get into broadcasting: ""No. Hell no. No, No, No. No. NoNoNoNoNoNoNo. No... I love the game. I don't love the game that f***ing much.""",1541,https://streamable.com/02mgx,1510586739,132,8387
7b9vuw,Kyrie dances through the Atlanta defense &amp; finishes high off the glass!,1524,https://streamable.com/i66zy,1510018622,127,48692
77awmq,Aaron Gordon pulling a TMac!,1506,https://streamable.com/dwbzi,1508372543,94,58017
7bydg4,DeMarcus Cousins breaks Valanciunas's ankles and drills the 3,1504,https://streamable.com/f7aw9,1510282133,123,53036
7anjc4,Steven Adams arrives to the game wearing a Rick &amp; Morty Christmas sweater,1500,https://streamable.com/mk2jt,1509755313,208,31549
78gp4y,"[Amin Elhassan] ""This is a part of a continuing pattern of the best players in Phoenix saying I don't want to be here anymore, Goran Dragic, the Morris twins, [and now Bledsoe]. At some point, if you're a Suns fan, you got to stop and say why does everyone not want to be here anymore?""",1492,https://streamable.com/miqk4,1508860872,449,5859
78d1dj,"LaMarcus Aldridge posts up Ibaka, gets the and-1 bucket to foul him out of the game",1491,https://streamable.com/g8629,1508814282,119,41075
79stgv,Ben Simmons goes coast-to-coast for the slam late in the 4th!,1490,https://streamable.com/ikq78,1509417070,259,59966
7e5ziy,Nikola Jokic and Mike Malone both get ejected - SSN,1486,https://streamable.com/96ofn,1511148834,446,38213
7daefg,Embiid goes over 40 points with the nice moves on Julius Randle,1483,https://streamable.com/nvs9b,1510811333,219,39974
7djkzg,Kevin Harlan tells a story about why he tries to sound excited even while commentating blowout games,1482,https://streamable.com/zvwen,1510908723,218,27099
77bgm7,Hassan Whiteside drops his first career three-pointer,1479,https://streamable.com/22nrb,1508378472,148,57178
7e46dm,DeMar DeRozan throws it down and closes the game,1477,https://streamable.com/rejft,1511131484,135,42448
7bablw,Jayson Tatum buries the clutch 3 pointer vs the Hawks,1475,https://streamable.com/jc7im,1510023137,255,45101
78k0vt,Jayson Tatum taking over the game on both ends of the floor,1474,https://streamable.com/6hztl,1508890419,359,44442
784933,Melo grabs a signature rebound,1473,https://streamable.com/m4cfg,1508719570,172,92198
7baecp,This kid at the Celtics/Hawks game,1466,https://streamable.com/prpj8,1510023907,106,94319
7ci7dn,Jayson Tatum dazzles with the spin move and hits the lay-up to beat the shot clock,1451,https://streamable.com/yt8da,1510521569,185,40184
79nsp2,Lauri Markkanen off the glass between the legs dunk pregame,1448,https://streamable.com/yg9pw,1509371145,168,65173
7d6y2x,[ESPN] 30 for 30: The Space Jam Game,1447,https://streamable.com/76f1,1510777648,88,186873
7dxl82,Jim and Bob don’t get the joke,1447,https://streamable.com/ss0nd,1511057370,146,50002
7d96qi,Rondo initiates a beautiful stretch of ball movement,1446,https://streamable.com/3ltww,1510798040,107,49123
78juh0,Jayson Tatum flies in for the put back slam,1439,https://streamable.com/0c98t,1508888650,153,56639
79kmpp,Derrick Rose gives the ball straight to KP on the inbound,1436,https://streamable.com/r1n99,1509326799,109,96912
7an96m,Derrick Rose with an acrobatic layup!,1424,https://streamable.com/4am9s,1509752306,164,50450
7984b1,"Fan shouts ""Fuck you mother fucker!"" at Bradley Beal",1422,https://streamable.com/m2a2d,1509163021,308,62496
7983rl,John Wall tells Steph Curry to stop flopping,1421,https://streamable.com/7cwtx,1509162796,512,111394
7br0u0,Nick Young with the creative pass-out-of-shot to Klay Thompson for a 3,1416,https://streamable.com/ibqwn,1510201466,125,71366
7a7v2g,Kris Dunn poster on Kelly Olynyk,1413,https://streamable.com/3p8c4,1509582104,169,37749
77r5ls,"DRose comments on the personal foul by Monroe that led to his ankle sprain: ""I think I'm the only person in the league that isn't getting that call for a flagrant. For sure I'm the only player. Go back and look at the history, it's there.""",1405,https://streamable.com/2u6xl,1508556569,327,14152
7av3h4,Warriors pass the ball 7 times leading to a Curry 3!,1404,https://streamable.com/23223,1509849277,112,54600
7cg41t,"Enes Kanter went from ""unplayable"" in OKC to now an adequate overall defender as a KNicks",1404,https://streamable.com/iyejc,1510502026,215,23213
7aftl0,Zaza Pachulia getting booed in San Antonio,1392,https://streamable.com/c5uao,1509668317,579,37413
7bqdv6,{HIGHLIGHT} Reggie Jackson with the between the legs pass to Andre Drummond for the slam!,1391,https://streamable.com/hfqro,1510194367,98,19854
78cy0p,LaMarcus Aldridge and Serge Ibaka scuffle after Lowry gets elbowed - NBATV,1390,https://streamable.com/wietc,1508813236,347,67063
773nsd,Wade tosses the familiar alley oop to LeBron,1386,https://streamable.com/ljvfw,1508293799,87,43118
77xuxn,Giannis forces the turnover and then gets the go ahead dunk on the run out with 11 seconds left,1356,https://streamable.com/ynxoz,1508641230,103,40264
7bifm1,Porzingis sprays down Dwight in the clutch,1350,https://streamable.com/kpdaf,1510109424,147,92348
7bpyge,[Wojnarowski] Julius Randle is very unlikely to continue with the Lakers long term,1338,https://streamable.com/jlmpe,1510189878,544,30293
7896de,"Dwyane Wade on asking to come off the bench: ""Looks like I'll probably be better with this team in that lineup so why wait?""",1334,https://streamable.com/mcw7p,1508778478,248,7520
7b7akf,"Kevin Love on leaving the game: ""Lue had drawn up a play, I kinda wheeled my way out of the huddle, he came to talk to me and I just booked it right to the back... just wasn't feeling right. Stomach, shortness of breath. They got me out of there and sent me to the hospital for a routine check.""",1334,https://streamable.com/miwfg,1509994897,162,5896
77iqle,"Kevin Harlan exclaims, ""Yikes"" as Felton's lob to Grant fails - TNT",1321,https://streamable.com/9730r,1508460782,96,37745
7bltek,"Kevin Love on playing well after his hospital visit: ""Whatever they gave me I might go back. Might check myself in tonight.""",1319,https://streamable.com/l61x7,1510153115,109,7827
7cs9ni,Kelly Oubre shakes Buddy Hield and tomahawks,1317,https://streamable.com/146xr,1510624618,106,40782
7cjflo,"James ""Stepdaddy"" Harden puts the sauce on Turner",1314,https://streamable.com/pl05c,1510533319,241,47327
7c5bh4,Baynes gets bodied by Dwight Howard,1311,https://streamable.com/nfeq8,1510361482,301,74019
77q1s9,Kyrie Irving gets booed in Philly,1309,https://streamable.com/ayv8g,1508543262,287,39741
7dq8ef,LeBron James with a fadeaway dagger against the Clippers! - FS,1309,https://streamable.com/rztbq,1510974740,220,57904
7d4w20,"New Footlocker Commercial feat. ""Kyrie"", ""Melo"", and ""Anthony Davis""",1307,https://streamable.com/ueda0,1510760404,125,37388
7d0b8p,Jaylen Brown on fans who think they can beat NBA players 1-on-1,1304,https://streamable.com/9axed,1510706828,376,56768
777nsv,Baynes hits Crowder with unseen 5th appendage,1302,https://streamable.com/1zql1,1508343571,126,37960
7da5ie,Embiid with a beautiful euro-step around Brook Lopez,1298,https://streamable.com/0j11h,1510808396,110,49060
7b96d2,[Kevin O'Connor] Kyrie Irving leads the NBA in steals but his defensive impact and commitment on that end show up most on film.,1293,https://streamable.com/x4ld0,1510011464,221,28317
79l2ic,Avery Bradley gets the clutch steal and dagger lay up against the Warriors,1281,https://streamable.com/gem94,1509331938,179,31850
7cgdbs,Lonzo with the pullup j from deep,1268,https://streamable.com/e4qf5,1510504609,215,61327
7cjee8,Angry Boston fans near the end of the game,1257,https://streamable.com/8diwd,1510532960,342,84192
7b1dw2,kyle lowry gets ejected,1255,https://streamable.com/uh9v1,1509926371,325,57479
7co059,"LeBron on the Knicks having extra motivation tonight: ""I don't care. What's gonna be worse here than what I've felt in my career. I'm just stating the facts. Have y'all seen Dennis Smith play? Y'all be tripping.""",1243,https://streamable.com/ka01o,1510588703,439,11421
79spju,Kristaps Porzingis with an important message to his fans,1241,https://streamable.com/g9nv6,1509416058,96,131174
7b9xpc,Kyrie Irving Ridiculous Handles Leads to a Smooth Fadeaway Jumper,1239,https://streamable.com/p1tty,1510019156,172,45765
777lya,Kyrie hugging LeBron's children after the game last night,1231,https://streamable.com/jjpd1,1508343167,220,55180
7b5p9d,Westbrook with the strong defensive effort on Lillard.,1224,https://streamable.com/ypqxn,1509980964,358,62166
7ctemi,"Simmons dunks it on Lou Williams again, called for a tech",1211,https://streamable.com/t7lrm,1510636485,142,52127
7a120e,Lonzo Ball nice touch pass to Lopez,1210,https://streamable.com/kww7z,1509506116,148,48539
77xv8z,Giannis with the clutch block to preserve the Bucs' lead!,1176,https://streamable.com/wj2ca,1508641337,137,31593
77qfcn,CJ Mccollum catches fire and scores 12 straight for the Blazers from all over the floor,1165,https://streamable.com/tx6i9,1508547585,135,25436
7dqc72,Carmelo nearly ties it at the end of regulation but his foot is on the line,1165,https://streamable.com/moyvz,1510975892,352,50062
7bn73h,"Lonzo Ball on the news on his brother's arrest in China: ""I know my people over there are handling it, so I'm over here just taking care of business.""",1161,https://streamable.com/n3lj2,1510165056,317,8232
7bpq9g,Jump ball between New York and the Knicks,1158,https://streamable.com/nhtdw,1510187652,137,70866
784al7,Wiggins glides for the slam,1153,https://streamable.com/v88qf,1508720011,101,34137
7aysjj,The Boston Celtics tell each-other bad jokes again.,1152,https://streamable.com/7d7p1,1509901907,168,25097
77b91z,Oubre's MONSTER putback slam!,1151,https://streamable.com/qu0ve,1508376197,60,34272
7c6rm9,"Jerami Grant says ""Gimme dat shit"" as he blocks the living shit out of Blake Griffin",1146,https://streamable.com/uqozd,1510379468,94,84412
77iw93,"Paul George with a steal, and a dunk to beat the buzzer at the half - TNT",1141,https://streamable.com/1dchs,1508462497,82,33446
790fya,Lauri Markkanen hits the dagger three to put the Bulls up 4,1137,https://streamable.com/qbmly,1509071128,214,54508
7bqgfb,Steve Kerr hilariously clips his nails during a press conference waiting for reporters to finish tweeting his quotes,1137,https://streamable.com/5tny8,1510195111,165,29407
7dpnem,Kyle Lowry lobs it up to DeMar DeRozan for the slam! - SN,1135,https://streamable.com/7md1v,1510968659,88,24687
78rpee,TJ McConnell to Joel Embiid for the slam! - CSN,1128,https://streamable.com/xux4h,1508974662,86,35905
79xuhy,Terry Rozier’s Stepback Last Night Looked Oddly Familiar...,1124,https://streamable.com/s72jo,1509475325,153,53543
7cs33c,Doug McDermott putback slam.,1123,https://streamable.com/0tv15,1510622864,102,37156
772tuw,Jaylen Brown SOARS and throws it down,1109,https://streamable.com/jg4od,1508285522,63,27487
77y0va,Joe Ingles is becoming one of the premier trash talkers of the league,1104,https://streamable.com/tttwu,1508643298,138,54557
7dq6m2,Kyle and Demar postgame bromance.,1102,https://streamable.com/58dfq,1510974195,110,32400
79waej,"Draymond Green: ""I'm not Steph. I'm not Klay. I'm not KD. So I'm not about to sit there and rely on the three, and I think I've been relying on it too much.""",1097,https://streamable.com/xugpb,1509461988,161,6314
7cbcym,[Pick] Boris Diaw with the game winner from half-court in the LNB Pro A,1094,https://streamable.com/5cqpp,1510437916,109,31409
7av3i6,Curry with the steal and 4 point play!,1079,https://streamable.com/jl6zj,1509849288,122,67781
7cszu6,DeAndre Jordan gives Blake Griffin some words of encouragement,1079,https://streamable.com/dth7o,1510631986,108,45292
7diu3p,James Harden calls CP3 a little midget,1076,https://streamable.com/n4quf,1510898914,150,45029
7bqxw1,Lonzo with the chase down block on Kyrie,1068,https://streamable.com/s0w95,1510200497,224,120937
7ditlh,Zhou Qi sends Alex Len's shot back to Ukraine,1060,https://streamable.com/pm8ly,1510898716,184,61147
77354w,Lebron with an incredible pass to Crowder,1058,https://streamable.com/xylap,1508288560,149,35063
7d98b3,Weirdass Hornets mascot dances with a referee and then strips down to its bee underpants,1052,https://gfycat.com/ThirdSnoopyCurassow,1510798474,103,51905
7980o3,Warriors putting in A LOT of work for a basket,1042,https://streamable.com/ytzyf,1509161581,38,42211
7dxd1b,Ben Simmons Spin-o-rama,1040,https://streamable.com/kudaq,1511054950,86,43288
79tgx5,Curry with a step-back three over Rivers to end the third quarter NBATV,1039,https://streamable.com/z9u6a,1509423971,152,32276
78tfkq,[Highlight] KD's pullup 3 to tie the game late because it needed to be posted.,1038,https://streamable.com/qkv32,1508994181,155,56373
7dhfdn,Marcus Smart misses the 3 then gets dunked on by Andre Iguodala,1036,https://streamable.com/u1271,1510883592,151,22623
7dptx1,Lowry's reaction to questionable call on Porzingis - SN,1028,https://streamable.com/0u5wt,1510970564,93,34699
77imbi,OG Anunoby's first NBA basket is a spin move and dunk,1025,https://streamable.com/gmy94,1508459473,107,24915
7b0xh3,Cavaliers' last possession vs the Hawks,1021,https://streamable.com/6i7y7,1509921798,164,67015
773zaa,Eric Gordon drives and posterizes Jordan Bell! - TNT,1015,https://streamable.com/6o65w,1508297217,97,23356
7ahh9x,Steve Kerr offers some words of encouragement to rookie Jordan Bell (x-post r/warriors),1013,https://streamable.com/bltel,1509687668,99,53207
7bhm2u,LeBron shakes Giannis on the fadeaway J - NBATV,1013,https://streamable.com/1soz6,1510101349,151,32564
77bmal,A nice looking family taking in the Spurs game,1012,https://streamable.com/k0y1h,1508380210,90,54180
78034h,Grizzlies DJ channels Tommy Wiseau after Gasol's basket,1010,https://streamable.com/usdoz,1508677610,59,26209
7cdb2e,[NBCSWarriors] Draymond &amp; KD showing love to Embiid after the game.,1006,https://streamable.com/uhquk,1510459940,144,58271
7drigi,Security guard forgot he was at work,1006,https://streamable.com/7tily,1510990982,93,70639
79ehqq,1st Team All Defense Patrick Beverley flies in for the block after Avery Bradley misses the easy lay up,1003,https://streamable.com/hh0w3,1509248470,91,28265
