id,title,score,url,created_utc,num_comments,views
772v5s,Gordon Hayward Breaks His Leg *GRAPHIC*,34194,https://streamable.com/j4yf3,1508285853,6439,2209085
77ch9a,Every Phoenix Suns player starts running at the exact same moment,31920,https://gfycat.com/PrestigiousWeeGreyhounddog,1508390979,621,3867708
784gt7,Carmelo puts OKC up by 1 before Wiggins wins it at the buzzer,27816,https://streamable.com/3t2tl,1508721935,1987,514785
7b1135,Tyronn Lue abruptly stops barking out orders after a weird ring falls out of his mouth,25092,https://gfycat.com/gifs/detail/DistinctAbsoluteEeve,1509922808,1479,0
7c6qk8,Lonzo with the pullup j from deep,18453,https://gfycat.com/gifs/detail/IllfatedPlainDwarfmongoose,1510379047,1337,0
78cysm,Jordan Bell SELF ALLEY OOP And-1,17274,https://streamable.com/rvev1,1508813464,1684,589661
7ahc4y,Damian Lillard game winner,13943,https://streamable.com/mfea8,1509685614,1239,246666
78hfst,"LeBron defends Jordan Bell's self alley-oop: ""We’re all men. Stop me from dunking. We’re not trying to hurt nobody..You play the game until it's over. Yeah he threw it off the glass, dunked it, so what?""",13553,https://streamable.com/zpyvy,1508867227,1181,92064
79ik7k,Anthony Davis and DeMarcus Cousins visit a haunted house,12872,https://streamable.com/0451j,1509305548,473,200854
77amvr,Markelle Fultz first 2 free-throws of his career,12210,https://streamable.com/gjj42,1508369772,1572,358336
7cryfk,Lebron and Enes Kanter scuffle.,11942,https://streamable.com/65b0w,1510621638,2690,475236
78sas3,Eric Gordon beats the 6ers at the buzzer,11534,https://streamable.com/flyqg,1508980843,980,323753
79e2gl,"""Wessell Russbrook""",11497,https://streamable.com/z4dpa,1509242601,443,295502
7cslyn,LeFuck You 3,11097,https://streamable.com/nahp8,1510628014,1139,325415
79127z,Blake Griffin wins the game with the buzzer beater 3 pointer,10655,https://streamable.com/zx0bi,1509078928,1273,359925
77n82a,Rookie Jonathon Isaac realizes he forgot his jersey in his 1st NBA Game.,9490,https://streamable.com/dilzk,1508516930,333,251611
7bgdid,Jimmy Butler fears for his life as his canoe begins to capsize,9261,https://streamable.com/nj85v,1510089891,464,351076
7b9mgq,[Dave McMenamin]: Lebron came out of the shower with a towel on his waist and went straight to Ty Lue's office.,8850,https://streamable.com/fz17z,1510015931,917,138652
7980z9,Draymond Green / Bradley Beal scuffle,8832,https://streamable.com/corf5,1509161698,2316,417786
78kxkz,Blake Griffin ends Rudy Gobert's life with the nasty poster dunk,8802,https://streamable.com/uofu3,1508900100,819,376142
79jq6f,Steph came to the arena in costume 😂😂,8685,https://streamable.com/uczx3,1509317057,389,261750
7dd5rn,21 Savage with probably the worst halftime performance in NBA history @ Hawks vs. Kings,8436,https://streamable.com/jj6bb,1510846690,1447,143585
774l1e,Durant Misses Game Winner By Faction of a Second - TNT,8130,https://streamable.com/g2xdi,1508304562,1122,321913
77els5,"Paul Pierce on Embiid: ""I’m tired of getting a little taste of him. I want the whole load.""",7721,https://streamable.com/p605e,1508422144,767,109901
7bq1se,Kyrie Irving somehow gets through the Lakers defense with some fancy ball-handling and lays it in - ESPN,7684,https://streamable.com/u30kq,1510190838,608,256098
7da6le,Lonzo bricks two threes in rapid succession,7443,https://streamable.com/youyd,1510808728,1532,275820
7a04y4,Westbrook to Adams - NBATV,7400,https://streamable.com/qkryq,1509496059,454,231677
7a8blu,Ben Simmons NASTY DUNK!,7315,https://streamable.com/ba6j7,1509586713,626,288579
7di4wg,"""They're not going to beat the Golden State Warriors tonight and they're not going to hold the Golden State Warriors to 94 points. I promise you that."" - Charles Barkley",6817,https://streamable.com/ys03p,1510890849,645,113861
77jj56,Patrick Beverley going at Lonzo Ball and welcoming him to the league,6800,https://streamable.com/qsv9k,1508469697,912,319156
7bqnot,Cameraman with the inhuman reactions,6749,https://streamable.com/yux5j,1510197323,553,395460
7aolru,"Brian Scalabrine: ""Paul George only makes those in the Gatorade commercials.""",6363,https://streamable.com/zm9qw,1509768343,346,155306
77qt68,Kyrie’s response to fan asking him “Where’s Lebron?”,6105,https://streamable.com/8so7i,1508552090,723,298688
77qgzg,Lebron James blocks Giannis then drills a wide open 3 on the next play,6074,https://streamable.com/vz14d,1508548094,557,221291
78rxij,Trevor Booker sneaks into the Cavs huddle,6060,https://streamable.com/cmnwl,1508976940,411,330687
78cu9g,Ref gets in the way of Harden's pass,5864,https://streamable.com/emmfh,1508812066,1083,210244
7989nb,Steph gets John Wall to take the bait and makes him pay!,5796,https://streamable.com/vewnp,1509165140,412,257696
7c442v,Steph Curry with the long distance goal shot from his foot (h/t:@letsgowarriors),5498,https://streamable.com/r6tqf,1510349113,397,199544
7d0d4o,Jaylen Brown throws down a hard windmill.,5180,https://streamable.com/jq4j1,1510707333,299,229968
7aod4c,LeBron with a pinpoint behind the back pass to the ref after a foul.,5017,https://streamable.com/bxmhj,1509765156,271,244352
7anyyt,Porzingis with a spectacular block on one end and a spectacular dunk on the other end!,5010,https://streamable.com/wvsir,1509760256,363,171968
7c60qj,Bledsoe to Giannis fastbreak oop,4954,https://streamable.com/840gj,1510369556,328,162599
7bhv7g,Cody Zeller gets blocked 4 times in a row,4763,https://streamable.com/sz1jz,1510103817,342,160587
790546,Klay Thompson attempts to start a race.,4706,https://streamable.com/7sryj,1509067696,359,141909
77aomj,Boston Celtics open home opener with a message from Gordon Hayward,4701,https://streamable.com/4katd,1508370283,284,57154
7ag2hp,"Steve Kerr: “F**k you, motherf**ker”",4658,https://streamable.com/sys8c,1509670874,308,180839
79dfdg,Beautiful ball movement by the Pelicans,4652,https://streamable.com/xt67c,1509234440,265,118696
7ao7ux,Manu pulls out a ferocious dunk at 40 years young,4652,https://streamable.com/xt0dz,1509763289,308,126735
7dqf6n,"Popovich to the Refs: ""All 3 of you: 1, 2, 3, you're all fucking blind!""",4651,https://streamable.com/nbk0g,1510976819,365,102420
7b2n81,This was a flagrant 2 on Carmelo Anthony...,4622,https://streamable.com/np0n7,1509939838,1758,168429
79ea05,Donovan Mitchell flies for the unbelievable putback slam,4564,https://streamable.com/3dld7,1509245411,302,143689
7cs5l5,Lebron just fucking watches as Ntilikina dribbles down the lane for a layup,4548,https://gfycat.com/BlackandwhiteFailingGoldeneye,1510623519,677,451153
7baqo5,"Curry hits a crazy teardrop floater during pregame, KD does a ritualistic dance",4432,https://streamable.com/soh5n,1510027656,404,166582
79acde,Reporter nervously forgets question while talking to KD.,4378,https://streamable.com/il8zc,1509200519,302,112307
777kle,Kevin Love's absolutely ridiculous pass last night,4339,https://streamable.com/b350f,1508342875,296,130123
7dxenr,"After bricking 3s after 3s, a Philly fan channels his inner Covington and drills the half-court shot to win a Chick-Fil-A biscuit for the whole crow",4298,https://streamable.com/g5oay,1511055426,378,60161
7anmd5,Ben Simmons Jersey Rip,4235,https://streamable.com/wyhlw,1509756276,483,259717
78tedl,Curry channeling China Klay after the whistle,4125,https://streamable.com/cecp7,1508993722,216,211788
77x3vz,James Johnson dunks Victor Oladipo into oblivion,4062,https://streamable.com/q4luu,1508631929,255,140192
797ndr,Popovich mistakes Ross for Simmons and puts him in a headlock,4037,https://streamable.com/rvte9,1509156559,298,261018
77xh86,Marc Gasol nasty move on Klay Thompson followed by a 3,4034,https://streamable.com/hutup,1508636464,284,88690
7brofw,"Omri Casspi on MVP chant, “I went up to KD after the game in the locker room and I said KD you’re holding me back bro. They’re calling MVP for me.”",3986,https://streamable.com/lw261,1510209907,316,36267
7blrvt,"""I see you workin booooiiii""",3840,https://streamable.com/fnq5z,1510152698,275,159502
7buwom,"LeBron on how CP3 can help the Rockets: ""Nah. No. CP stinks. Tell him I said it.""",3681,https://streamable.com/g3xr5,1510249396,337,57593
7dy5qj,"WATCH: Kevin Durant ""we didn't want to lose to these guys, especially Joel, he would've went straight to twitter and talked shit""",3675,https://streamable.com/jpfsj,1511063601,374,28402
7bz6bm,De'Aaron Fox with the game winner against the 76ers,3592,https://streamable.com/my4t2,1510291896,453,81721
78l05b,Wade’s handshake with Lebron..and Kevin Love.,3577,https://streamable.com/nh6pc,1508900888,378,190472
78od5p,"LeBron James: ""Ever since I was a kid I learned every position on the floor. For some odd reason, I could learn every position on the floor all at one time. PG, SG, SF, PF and C and know all the plays what they're doing and what's the reads. I know every single play at every single position.""",3560,https://streamable.com/ygfrt,1508944900,848,14379
77t7j7,De'Aaron Fox with Kameha shot,3547,https://streamable.com/bc9m8,1508590707,523,147882
791qeo,"Chuck on Kyrie's comments on the gym floor of the Mecca: ""This is the same dude that says he believes in flat earth? ... And Ernie I got one worse than flat earth theory, this is the same dude that don't want to play with LeBron. His credibility is SHOT""",3540,https://streamable.com/n2vk6,1509088942,580,21997
78gmdr,"Draymond yells:""Who is this?"" as Mavs rookie Gian Clavell enters the game",3496,https://streamable.com/skmz7,1508860207,758,198803
7cd4ct,Shaun Livingston behind-the-back crossover to a behind-the-back dime to Klay Thompson for 3,3492,https://streamable.com/ztjvu,1510457718,230,86619
78hokz,Video of Kevin Durant watching Gordon Hayward's injury live,3455,https://streamable.com/5vh07,1508869283,641,145386
7ant4m,J. J. Redick circus 3 vs the Pacers,3451,https://streamable.com/9s7fn,1509758361,271,75710
7dhk4g,Kyrie Irving with the layup and...Marcus Smart disqualifies it,3448,https://streamable.com/dqyxi,1510884972,312,115149
7d4dx3,"Dwight Howard on facing the Cavs tonight: ""We can't let them win. This is our home. He calls himself the king, but the king has to face the Evil One tomorrow. And I'm the Evil One.""",3421,https://streamable.com/iqgic,1510755696,646,21356
77xb99,Markelle Fultz horrible free throw attempt,3419,https://streamable.com/olcno,1508634438,930,252039
7d7joj,"Malik Monk asked if its weird to be playing against LeBron: ""So weird. He was in his prime when I was [growing up] watching and he's still in his prime now, so its crazy.""",3408,https://streamable.com/gozm8,1510782722,208,14145
7d72lu,"Isaiah Thomas: ""When I got traded here, one of the first things I thought of was like damn I'm gonna have to get these handshakes down. I really wasn't worried about the on-court things, I'm like man these handshakes are very serious.""",3394,https://streamable.com/t2keb,1510778724,179,16058
7bnhag,Porzingis the flop artist,3355,https://streamable.com/1lrq8,1510167404,657,92518
77r363,Dwight Howard receives his 5th foul and shows his appreciation,3340,https://streamable.com/y53ar,1508555674,261,130693
7bq8x1,Smart rejects Ball at the rim - ESPN,3337,https://streamable.com/55i4h,1510192960,400,97218
79sm7n,Andrew Wiggins huge dunk in the clutch vs the Heat,3267,https://streamable.com/l64qv,1509415186,250,91611
7dq23m,LeBron puts Austin Rivers on skates,3264,https://streamable.com/crv1u,1510972977,197,132514
7c5u2n,Oladidpo 360 slam,3218,https://streamable.com/m743e,1510367301,219,100623
77b5vv,Tony Allen gets a standing ovation in Memphis when he enters the game,3203,https://streamable.com/2gzbk,1508375262,175,51269
78cu85,Chalmers trips Harden; Harden shoves Rio to the ground,3198,https://streamable.com/9muqz,1508812054,772,200664
77qglc,Kyle Korver goes on a 9-0 run,3178,https://streamable.com/4jw7l,1508547972,274,82296
78cdw5,"[SINow] Stephen Curry consoles Devin Harris' nephew, who lost his father in a car accident last week",3158,https://streamable.com/jobsk,1508807315,162,58862
77am7w,[Highlight] John Wall bodies TJ McConnell and dunks it!,3143,https://streamable.com/bwz0i,1508369576,360,88172
78zzr8,Irving gets free and floats it in with some wicked handle on Brogdon - TNT,3101,https://streamable.com/ej6cb,1509066005,309,98696
7dah4n,Joel Embiid with the legendary post-game interview feat. Kevin Hart and Ben Simmons,3066,https://streamable.com/1ftka,1510812234,335,83209
7d9qzz,Ben Simmons with the euro-step and slam past Ball - ESPN,3040,https://streamable.com/r1wr2,1510803959,249,88923
7b9wta,Al Horford is back with another flinch after the whistle,3039,https://streamable.com/ge0ug,1510018907,240,115420
77jk8a,Patrick Beverley pretty move and NASTY block,2975,https://streamable.com/xkrfx,1508470071,167,88697
77liaw,[Inside The NBA] Chuck gets roasted as he has a weird stutter and a lisp at the same time,2951,https://streamable.com/wclzp,1508499409,173,58035
77ikxl,KP send Melo back to NYC with the block,2949,https://streamable.com/sclco,1508459048,161,145048
79bfha,Gortat holds Klay for the last 1.1 seconds of the game,2944,https://streamable.com/g251g,1509212388,354,318861
7cck6l,The speed of Patty Mills.,2944,https://streamable.com/n2uv8,1510451002,225,143284
78d47a,"Dejounte Murray told Pop to Chill He got this, After LMA Scuffle With Ibaka",2925,https://streamable.com/urqsi,1508815215,532,150470
776l40,"After putting up 29 Pts, 16 Rebs, and 9 Asts in the season opener, LeBron's reaction: ""I'm outta shape.""",2866,https://streamable.com/kufcl,1508333925,333,11683
79zdwz,Lebron dancing in Pennywise costume,2863,https://streamable.com/dv263,1509488696,251,141977
78t513,John Wall explodes past Lonzo,2848,https://streamable.com/wn9qu,1508990350,331,130144
78jwmi,Jaylen Brown throws down the thunderous reverse dunk on the fast break,2810,https://streamable.com/84s8y,1508889249,280,84877
7bhm6g,Giannis gives Lebron a taste of his own medicine,2791,https://streamable.com/g9yp8,1510101373,292,121914
7bihce,Kristaps has a finely tuned internal clock,2756,https://streamable.com/vl27c,1510109910,270,90593
77r9s5,"Lakers Corey Brewer calling for the ball for a good 15 seconds, but to no avail",2750,https://streamable.com/n3v7g,1508558119,253,99437
7bn02d,Esteemed sharpshooter Andre Roberson splashes effortlessly from the logo,2721,https://streamable.com/704ht,1510163489,202,105265
77ijky,Enes Kanter gets a huge ovation on his return to OKC,2714,https://streamable.com/62bbf,1508458664,188,63990
7a0omq,"Nothing stops Me7o, not even Giannis",2707,https://streamable.com/5bq1d,1509501884,386,134199
7cnyg7,"LeBron: ""I wasn't throwing shade at Frank at all. People got their panties in a bunch in New York. I thought he would be a great fit here with Porzingis. That's not to say Frank won't be... So that's a clarification for Enes Kanter who always got something to say.""",2665,https://streamable.com/d5x4k,1510588315,792,0
7buc6v,"Jason Kidd calls Lonzo Ball comparison ""a stretch""",2632,https://streamable.com/qww5u,1510244420,779,56478
79jry4,Victor Oladipo hit the 3 over LaMarcus Aldridge to give the Pacers the lead with 10.3 seconds left,2596,https://streamable.com/zrfxs,1509317575,365,52767
7d0rcl,Dennis Smith Jr. blows by Pau Gasol and throws down the two-handed hammer!,2593,https://streamable.com/od4wx,1510711173,373,0
773099,[NBAonTNT] Celtics huddle together after gruesome Hayward injury.,2592,https://streamable.com/qrhhy,1508287211,312,83622
78zulw,Only the highest quality of basketball being played in the Bulls-Hawks game,2589,https://streamable.com/ff1kw,1509064384,225,114795
7ct5ye,Embiid fakes the shoes out of Deandre Jordan and slams it!,2587,https://streamable.com/y2sac,1510633791,161,0
7dqd3w,LeBron’s sons grade his performance,2571,https://streamable.com/ebsnb,1510976174,437,0
79dsz1,Ben Simmons with a ridiculous wrap-around pass to Embiid,2552,https://streamable.com/dek38,1509239122,290,153705
7ccw92,[Nuggets] Jokic half-court lob to Manimal,2530,https://streamable.com/owoi6,1510454938,151,80700
7afv0h,Danny Green with the poster on KD!,2528,https://streamable.com/vvxpt,1509668713,253,89574
7blmda,"LeBron on JR's breakout game: ""I told him it was the shoes... after a long conversation he finally decided to wear my shoes and he had a breakout game.""",2518,https://streamable.com/d381b,1510151152,200,17704
7actid,Doc Rivers tells a funny story about trying to get thrown out of a game to watch Tiger Woods at the Masters,2517,https://streamable.com/ce55p,1509641469,103,28633
7ao285,"LeBron in the tunnel: ""This is the best I've felt in my career right now.""",2493,https://streamable.com/66qld,1509761379,395,44706
7a6evu,"Tracy Mcgrady on Kyrie Irving's continuing belief that the earth is flat: ""I have it guys. I have it. Kyrie Irving lost a bet. He's trolling all of us. I hope it was a dare.""",2443,https://streamable.com/t08ql,1509568834,282,9919
7anpcg,LeBron jumps over Beal,2389,https://streamable.com/hbjg8,1509757210,299,116841
7av1ba,Anthony Davis smart play to keep the possession,2385,https://streamable.com/6pvv5,1509848505,220,85690
7asyyb,Porzingis speaking Spanish postgame,2370,https://streamable.com/031re,1509826182,390,44230
79kmi7,KD with the Space Jam dunk!,2363,https://streamable.com/kqz0q,1509326729,177,118268
773ol1,Kyrie Irving misses a potential game-winning three against LeBron James - TNT,2360,https://streamable.com/ydfum,1508294034,376,84439
7cckei,Frank Ntilikina Alley Oop to Porzingis!,2354,https://streamable.com/y0kyi,1510451067,188,59077
7dxxp9,Sexual Tension in the Philly Broadcast Booth,2346,https://streamable.com/x218m,1511061050,284,0
7c641i,Giannis bringing out the party tricks on the fast break dunk,2345,https://streamable.com/35iz0,1510370686,183,135665
7aoj0s,Kyrie Irving completes the rare 5 point play!,2343,https://streamable.com/rjefe,1509767290,197,70944
7d11m4,Kyrie gets the steal and finds Jaylen who lobs it up for Jayson Tatum,2331,https://streamable.com/uzlzv,1510714014,228,0
7d9lk2,LeBron reads the passing lane and throws it down,2317,https://streamable.com/2jwni,1510802343,333,0
7bynix,Clint capela huge block on Lebron James to seal the game!,2306,https://streamable.com/tapsk,1510285436,180,114995
77xpsi,KD's reaction to getting ejected (h/t:@vineydelnegro),2296,https://streamable.com/ethqm,1508639439,591,356613
7bz680,Kosta Koufas thinking about life,2290,https://streamable.com/mxe75,1510291859,147,88260
7b0hga,Kevin Love rips his jersey right down the middle in frustration,2284,https://streamable.com/9d5h8,1509917389,313,169342
77qv32,Demarcus Cousins gets under Green's skin resulting in a technical on Draymond,2267,https://streamable.com/3t72x,1508552758,500,87561
7agizs,Gregg Popovich get ejected,2251,https://streamable.com/317da,1509675781,386,76530
783y2g,Karl-Anthony Towns fucking hammers it down,2249,https://streamable.com/02831,1508716369,222,85880
77jhu1,Blake Griffin posterizes Julius Randle,2241,https://streamable.com/tij8q,1508469289,230,86101
7d0ltm,DeMar DeRozan high fiving the air after hitting his free throw,2232,https://streamable.com/h9irs,1510709677,129,0
79l1a2,JR Smith blank staring for 18 seconds,2223,https://streamable.com/5cljk,1509331552,185,70922
78tdve,[HIGHLIGHT] Durant to Curry for the DEEP three to take the lead!,2219,https://streamable.com/fqibs,1508993524,362,99363
7dq5pe,LeBron reloads to tie the game,2209,https://streamable.com/4m3b1,1510973940,235,0
7aw8uw,[Slater] There was a joke around the locker room that Pachulia almost got a three-second violation while on the fastbreak.,2199,https://streamable.com/2iyfs,1509865532,118,55575
7d9q2s,JV with the nasty spin move on Cousins,2198,https://gfycat.com/HollowShorttermBantamrooster,1510803687,181,329870
7by61k,LeBron gets defensive on a good call,2192,https://streamable.com/l0u4t,1510279845,481,141297
7cp8m7,"Knicks fan to Cavs team in subway: ""KP gonna get yall tonight""",2183,https://streamable.com/su3a5,1510598837,359,0
7cjwol,"After having been jawed at by Mejri, Westbrook looks like he gets up off the bench and yells ""trash-ass n***a"" at him for missing a free throw",2174,https://streamable.com/zx81e,1510538242,253,70264
7d1d1y,[NBA] Kyrie Being a Great Guy.,2153,https://streamable.com/kfig4,1510717134,298,67184
7d9639,Russ takes out his frustration at getting called for the foul by stealing it again anyway and throwing it down hard,2145,https://streamable.com/3bmzk,1510797863,140,62020
7bio34,Porzingis had no intention of answering this question in his post-game interview,2138,https://streamable.com/omfy9,1510111835,237,75905
7a0d33,Russell Westbrook turns a lay-up into a dunk at the last second,2132,https://streamable.com/q5k30,1509498375,127,111349
7907sv,"Draymond, tired of kicking his legs so high, whips the ball at Kyle Lowry's balls",2124,https://streamable.com/maykb,1509068572,361,101002
7ahllv,Slow motion footage of Lillard's game-winner and reaction,2122,https://streamable.com/ajcfp,1509689477,287,47303
7ajy6g,Gordon Hayward practicing in a chair,2118,https://streamable.com/9ihfz,1509721449,252,102600
7740gj,James Harden step-back three on Steph Curry to end the first quarter - TNT,2114,https://streamable.com/ku506,1508297587,219,44405
7cocqv,"JR Smith tells us his dad's motto growing up: ""Shoot every time you get it."" ... ""He said your shot is better than a turnover so don't risking turning the ball over, just shoot it.""",2108,https://streamable.com/3i9zm,1510591563,145,8670
7dicdo,Jaylen Brown gives emotional interview on playing after the death of his best friend,2108,https://streamable.com/tukaq,1510893137,191,21700
77qxu8,KD gets 2 blocks and the rebound wearing one shoe,2096,https://streamable.com/vhrqc,1508553724,152,60796
7a4e1m,"LeBron asked if his Pennywise costume was costume made: ""Nah I bought that out at Wal-Mart, size and everything, right of the rack.""",2071,https://streamable.com/3g38i,1509551020,257,21229
7c1nsi,Jimmer Fredette and Stephon Marbury get into an altercation during a game in China,2068,https://streamable.com/y2jpd,1510326750,539,59839
7e3w0s,Kerr breaks out a slinky as he waits for reporters to finish tweeting the news that Casspi will start in place of Durant,2060,https://streamable.com/bi2gr,1511129044,204,50027
7c6u1o,"Bill Walton on the UCLA shoplifting scandal: ""I want to apologize right now on the behalf of the human race for this travesty""",2058,https://streamable.com/odwh9,1510380450,349,24007
78ce73,Frank Kaminsky throws it down on Giannis,2035,https://streamable.com/2ai3d,1508807401,223,70444
78zxfg,Baynes contests Giannis' insane dunk attempt and goes down hard,2022,https://streamable.com/lb5a3,1509065249,376,69553
7844f7,Andre Roberson tries to compete with Fultz,2019,https://streamable.com/hijqb,1508718181,384,84057
7b2k5i,Wiggins tries to pull a piece of thread off of Jimmys chin,2003,https://streamable.com/umlne,1509938848,173,109477
77jneg,"Patrick ""1st Team All-Defense"" Beverley steals it from Lonzo for the easy basket",1983,https://streamable.com/qrhpd,1508471176,207,95034
79s6o7,Porzingis ends the half in EPIC FASHION,1983,https://streamable.com/n5tj5,1509411077,222,92295
772x08,[Highlight] Derrick Rose crosses up Kyrie and finishes at the rim,1972,https://streamable.com/n8sgq,1508286337,189,75423
78czwe,Markelle Fultz tries a jumpshot,1969,https://streamable.com/6hhop,1508813807,721,172245
781lb8,"Josh Jackson shooting gesture at a fan and telling him/her ""f*** you""",1967,https://streamable.com/gmhhq,1508693283,483,94524
7cs4rr,Tim Hardaway JR rips LeBron and gets the slam.,1961,https://streamable.com/vu7lj,1510623317,130,82383
77xqvj,Steph Curry and Kevin Durrant get ejected on the same play,1956,https://streamable.com/ibryo,1508639814,367,64583
79xijw,"Here's the first video footage of LeBron and Steph hugging it out after the 2017 Finals ended, which wasn't shown on the live ABC broadcast.",1925,https://streamable.com/lbkfw,1509472516,428,94794
7e5ni8,Reggie Jackson inturrupts Jimmy Butler's FT attempt causing him to miss the game tying FT,1914,https://streamable.com/5l89m,1511145527,252,94293
7ak4tn,"Ty Lue: ""We came out here early today and ran through a lot of plays and [Cedi Osman &amp; Ante Zizic] knew them the best."" Reporter: ""Is that terrifying?"" Lue: ""It is.""",1911,https://streamable.com/iutdt,1509723152,290,12031
7autuo,Steph Curry with the fake shot pass to Javale McGee,1911,https://streamable.com/0y0r0,1509846001,149,201783
7c5upj,"Antetokounmpo not aware where the ball is, finds it then eurostep and lay in! - ESPN",1888,https://streamable.com/krx1i,1510367500,115,61689
7bj1gj,Russell Westbrook assessed a flagrant offensive foul,1869,https://streamable.com/tgcsz,1510115935,547,82699
7b0kfo,LeBron not pleased with Bazemore's flop,1857,https://streamable.com/06ine,1509918183,270,125368
7ah2ja,Shaq takes the Paqui One Chip Challenge; Kenny struggles from just the chip dust,1848,https://streamable.com/mck8x,1509682130,212,71866
7a9129,Ricky Rubio with the dagger 3 in overtime,1844,https://streamable.com/6f3pa,1509594289,351,41283
7b21av,Kyle Lowry violently kisses baby after ejection,1835,https://streamable.com/4vgey,1509933049,162,117279
7c5au9,Kyrie Irving leaves the game after he takes an accidental elbow from Baynes. Some blood on the court.,1832,https://streamable.com/p58d2,1510361294,355,56723
7776yj,"LeBron on Kyrie being booed: ""That was nothing. I've experienced boos before. That was like a pat on the back. That was nothing.""",1819,https://streamable.com/b9i54,1508339600,265,6533
773c2r,LeBron spin and two-hand dunk,1815,https://streamable.com/7f8uk,1508290420,110,38622
77bb57,Giannis dunks on Baynes again. This time with the lob,1815,https://streamable.com/j4zwy,1508376841,179,57129
7ae11s,Frank Ntilikina locking up James Harden on defense and forcing an airball,1815,https://streamable.com/kueg5,1509651901,258,47697
