id,title,score,url,created_utc,num_comments,views,week
77ch9a,Every Phoenix Suns player starts running at the exact same moment,31920,https://gfycat.com/PrestigiousWeeGreyhounddog,1508390979,621,3772501,2017-42
772v5s,Gordon Hayward Breaks His Leg *GRAPHIC*,34194,https://streamable.com/j4yf3,1508285853,6439,2201631,2017-42
784gt7,Carmelo puts OKC up by 1 before Wiggins wins it at the buzzer,27816,https://streamable.com/3t2tl,1508721935,1987,510759,2017-42
77amvr,Markelle Fultz first 2 free-throws of his career,12210,https://streamable.com/gjj42,1508369772,1572,357603,2017-42
77xpsi,KD's reaction to getting ejected (h/t:@vineydelnegro),2296,https://streamable.com/ethqm,1508639439,591,356511,2017-42
774l1e,Durant Misses Game Winner By Faction of a Second - TNT,8130,https://streamable.com/g2xdi,1508304562,1122,321743,2017-42
77jj56,Patrick Beverley going at Lonzo Ball and welcoming him to the league,6800,https://streamable.com/qsv9k,1508469697,912,318759,2017-42
77qt68,Kyrie’s response to fan asking him “Where’s Lebron?”,6105,https://streamable.com/8so7i,1508552090,723,298051,2017-42
77xb99,Markelle Fultz horrible free throw attempt,3419,https://streamable.com/olcno,1508634438,930,250300,2017-42
77n82a,Rookie Jonathon Isaac realizes he forgot his jersey in his 1st NBA Game.,9490,https://streamable.com/dilzk,1508516930,333,250060,2017-42
77qgzg,Lebron James blocks Giannis then drills a wide open 3 on the next play,6074,https://streamable.com/vz14d,1508548094,557,221069,2017-42
77xq40,Curry tossing his mouthpiece (h/t:@vineydelnegro),1561,https://streamable.com/vxko1,1508639548,330,186764,2017-42
77t7j7,De'Aaron Fox with Kameha shot,3547,https://streamable.com/bc9m8,1508590707,523,147517,2017-42
77ikxl,KP send Melo back to NYC with the block,2949,https://streamable.com/sclco,1508459048,161,145011,2017-42
77x3vz,James Johnson dunks Victor Oladipo into oblivion,4062,https://streamable.com/q4luu,1508631929,255,140036,2017-42
77r363,Dwight Howard receives his 5th foul and shows his appreciation,3340,https://streamable.com/y53ar,1508555674,261,130585,2017-42
777kle,Kevin Love's absolutely ridiculous pass last night,4339,https://streamable.com/b350f,1508342875,296,129961,2017-42
77els5,"Paul Pierce on Embiid: ""I’m tired of getting a little taste of him. I want the whole load.""",7721,https://streamable.com/p605e,1508422144,767,109071,2017-42
77r9s5,"Lakers Corey Brewer calling for the ball for a good 15 seconds, but to no avail",2750,https://streamable.com/n3v7g,1508558119,253,99408,2017-42
77j0fz,"""Aww shit getta fuck outta here""",1554,https://streamable.com/qxmmy,1508463796,112,96373,2017-42
77jneg,"Patrick ""1st Team All-Defense"" Beverley steals it from Lonzo for the easy basket",1983,https://streamable.com/qrhpd,1508471176,207,95002,2017-42
781lb8,"Josh Jackson shooting gesture at a fan and telling him/her ""f*** you""",1967,https://streamable.com/gmhhq,1508693283,483,94423,2017-42
784933,Melo grabs a signature rebound,1473,https://streamable.com/m4cfg,1508719570,172,91973,2017-42
77efh0,Terrence Ross No Look Pass To Vucci Mane,1676,https://gfycat.com/bewitcheddefinitiveharrierhawk,1508420371,134,91562,2017-42
77jk8a,Patrick Beverley pretty move and NASTY block,2975,https://streamable.com/xkrfx,1508470071,167,88672,2017-42
77xh86,Marc Gasol nasty move on Klay Thompson followed by a 3,4034,https://streamable.com/hutup,1508636464,284,88555,2017-42
77am7w,[Highlight] John Wall bodies TJ McConnell and dunks it!,3143,https://streamable.com/bwz0i,1508369576,360,88136,2017-42
77qv32,Demarcus Cousins gets under Green's skin resulting in a technical on Draymond,2267,https://streamable.com/3t72x,1508552758,500,87546,2017-42
77jhu1,Blake Griffin posterizes Julius Randle,2241,https://streamable.com/tij8q,1508469289,230,86020,2017-42
783y2g,Karl-Anthony Towns fucking hammers it down,2249,https://streamable.com/02831,1508716369,222,85855,2017-42
78cysm,Jordan Bell SELF ALLEY OOP And-1,17274,https://streamable.com/rvev1,1508813464,1684,586822,2017-43
7980z9,Draymond Green / Bradley Beal scuffle,8827,https://streamable.com/corf5,1509161698,2316,416068,2017-43
78kxkz,Blake Griffin ends Rudy Gobert's life with the nasty poster dunk,8802,https://streamable.com/uofu3,1508900100,819,375167,2017-43
79127z,Blake Griffin wins the game with the buzzer beater 3 pointer,10655,https://streamable.com/zx0bi,1509078928,1273,358523,2017-43
78sas3,Eric Gordon beats the 6ers at the buzzer,11534,https://streamable.com/flyqg,1508980843,980,322826,2017-43
78rxij,Trevor Booker sneaks into the Cavs huddle,6060,https://streamable.com/cmnwl,1508976940,411,317448,2017-43
79bfha,Gortat holds Klay for the last 1.1 seconds of the game,2941,https://streamable.com/g251g,1509212388,354,317334,2017-43
79e2gl,"""Wessell Russbrook""",11463,https://streamable.com/z4dpa,1509242601,444,288641,2017-43
7989nb,Steph gets John Wall to take the bait and makes him pay!,5796,https://streamable.com/vewnp,1509165140,412,255758,2017-43
79jq6f,Steph came to the arena in costume 😂😂,8454,https://streamable.com/uczx3,1509317057,378,250281,2017-43
78tedl,Curry channeling China Klay after the whistle,4125,https://streamable.com/cecp7,1508993722,216,211183,2017-43
78cu9g,Ref gets in the way of Harden's pass,5864,https://streamable.com/emmfh,1508812066,1083,209577,2017-43
78cu85,Chalmers trips Harden; Harden shoves Rio to the ground,3198,https://streamable.com/9muqz,1508812054,772,200394,2017-43
78gmdr,"Draymond yells:""Who is this?"" as Mavs rookie Gian Clavell enters the game",3496,https://streamable.com/skmz7,1508860207,758,198348,2017-43
797ndr,Popovich mistakes Ross for Simmons and puts him in a headlock,4030,https://streamable.com/rvte9,1509156559,298,192154,2017-43
79ik7k,Anthony Davis and DeMarcus Cousins visit a haunted house,12709,https://streamable.com/0451j,1509305548,475,191721,2017-43
78l05b,Wade’s handshake with Lebron..and Kevin Love.,3577,https://streamable.com/nh6pc,1508900888,378,189336,2017-43
78czwe,Markelle Fultz tries a jumpshot,1969,https://streamable.com/6hhop,1508813807,721,170839,2017-43
79dsz1,Ben Simmons with a ridiculous wrap-around pass to Embiid,2549,https://streamable.com/dek38,1509239122,289,152879,2017-43
78d47a,"Dejounte Murray told Pop to Chill He got this, After LMA Scuffle With Ibaka",2925,https://streamable.com/urqsi,1508815215,532,150353,2017-43
78hokz,Video of Kevin Durant watching Gordon Hayward's injury live,3455,https://streamable.com/5vh07,1508869283,641,145127,2017-43
79ea05,Donovan Mitchell flies for the unbelievable putback slam,4552,https://streamable.com/3dld7,1509245411,303,140597,2017-43
790546,Klay Thompson attempts to start a race.,4706,https://streamable.com/7sryj,1509067696,359,140126,2017-43
78t513,John Wall explodes past Lonzo,2848,https://streamable.com/wn9qu,1508990350,331,129598,2017-43
79dfdg,Beautiful ball movement by the Pelicans,4650,https://streamable.com/xt67c,1509234440,265,116421,2017-43
78zulw,Only the highest quality of basketball being played in the Bulls-Hawks game,2589,https://streamable.com/ff1kw,1509064384,225,114423,2017-43
79acde,Reporter nervously forgets question while talking to KD.,4378,https://streamable.com/il8zc,1509200519,302,111349,2017-43
7983rl,John Wall tells Steph Curry to stop flopping,1421,https://streamable.com/7cwtx,1509162796,512,109345,2017-43
79kmi7,KD with the Space Jam dunk!,2173,https://streamable.com/kqz0q,1509326729,169,107409,2017-43
78s18q,LeBron doing LeBron things,1682,https://streamable.com/29x26,1508977970,200,104149,2017-43
79lylg,"The Cavs bench clears out after loss without shaking hands, again",1052,https://streamable.com/pzm87,1509344126,307,24850,2017-44
