id,title,score,url,created_utc,num_comments
7a0omq,"Nothing stops Me7o, not even Giannis",1863,https://streamable.com/5bq1d,1509501884,307
7a0d33,Russell Westbrook turns a lay-up into a dunk at the last second,1645,https://streamable.com/q5k30,1509498375,96
7a04y4,Westbrook to Adams - NBATV,6142,https://streamable.com/qkryq,1509496059,390
79zdwz,Lebron dancing in Pennywise costume,2346,https://streamable.com/dv263,1509488696,223
79z6wv,Kevin Love trimmed his beard &amp; he now looks 10 years younger.,1291,https://streamable.com/89cq7,1509486881,150
79xuhy,Terry Rozier’s Stepback Last Night Looked Oddly Familiar...,1028,https://streamable.com/s72jo,1509475325,142
79xijw,"Here's the first video footage of LeBron and Steph hugging it out after the 2017 Finals ended, which wasn't shown on the live ABC broadcast.",1781,https://streamable.com/lbkfw,1509472516,405
79waej,"Draymond Green: ""I'm not Steph. I'm not Klay. I'm not KD. So I'm not about to sit there and rely on the three, and I think I've been relying on it too much.""",1067,https://streamable.com/xugpb,1509461988,159
79tk2u,Jordan Bell GETS UP for the impressive putback slam,1616,https://streamable.com/9gfnb,1509425098,228
79tgx5,Curry with a step-back three over Rivers to end the third quarter NBATV,1026,https://streamable.com/z9u6a,1509423971,153
79stgv,Ben Simmons goes coast-to-coast for the slam late in the 4th!,1485,https://streamable.com/ikq78,1509417070,260
79spju,Kristaps Porzingis with an important message to his fans,1238,https://streamable.com/g9nv6,1509416058,97
79sm7n,Andrew Wiggins huge dunk in the clutch vs the Heat,3260,https://streamable.com/l64qv,1509415186,250
79s6o7,Porzingis ends the half in EPIC FASHION,1978,https://streamable.com/n5tj5,1509411077,223
79nsp2,Lauri Markkanen off the glass between the legs dunk pregame,1448,https://streamable.com/yg9pw,1509371145,168
79lylg,"The Cavs bench clears out after loss without shaking hands, again",1769,https://streamable.com/pzm87,1509344126,493
79l2ic,Avery Bradley gets the clutch steal and dagger lay up against the Warriors,1280,https://streamable.com/gem94,1509331938,179
79l1a2,JR Smith blank staring for 18 seconds,2219,https://streamable.com/5cljk,1509331552,186
79kmpp,Derrick Rose gives the ball straight to KP on the inbound,1432,https://streamable.com/r1n99,1509326799,109
79kmi7,KD with the Space Jam dunk!,2362,https://streamable.com/kqz0q,1509326729,177
79jry4,Victor Oladipo hit the 3 over LaMarcus Aldridge to give the Pacers the lead with 10.3 seconds left,2595,https://streamable.com/zrfxs,1509317575,365
79jq6f,Steph came to the arena in costume 😂😂,8685,https://streamable.com/uczx3,1509317057,389
