id,title,score,url,created_utc,num_comments
78hfst,"LeBron defends Jordan Bell's self alley-oop: ""We’re all men. Stop me from dunking. We’re not trying to hurt nobody..You play the game until it's over. Yeah he threw it off the glass, dunked it, so what?""",2835,https://streamable.com/zpyvy,1508867227,467
78gmdr,"Draymond yells:""Who is this?"" as Mavs rookie Gian Clavell enters the game",1722,https://streamable.com/skmz7,1508860207,501
78d47a,"Dejounte Murray told Pop to Chill He got this, After LMA Scuffle With Ibaka",2745,https://streamable.com/urqsi,1508815215,507
78d1dj,"LaMarcus Aldridge posts up Ibaka, gets the and-1 bucket to foul him out of the game",1404,https://streamable.com/g8629,1508814282,116
78czwe,Markelle Fultz tries a jumpshot,1905,https://streamable.com/6hhop,1508813807,699
78cysm,Jordan Bell SELF ALLEY OOP And-1,16763,https://streamable.com/rvev1,1508813464,1648
78cy0p,LaMarcus Aldridge and Serge Ibaka scuffle after Lowry gets elbowed - NBATV,1328,https://streamable.com/wietc,1508813236,339
78cu9g,Ref gets in the way of Harden's pass,5626,https://streamable.com/emmfh,1508812066,1051
78cu85,Chalmers trips Harden; Harden shoves Rio to the ground,3063,https://streamable.com/9muqz,1508812054,727
78ce73,Frank Kaminsky throws it down on Giannis,1981,https://streamable.com/2ai3d,1508807401,222
78cdw5,"[SINow] Stephen Curry consoles Devin Harris' nephew, who lost his father in a car accident last week",3079,https://streamable.com/jobsk,1508807315,160
7896de,"Dwyane Wade on asking to come off the bench: ""Looks like I'll probably be better with this team in that lineup so why wait?""",1322,https://streamable.com/mcw7p,1508778478,251
785b82,Anthony Davis blocks Lonzo Ball,1607,https://streamable.com/zot3g,1508731735,152
784gt7,Carmelo puts OKC up by 1 before Wiggins wins it at the buzzer,27791,https://streamable.com/3t2tl,1508721935,1986
784al7,Wiggins glides for the slam,1153,https://streamable.com/v88qf,1508720011,101
784933,Melo grabs a signature rebound,1472,https://streamable.com/m4cfg,1508719570,173
7844f7,Andre Roberson tries to compete with Fultz,2019,https://streamable.com/hijqb,1508718181,384
783y2g,Karl-Anthony Towns fucking hammers it down,2245,https://streamable.com/02831,1508716369,222
781lb8,"Josh Jackson shooting gesture at a fan and telling him/her ""f*** you""",1967,https://streamable.com/gmhhq,1508693283,483
78034h,Grizzlies DJ channels Tommy Wiseau after Gasol's basket,1000,https://streamable.com/usdoz,1508677610,59
77y0va,Joe Ingles is becoming one of the premier trash talkers of the league,1104,https://streamable.com/tttwu,1508643298,138
77xv8z,Giannis with the clutch block to preserve the Bucs' lead!,1176,https://streamable.com/wj2ca,1508641337,137
77xuxn,Giannis forces the turnover and then gets the go ahead dunk on the run out with 11 seconds left,1353,https://streamable.com/ynxoz,1508641230,103
77xqvj,Steph Curry and Kevin Durrant get ejected on the same play,1955,https://streamable.com/ibryo,1508639814,366
77xq40,Curry tossing his mouthpiece (h/t:@vineydelnegro),1552,https://streamable.com/vxko1,1508639548,330
