id,title,score,url,created_utc,num_comments
7mhhvr,"LeBron on refs and officiating this season: For me, the worst thing is when they don't admit to their mistake. I go over and talk to the ref, he says ""it's nothing"". Like when i actually go over and ask ""you didn't see that?"" and they say ""No, it's nothing, no foul"". That's the worst.",1078,https://streamable.com/8x856,1514405982,319
7mfxm8,Langston Galloway dunks to finds out his wife is having a baby boy,1476,https://streamable.com/zai2l,1514391501,148
7mcvs3,Lob to Tyson Chandler to end it for the Suns!,3608,https://streamable.com/imm4f,1514349866,549
7mco51,"Jokic ejected on a flagrant 2 foul after this ""swim move""",1231,https://streamable.com/3yifo,1514347327,402
7mcke8,Jokic gives no fucks.,5445,https://streamable.com/uukyy,1514346086,339
7mcjts,Ginobili and-1 put back jam,1955,https://streamable.com/a756w,1514345906,163
7mc2pn,Andre Drummond With The Handles,1121,https://streamable.com/iyyyb,1514340458,77
7m6bce,"A reporter asks LeBron if Game 3 of the 2017 finals sticks with him. His reply: ""I've lost five finals. What are you gonna do about it? What's gonna stick with me is seeing my daughter smile, my kids graduating high school and college, hopefully""",3287,https://streamable.com/kih9r,1514270552,612
7m5z7e,Karl-Anthony Towns with the emphatic slam on Corey Brewer,1264,https://streamable.com/m6jxp,1514266172,132
7m5u5t,"Chuck to Shaq on the contracts being given out ""They giving some of these bums a 100 million dollars, you know how much you and me get Shaq?""",1975,https://streamable.com/dxbp5,1514264350,347
7m4jk8,"LeBron on the non-called fouls by Durant: ""Which one?..I lost it on the left wing. He got me a little bit. But the one [where the out-of-bounds call was overturned], he fouled me twice. But whatever. What are you gonna do about it.""",3462,https://streamable.com/7ntg4,1514247575,496
7m43t7,3 crucial missed calls on LeBron James on consecutive possessions,2688,https://streamable.com/nspbd,1514242212,646
7m4193,ESPN crew not happy about no call at end of GSW/Cavs game,11883,https://streamable.com/1fxrk,1514241360,1813
7m3lg8,Durant and Green completely neutralize LeBron on a full head of steam,1445,https://streamable.com/9i5dc,1514236174,290
7m3dvb,Ref refuses to give Durant his 2nd technical (automatic ejection) midway through the 1st,4098,https://streamable.com/01lc2,1514233679,861
7m33nx,"""Go Tweet about it! You're a cornball, Embiid! A cornball!""",4075,https://streamable.com/srwei,1514230362,411
