id,title,score,url,created_utc,num_comments
7hetc8,Harden nonchalantly throws a 48 foot alley oop to Eric Gordon,1275,https://streamable.com/yt1p5,1512359588,133
7hed7g,Steph Curry with the ridiculous finish underneath the rim,1027,https://streamable.com/u2goo,1512354743,146
7hebdb,"Joffrey Lauvergne gets his finger dislocated, Popovich doesn't want to see any of that",2078,https://streamable.com/ge6lf,1512354193,120
7hdxa6,Bam Adebayo locks down Stephen Curry on the perimeter,2234,https://streamable.com/vh5xh,1512350170,199
7hdtre,Shaun Livingston gets thrown out from the game,5455,https://streamable.com/iz7dp,1512349188,1262
7havti,Meyers Legend with the ridiculous no-look circus shot,1261,https://streamable.com/sa0pl,1512321748,113
7h9pl1,"Giannis with the ""gomu gomu no steal""",1591,https://streamable.com/03rjm,1512308826,195
7h7rol,Jamal Murray dribbles past Lonzo Ball and Randle takes offense,2151,https://streamable.com/lsead,1512276168,780
7h7ks3,LeBron going crazy during the middle of Wade's interview as he watches the Ohio State/Wisconsin game,1576,https://streamable.com/st2mc,1512273692,223
7h7jd0,Gary Garris Harris 360 Fingeroll Past Larry Nance,9358,https://streamable.com/7ca4y,1512273200,310
7h7cfv,Embiid and Drummond hug it out at the end of the game,2708,https://streamable.com/cmybt,1512270871,239
7h7971,Embiid shows Drummond the way out,3385,https://streamable.com/183v2,1512269824,551
7h78yt,LeBron dances while fan begs for a high five,1475,https://streamable.com/ok10r,1512269752,205
7h78bm,LeBron seals the game with a deep 2 to propel the Cavs to their 11th straight win,2507,https://streamable.com/lf4aa,1512269552,437
7h70ki,Pistons forward Anthony Tolliver casually helps mop up the Sixers court,1187,https://streamable.com/spv8r,1512267062,76
7h6vck,J.R. Smith is not on drugs,1525,https://streamable.com/ehgrh,1512265424,211
7h52lf,Jaylen Brown's Ass Can't Resist The Sugarhill Gang,1489,https://streamable.com/eaiwb,1512246728,96
7h5293,Amazing defensive effort by the Suns,22852,https://streamable.com/7w48t,1512246626,1137
7h4q36,"Devin Booker blocks Kyrie's meaningless shot after the buzzer, then keeps the ball away from him",2364,https://streamable.com/pyh7p,1512243364,349
7h0lbn,Donovan Mitchell cannot hide his smile as he becomes the first rookie to score 40-plus points since Blake Griffin did it in 2011,12615,https://streamable.com/j1spt,1512188558,821
7gzyy4,Draymond blocks Fournier then finds Bell for the slam!,1193,https://streamable.com/whro5,1512180977,111
7gzxy2,Kevin Durant gets ejected from the game,2926,https://streamable.com/4pwrk,1512180657,822
7gzt03,Steven Adams takes it all the way to rack after the steal and Russell Westbrook loves it,1988,https://streamable.com/c9sbk,1512179079,108
7gzp9f,"Orlando Magic with the ""Bandwagon Cam"" vs the Warriors",2874,https://streamable.com/exgpn,1512177887,328
7gsyov,Donovan Mitchell jumps out the gym for another big dunk,1203,https://streamable.com/w3zgj,1512106621,146
