id,title,score,url,created_utc,num_comments
7a04y4,Westbrook to Adams - NBATV,2653,https://streamable.com/qkryq,1509496059,231
79zdwz,Lebron dancing in Pennywise costume,1624,https://streamable.com/dv263,1509488696,194
79xijw,"Here's the first video footage of LeBron and Steph hugging it out after the 2017 Finals ended, which wasn't shown on the live ABC broadcast.",1515,https://streamable.com/lbkfw,1509472516,382
79tk2u,Jordan Bell GETS UP for the impressive putback slam,1606,https://streamable.com/9gfnb,1509425098,228
79tgx5,Curry with a step-back three over Rivers to end the third quarter NBATV,1030,https://streamable.com/z9u6a,1509423971,154
79stgv,Ben Simmons goes coast-to-coast for the slam late in the 4th!,1484,https://streamable.com/ikq78,1509417070,259
79spju,Kristaps Porzingis with an important message to his fans,1239,https://streamable.com/g9nv6,1509416058,96
79sm7n,Andrew Wiggins huge dunk in the clutch vs the Heat,3246,https://streamable.com/l64qv,1509415186,250
79s6o7,Porzingis ends the half in EPIC FASHION,1967,https://streamable.com/n5tj5,1509411077,223
79nsp2,Lauri Markkanen off the glass between the legs dunk pregame,1447,https://streamable.com/yg9pw,1509371145,168
79lylg,"The Cavs bench clears out after loss without shaking hands, again",1770,https://streamable.com/pzm87,1509344126,492
79l2ic,Avery Bradley gets the clutch steal and dagger lay up against the Warriors,1278,https://streamable.com/gem94,1509331938,179
79l1a2,JR Smith blank staring for 18 seconds,2222,https://streamable.com/5cljk,1509331552,186
79kmpp,Derrick Rose gives the ball straight to KP on the inbound,1431,https://streamable.com/r1n99,1509326799,109
79kmi7,KD with the Space Jam dunk!,2363,https://streamable.com/kqz0q,1509326729,177
79jry4,Victor Oladipo hit the 3 over LaMarcus Aldridge to give the Pacers the lead with 10.3 seconds left,2596,https://streamable.com/zrfxs,1509317575,365
79jq6f,Steph came to the arena in costume 😂😂,8681,https://streamable.com/uczx3,1509317057,389
