id,title,score,url,created_utc,num_comments
7g21xn,Lonzo Ball attempts to cut into the Clippers 5 point lead with 12 seconds left,2762,https://streamable.com/cj6wi,1511849268,670
7g20o6,Blake Griffin leaves the game after Rivers sits on his knee,1014,https://streamable.com/ze7cs,1511848954,238
7g18jr,"Ty Lue slaps the scorer's table in disgust, knocking chalk into a fan's face",1038,https://streamable.com/78cyg,1511840872,145
7g13ul,LeBron smiling at Embiid after knocking down the jumper in his face.,1836,https://streamable.com/xn3uz,1511839629,259
7g0zlr,ESPN hype ad for a shitty game,2893,https://streamable.com/7ozez,1511838545,314
7g0ubt,Gregg Popovich ejected for foul language toward refs,1854,https://streamable.com/zfhfg,1511837217,261
7g0t92,Tony Parker is BACK,1454,https://streamable.com/pdr9d,1511836937,78
7g0rgw,This Celtics fan on the Jumbotron had me shook,7709,https://streamable.com/n95cb,1511836482,376
7g0khc,"Wade blocks Embiid, on the other end LeBron James squares Embiid up on the perimeter and drills it - FS",2102,https://streamable.com/hbrbw,1511834713,275
7g0b4f,Lebron throwing down a classic LeTomahawk.,1139,https://streamable.com/043n5,1511832314,88
7g06m7,Lebron cleans up his mess and ends the half with a buzzer beater.,3596,https://streamable.com/pcp1e,1511831176,347
7fzvv6,JJ Reddick doesn't want to guard LeBron,1656,https://streamable.com/3lg3x,1511828486,143
7frvoi,"Gasol's reaction after being benched in the 4th: ""At the end of the day, I'm as competitive as anybody. I hate not playing, that's what I value most. If I'm not on the floor, that means I'm not valued. I'm sure they knew that would hurt me the most..I'm sure they wouldn't do it to Mike.""",4908,https://streamable.com/ucczh,1511749817,981
7frkwh,I think Marc Gasol is at odds with the coaching staff and on his way out (video example),2211,https://www.reddit.com/r/nba/comments/7frkwh/i_think_marc_gasol_is_at_odds_with_the_coaching/,1511746867,639
7fqwvv,Draymond Green freezes and turns off once again,3417,https://streamable.com/y7i4q,1511740529,157
7fp893,"The Celtics tried a new play by play guy last night, and it got...sensual (courtesy u/feversmirrors)",3383,https://streamable.com/26i3m,1511725528,174
7fo2jk,Klay Thompson hates Gatorade,18459,https://streamable.com/oz5k1,1511715363,1223
7flnw2,"High quality vid of Giannis yelling ""I will fuck you up!"" to assistant coach Sean Sweeney",3860,https://streamable.com/w4p5w,1511684165,873
7fkdps,Zaza Pachulia weird flop vs the Pelicans,1053,https://streamable.com/i2gmy,1511668041,233
7fk1vz,Referee's terrible foul call against Jordan Bell,1642,https://streamable.com/vpwz0,1511664413,314
7fjrg8,"The Toronto Spurs trying out this strange new concept, called Ball Movement",1454,https://streamable.com/4ipsk,1511661354,163
7fjmk3,Kyrie Irving drops Darren Collison and gets the easy layup,2820,https://streamable.com/3q366,1511659923,223
7fh4os,KAT Defensive Lapses vs. Miami Heat,1020,https://streamable.com/be9yh,1511635975,272
7fgsmr,Jayson Tatum looks at the wrong camera.,16405,https://streamable.com/bgf93,1511632858,416
