id,title,score,url,created_utc,num_comments
7ln3ea,Jordan Bell on his role: “Run every single time... pass it to the Lightskin dudes...and the skinny dude”,5234,https://streamable.com/i7p0t,1514009505,379
7lmjre,Harden knocks the ball out of the refs' hands and doesn't let him get it back,1019,https://streamable.com/2coo1,1514002068,327
7lmd8f,Westbrook with the game winner against Atlanta!,2934,https://streamable.com/stnu4,1513999790,475
7llsm2,NO FUCKING SWITCHING!: How the Heat took advantage of the Celtics' youth (and Horford fouling out),2977,https://www.reddit.com/r/nba/comments/7llsm2/no_fucking_switching_how_the_heat_took_advantage/,1513992934,169
7ljshd,"Lauri See, Lauri do",3722,https://streamable.com/hjpuz,1513972184,161
7lfn85,"Kristaps Porzingis on his struggles vs Boston: ""Thanks to me, the game was close ... Kobe says you miss 100 percent of the shots that you don't take. Today I missed all hundred.""",5694,https://streamable.com/ydmjz,1513923592,284
7lfjud,"""Fucking blind bitch!""",1958,https://streamable.com/u9aah,1513922430,215
7lffw3,Manu and Tony Parker are in sync,2806,https://streamable.com/4fqdg,1513921055,135
7lf0pz,Marv Albert just isn't good anymore...,2654,https://streamable.com/hdj2b,1513916148,537
7lexcf,"Frank ""The French Prince"" Ntilikina shows Kyrie what lockdown D looks like",1801,https://streamable.com/tbmr3,1513915109,298
7lehc7,LeBron pumped up after clutch fadeaway jumper on KD,1246,https://streamable.com/c8iw3,1513910260,153
7leetv,LeBron searches for candy mid game for his daughter Zhuri,3661,https://streamable.com/4tgyn,1513909518,452
7ldwdz,The Cleveland Cavaliers Christmas Cringefest,1682,https://streamable.com/8jkw4,1513904127,213
7lbzos,The 8-0 Bulls demonstrate how to run a fast break,2716,https://streamable.com/l6c6y,1513886414,148
7l7g3v,Warriors' bench makes fun of David West's vertical,1054,https://streamable.com/hrb77,1513834957,106
