id,title,score,url,created_utc,num_comments
7djkzg,Kevin Harlan tells a story about why he tries to sound excited even while commentating blowout games,1139,https://streamable.com/zvwen,1510908723,177
7dicdo,Jaylen Brown gives emotional interview on playing after the death of his best friend,1975,https://streamable.com/tukaq,1510893137,181
7di4wg,"""They're not going to beat the Golden State Warriors tonight and they're not going to hold the Golden State Warriors to 94 points. I promise you that."" - Charles Barkley",6520,https://streamable.com/ys03p,1510890849,627
7dhk4g,Kyrie Irving with the layup and...Marcus Smart disqualifies it,3347,https://streamable.com/dqyxi,1510884972,309
7dhfdn,Marcus Smart misses the 3 then gets dunked on by Andre Iguodala,1020,https://streamable.com/u1271,1510883592,149
7dhb6u,Jaylen Brown gets a steal off Curry and throws it down! - TNT,1588,https://streamable.com/ansx8,1510882321,137
7dd5rn,21 Savage with probably the worst halftime performance in NBA history @ Hawks vs. Kings,8395,https://streamable.com/jj6bb,1510846690,1444
7dbv9c,Siakam's funny face after shove from AD,1776,https://streamable.com/cg040,1510832754,106
7dah4n,Joel Embiid with the legendary post-game interview feat. Kevin Hart and Ben Simmons,3063,https://streamable.com/1ftka,1510812234,335
7daefg,Embiid goes over 40 points with the nice moves on Julius Randle,1480,https://streamable.com/nvs9b,1510811333,219
7da6le,Lonzo bricks two threes in rapid succession,7437,https://streamable.com/youyd,1510808728,1532
7da5ie,Embiid with a beautiful euro-step around Brook Lopez,1294,https://streamable.com/0j11h,1510808396,110
7da13v,Kuzma tries throwing it down on Embiid! - ESPN,1545,https://streamable.com/k816j,1510806991,279
7d9qzz,Ben Simmons with the euro-step and slam past Ball - ESPN,3033,https://streamable.com/r1wr2,1510803959,248
7d9lk2,LeBron reads the passing lane and throws it down,2317,https://streamable.com/2jwni,1510802343,333
7d96qi,Rondo initiates a beautiful stretch of ball movement,1446,https://streamable.com/3ltww,1510798040,107
7d9639,Russ takes out his frustration at getting called for the foul by stealing it again anyway and throwing it down hard,2145,https://streamable.com/3bmzk,1510797863,140
7d7joj,"Malik Monk asked if its weird to be playing against LeBron: ""So weird. He was in his prime when I was [growing up] watching and he's still in his prime now, so its crazy.""",3406,https://streamable.com/gozm8,1510782722,208
