id,title,score,url,created_utc,num_comments
7cd4ct,Shaun Livingston behind-the-back crossover to a behind-the-back dime to Klay Thompson for 3,2078,https://streamable.com/ztjvu,1510457718,165
7ccw92,[Nuggets] Jokic half-court lob to Manimal,1435,https://streamable.com/owoi6,1510454938,114
7cckei,Frank Ntilikina Alley Oop to Porzingis!,1640,https://streamable.com/y0kyi,1510451067,147
7cck6l,The speed of Patty Mills.,1441,https://streamable.com/n2uv8,1510451002,124
7c6u1o,"Bill Walton on the UCLA shoplifting scandal: ""I want to apologize right now on the behalf of the human race for this travesty""",2053,https://streamable.com/odwh9,1510380450,351
7c6rm9,"Jerami Grant says ""Gimme dat shit"" as he blocks the living shit out of Blake Griffin",1142,https://streamable.com/uqozd,1510379468,93
7c6f4s,Neon Dion completely takes over and buries the Jazz,1581,https://streamable.com/ns2pa,1510374689,157
7c641i,Giannis bringing out the party tricks on the fast break dunk,2345,https://streamable.com/35iz0,1510370686,183
7c60qj,Bledsoe to Giannis fastbreak oop,4954,https://streamable.com/840gj,1510369556,328
7c5upj,"Antetokounmpo not aware where the ball is, finds it then eurostep and lay in! - ESPN",1888,https://streamable.com/krx1i,1510367500,115
7c5u2n,Oladidpo 360 slam,3216,https://streamable.com/m743e,1510367301,219
