id,title,score,url,created_utc,num_comments
7f201q,Steph Curry makes a tough finger roll with a squash. Denzel Washington in disbelief.,1467,https://streamable.com/im5rs,1511466022,180
7ex3h9,Devin Booker with the tough buzzer beater to force overtime,3271,https://streamable.com/n98qn,1511411836,271
7ex2wt,Lonzo Ball throws down the one-handed alley-oop,2138,https://streamable.com/6zxnc,1511411654,135
7ex0lh,Stephen Curry and Kevin Durant on the bench laughing at Westbrook's failed attempt to get a triple double (credit to u/Metsvault),2277,https://streamable.com/83flx,1511410957,1160
7ewpeu,Harrison Barnes sinks the winning 3 pointer with 0.5 seconds left.,4095,https://streamable.com/at64r,1511407677,395
7ewh9y,"Melo gets pissed at Russ for stealing his rebound, drains a 3 at the other end",1393,https://streamable.com/fj7zi,1511405319,144
7ewfcf,"Westbrook and Durant jawing at eachother, go head-to-head - ESPN",14532,https://streamable.com/vl8vx,1511404727,2318
7ewekt,Westbrook back to back steals on KD/Steph,6827,https://streamable.com/9pp2a,1511404559,454
7ewe1f,"OKC announcers discuss a no call on Draymond - ""At least he didn't kick in him in the crotch this time""",1970,https://streamable.com/9te6m,1511404417,123
7ewcmu,"Sixers fans chant ""We Want Okafor"" at Wells Fargo Center",1666,https://streamable.com/p6ctx,1511404022,257
7ewaaa,Westbrook hypes up the crowd as KD tries to trash talk to him and Melo waves goodbye,1109,https://streamable.com/ggqfl,1511403331,126
7ewa70,Embiid hits the Sky Hook,3034,https://streamable.com/eanmb,1511403310,293
7ew9fp,Zhou Qi sends Chandler's shot into the front row,1465,https://streamable.com/d9odk,1511403087,226
7ew69i,Westbrook comes in for the vicious slam,2549,https://streamable.com/oymlj,1511402234,166
7ew4zr,Embiid vicious block on Damian Lillard,1464,https://streamable.com/r4m92,1511401871,127
7ew152,WATCH: Chris Paul fakes out Jokic with crazy ball fake,3578,https://streamable.com/i0dce,1511400786,292
7ew0gp,"Carmelo Anthony drains a midrange J, strips Curry then stops on a dime and drills a three! - ESPN",1023,https://streamable.com/3zq24,1511400604,71
7evp0h,All 4 Mavs run over to help J.J. up after a fall,1596,https://streamable.com/t7wjy,1511397373,126
7evo3k,LeBron submits his Shaqtin nomination by blowing the wide open dunk,2788,https://streamable.com/dqio0,1511397107,247
7epsrj,Sample of Josh Jackson's defense this season,8020,https://streamable.com/no4jw,1511343985,659
7eo4oe,Cameraman gets his priorities straight,3007,https://streamable.com/uoa0a,1511324401,365
7eo1hp,Justin Holiday with the pull up jumper in transition,1773,https://streamable.com/tebir,1511323529,169
7emyqw,"[SC6] Joel Embiid on if he’s worried his trolling is “poking the bear a little bit” : “I’m not worried about that, if those guys want to get their feelings hurt...and they’re not strong mentally, that’s not my fault.”",1543,https://streamable.com/a2hwe,1511313352,213
7ejrfv,Steph and KD engage in a bank battle,2173,https://streamable.com/1qtwt,1511287319,350
7ejhs8,Isaiah Thomas gives his dad a gift in memory of his sister,1295,https://streamable.com/uwm40,1511285245,141
7ej3ug,Rodney Hood Jedi mind trick,4030,https://streamable.com/90prl,1511282194,212
7eiz9s,"Kyrie on where the Celtics resiliency comes from: ""Just a lot of heart, you know, being protected by some incredible energies.""",1060,https://streamable.com/jhj7q,1511281179,255
7eihs7,"Charles Barkley says Clippers are going to the Western Conference Finals, Clippers proceed to lose 9 in a row",12586,https://streamable.com/qkbrb,1511277169,659
7efmhv,Klay Thompson offers his thoughts regarding walking under scaffolding on NY nighttime news.,3067,https://streamable.com/atl40,1511243344,347
7eewh5,Two insane saves by Tatum and Smart lead to the clutch Kyrie 3 pointer,1833,https://streamable.com/7g46f,1511235786,181
