id,title,score,url,created_utc,num_comments
7m6bce,"A reporter asks LeBron if Game 3 of the 2017 finals sticks with him. His reply: ""I've lost five finals. What are you gonna do about it? What's gonna stick with me is seeing my daughter smile, my kids graduating high school and college, hopefully""",2766,https://streamable.com/kih9r,1514270552,511
7m5z7e,Karl-Anthony Towns with the emphatic slam on Corey Brewer,1182,https://streamable.com/m6jxp,1514266172,127
7m5u5t,"Chuck to Shaq on the contracts being given out ""They giving some of these bums a 100 million dollars, you know how much you and me get Shaq?""",1748,https://streamable.com/dxbp5,1514264350,302
7m4jk8,"LeBron on the non-called fouls by Durant: ""Which one?..I lost it on the left wing. He got me a little bit. But the one [where the out-of-bounds call was overturned], he fouled me twice. But whatever. What are you gonna do about it.""",3386,https://streamable.com/7ntg4,1514247575,477
7m43t7,3 crucial missed calls on LeBron James on consecutive possessions,2646,https://streamable.com/nspbd,1514242212,631
7m4193,ESPN crew not happy about no call at end of GSW/Cavs game,11799,https://streamable.com/1fxrk,1514241360,1788
7m3lg8,Durant and Green completely neutralize LeBron on a full head of steam,1425,https://streamable.com/9i5dc,1514236174,291
7m3dvb,Ref refuses to give Durant his 2nd technical (automatic ejection) midway through the 1st,4073,https://streamable.com/01lc2,1514233679,857
7m33nx,"""Go Tweet about it! You're a cornball, Embiid! A cornball!""",4032,https://streamable.com/srwei,1514230362,413
7lxi36,Isaiah Thomas Back at It Dunking Via His Wife’s Instagram Account (@kayla_jasmin_),1255,https://streamable.com/y7u0x,1514149730,224
7lxc5n,"LeBron on KD: ""He's always been the guy that has the opportunity to be next. I don't even want to say 'next'. He's been doing it at a high level for so long. It's not even 'next' or 'now'. He's one of the best players that we have in the world and he's proven that over and over again.""",2176,https://streamable.com/8p75c,1514147858,354
7lt1bw,#72 tries his hand at shooting as the Warriors keep struggling from deep,1137,https://streamable.com/5oxp8,1514086881,71
7lsyor,"Russell Westbrook to Donovan Mitchell: ""Don't stop!""",3307,https://streamable.com/7abni,1514085867,467
7lsnd1,Jerian Grant beats the 3rd quarter buzzer from his knees,1531,https://streamable.com/gb99d,1514081756,100
7lsm3v,Lance Makes 'Em Dance,2072,https://streamable.com/9dkz9,1514081305,179
7lsgpe,"Ibaka to DeRozan post-game: ""I don't wanna play with you no more...I'm going to go play with John Wall""",2833,https://streamable.com/qgbv1,1514079400,300
