id,title,score,url,created_utc,num_comments
78od5p,"LeBron James: ""Ever since I was a kid I learned every position on the floor. For some odd reason, I could learn every position on the floor all at one time. PG, SG, SF, PF and C and know all the plays what they're doing and what's the reads. I know every single play at every single position.""",1846,https://streamable.com/ygfrt,1508944900,576
78m6tc,Look at how effortlessly LeBron makes this cross court pass to Crowder,1282,https://streamable.com/d37mt,1508917232,291
78l05b,Wade’s handshake with Lebron..and Kevin Love.,3372,https://streamable.com/nh6pc,1508900888,367
78kxkz,Blake Griffin ends Rudy Gobert's life with the nasty poster dunk,8631,https://streamable.com/uofu3,1508900100,806
78k2zp,Klay Thompson's pregame ritual: Reading the newspaper.,1516,https://streamable.com/4eapq,1508890973,178
78k0vt,Jayson Tatum taking over the game on both ends of the floor,1456,https://streamable.com/6hztl,1508890419,351
78jwmi,Jaylen Brown throws down the thunderous reverse dunk on the fast break,2763,https://streamable.com/84s8y,1508889249,277
78juh0,Jayson Tatum flies in for the put back slam,1433,https://streamable.com/0c98t,1508888650,154
78hokz,Video of Kevin Durant watching Gordon Hayward's injury live,3446,https://streamable.com/5vh07,1508869283,648
78hfst,"LeBron defends Jordan Bell's self alley-oop: ""We’re all men. Stop me from dunking. We’re not trying to hurt nobody..You play the game until it's over. Yeah he threw it off the glass, dunked it, so what?""",13522,https://streamable.com/zpyvy,1508867227,1179
78gp4y,"[Amin Elhassan] ""This is a part of a continuing pattern of the best players in Phoenix saying I don't want to be here anymore, Goran Dragic, the Morris twins, [and now Bledsoe]. At some point, if you're a Suns fan, you got to stop and say why does everyone not want to be here anymore?""",1485,https://streamable.com/miqk4,1508860872,449
78gmdr,"Draymond yells:""Who is this?"" as Mavs rookie Gian Clavell enters the game",3373,https://streamable.com/skmz7,1508860207,742
78d47a,"Dejounte Murray told Pop to Chill He got this, After LMA Scuffle With Ibaka",2918,https://streamable.com/urqsi,1508815215,532
78d1dj,"LaMarcus Aldridge posts up Ibaka, gets the and-1 bucket to foul him out of the game",1485,https://streamable.com/g8629,1508814282,119
78czwe,Markelle Fultz tries a jumpshot,1972,https://streamable.com/6hhop,1508813807,719
78cysm,Jordan Bell SELF ALLEY OOP And-1,17274,https://streamable.com/rvev1,1508813464,1684
78cy0p,LaMarcus Aldridge and Serge Ibaka scuffle after Lowry gets elbowed - NBATV,1389,https://streamable.com/wietc,1508813236,347
78cu9g,Ref gets in the way of Harden's pass,5865,https://streamable.com/emmfh,1508812066,1083
78cu85,Chalmers trips Harden; Harden shoves Rio to the ground,3196,https://streamable.com/9muqz,1508812054,774
78ce73,Frank Kaminsky throws it down on Giannis,2041,https://streamable.com/2ai3d,1508807401,223
78cdw5,"[SINow] Stephen Curry consoles Devin Harris' nephew, who lost his father in a car accident last week",3161,https://streamable.com/jobsk,1508807315,162
7896de,"Dwyane Wade on asking to come off the bench: ""Looks like I'll probably be better with this team in that lineup so why wait?""",1333,https://streamable.com/mcw7p,1508778478,248
788ras,"Hey /r/nba, I made an android app featuring live scores (with game thread finder), highlights, alerts, reddit integration for this and all team subreddits and more! (free, no ads)",1005,https://www.reddit.com/r/nba/comments/788ras/hey_rnba_i_made_an_android_app_featuring_live/,1508774965,349
785b82,Anthony Davis blocks Lonzo Ball,1605,https://streamable.com/zot3g,1508731735,151
784gt7,Carmelo puts OKC up by 1 before Wiggins wins it at the buzzer,27814,https://streamable.com/3t2tl,1508721935,1987
784al7,Wiggins glides for the slam,1148,https://streamable.com/v88qf,1508720011,101
784933,Melo grabs a signature rebound,1470,https://streamable.com/m4cfg,1508719570,172
7844f7,Andre Roberson tries to compete with Fultz,2018,https://streamable.com/hijqb,1508718181,388
783y2g,Karl-Anthony Towns fucking hammers it down,2248,https://streamable.com/02831,1508716369,222
