id,title,score,url,created_utc,num_comments
7icjol,Embiid runs into Lonzo's dad after the game,1623,https://streamable.com/tuovv,1512708251,407
7ic303,Brandon Ingram with the three with 0.8 seconds left! - TNT,9148,https://streamable.com/t5m10,1512704386,1066
7ibd99,Julius Randle drops the hammer over Embiid,1649,https://streamable.com/u445f,1512697157,230
7i94kg,LeBron arguing with Bulls fan on the bench,1160,https://streamable.com/2kdke,1512676295,514
7i6jum,Rondo takes out two Nuggets leaving Boogie open for the dunk,1444,https://streamable.com/xh5ka,1512654410,133
7i5zs8,"Jimmy Butler on playing 40 minutes: “Yeah we need to talk to Thibs, these 40 minutes are starting to add up.”",2876,https://streamable.com/gedrc,1512648386,454
7i4eu0,Jimmy Butler is not impressed by Taj's half court heave to end the half,2886,https://streamable.com/p7zlq,1512626222,207
7i3ysi,Steve Kerr And Mike Brown Are Hyped After Nick Young's Ridiculous Pump Fake Step Back Jimbo,1342,https://streamable.com/5shtr,1512620869,122
7i3hwn,Korver with back-to-back-to-back 3's in 60 seconds to give the Cavs the lead,1572,https://streamable.com/me6sl,1512615967,189
7i36u2,Oladipo gets a steal and hits a game-winning three! - FS,3324,https://streamable.com/w6qkv,1512612879,382
7i36sd,"Bron says, ""I run this b***h!""",1833,https://streamable.com/5o1w3,1512612869,464
7i36gq,Bron dagger!,9360,https://streamable.com/8whn4,1512612796,1308
7i31ji,D-Wade to LeBron. A little PB&amp;J.,1044,https://streamable.com/bop08,1512611512,96
7i2ov3,Kyrie pins DSJ's shot against the glass,1354,https://streamable.com/ppxjn,1512608092,128
7i2oe6,LeBron James throws 5 insane passes in the first 6 possessions of the game!,3030,https://streamable.com/r2kxl,1512607956,326
7hv4xw,Serge Ibaka finger wags after blocking Alex Len - and Dikembe Mutombo loves it,8742,https://streamable.com/llnxr,1512529042,323
7huu9l,Joe Ingles stumps two all stars in one possession.,2527,https://streamable.com/j18g9,1512526194,186
7hti4s,Giannis insane finger roll,1459,https://streamable.com/wpg8e,1512513909,186
7hnsdi,LeBron James pays homage to Michael Jordan imitating his moves against the Bulls.,1132,https://streamable.com/07ndv,1512453924,208
7hn0cp,Donovan Mitchell flies up for the alley-oop from Ricky Rubio!,1260,https://streamable.com/v73r8,1512445177,148
7hmyd4,Steph Curry's nasty ankle injury,7199,https://streamable.com/5zwhg,1512444615,1057
7hmx6z,Kevin Durant and Demarcus Cousins both get ejected late in the fourth - NBCSBA,2231,https://streamable.com/tznlw,1512444295,1003
