id,title,score,url,created_utc,num_comments
7khuad,Lebron puts the defender in a blender for an and-1,2066,https://streamable.com/n81ia,1513559251,208
7kht4j,LeBron pins John Wall's layup attempt on the backboard,1041,https://streamable.com/ijswe,1513558895,132
7kh15a,Vince Carter gets a standing ovation and cheers from the Toronto crowd as he checks out for maybe the last time in Toronto - TSN,11892,https://streamable.com/7hjbl,1513550990,622
7kbvps,"CP3 hits 2 clutch baskets in a row then tells Harden, ""I gotchu""",2159,https://streamable.com/ubxvz,1513484839,297
7kbow2,Manu Ginobili wins it for the Spurs with a clutch layup! - FSSW,3243,https://streamable.com/2ztqc,1513482390,345
7kbmqu,LeBron has some uncovered words for Donovan Mitchell after the game,1328,https://streamable.com/00qkz,1513481635,195
7kbja3,Donovan Mitchell with the amazing spin move and dunk!,1360,https://streamable.com/snoc7,1513480421,137
7kbj14,James Harden to Tarik Black for the slam! - FSW,1274,https://streamable.com/nuyhl,1513480329,74
7kb4l4,"Melo booed on his first shot of the game, also cheered after he makes it",1313,https://streamable.com/dlg4o,1513475323,188
7kavlm,LeBron left-handed oop from Green,6758,https://streamable.com/zgdxk,1513472560,585
7karfu,Carmelo Anthony gets a tribute video and the cheers on his return to Madison Square Garden,2421,https://streamable.com/yiq4y,1513471207,277
7k92v9,[NBA] Ben Simmons mic’d up during OKC game!,1847,https://streamable.com/c0uqw,1513453724,271
7k8n6x,"Bron: ""Yeh i will be 33 in 15 days, this is my 15th season and this is the best i have ever felt in my career.. I WANT IT ALL""",2256,https://streamable.com/en3xt,1513449359,260
7k8jsw,LeBron is not happy about /u/IT-3 revealing his conversation with Lonzo to the public,3687,https://streamable.com/xpvgk,1513448429,494
7k87to,Chris Paul and Trevor Ariza are so in sync it's almost creepy,11306,https://streamable.com/yva6q,1513445030,327
7k83g4,"CP3 to Harden: ""Man I ain't never had help. I ain't never had help."" Harden to CP3: ""ᕕ(ʘᨎʘ)ᕗ""",3259,https://streamable.com/rpxar,1513443848,439
7k762y,"Dwane Casey on leaving Kyle Lowry on the court to chase his triple double: ""I told him that he had two minutes to get it done, I don't believe in messing with the game but I owe it to my veterans if they have something like that to get done""",1347,https://www.reddit.com/r/nba/comments/7k762y/dwane_casey_on_leaving_kyle_lowry_on_the_court_to/,1513433247,210
7k4pth,Westbrook and Embiid with some banter after the 3OT thriller,2977,https://streamable.com/z92oy,1513394142,621
7k4orr,Embiid another monster block on Russ,1046,https://streamable.com/lpxlp,1513393786,85
7k4nj4,Westbrook with the coast to coast thunderous slam!,1608,https://streamable.com/yyr14,1513393374,229
7k4mnx,JVG not happy with Embiid no call at end of OT2,1117,https://streamable.com/l32cb,1513393107,182
7k4kn9,Boogie goes behind the back and destroys a Plumlee,1326,https://streamable.com/u0ibx,1513392400,74
7k4izp,Embiid with a clutch block on Westbrook with 10 seconds left in OT,1809,https://streamable.com/hoqlu,1513391857,159
7k4gdt,"Paul George says ""Yes OT tonight""",8287,https://streamable.com/iabxb,1513390994,552
7k4fzo,Melo can't believe that Westbrook won't pass him the ball,3516,https://streamable.com/qbsw3,1513390850,761
7k41i4,DeRozan soars and dunks with his left hand off the Lowry lob,1236,https://streamable.com/agdmn,1513386359,68
7k417z,Andre Roberson gorgeous three-pointer,2671,https://streamable.com/87zeu,1513386275,265
