id,title,score,url,created_utc,num_comments
7ej3ug,Rodney Hood Jedi mind trick,1332,https://streamable.com/90prl,1511282194,104
7eihs7,"Charles Barkley says Clippers are going to the Western Conference Finals, Clippers proceed to lose 9 in a row",7701,https://streamable.com/qkbrb,1511277169,482
7efmhv,Klay Thompson offers his thoughts regarding walking under scaffolding on NY nighttime news.,2571,https://streamable.com/atl40,1511243344,313
7eewh5,Two insane saves by Tatum and Smart lead to the clutch Kyrie 3 pointer,1773,https://streamable.com/7g46f,1511235786,173
7eej3v,DeMarcus Cousins receives a flagrant-2,1962,https://streamable.com/o19w4,1511232224,680
7eec5e,Donovan Mitchell commits the tech after Embiid swats his layup,5209,https://streamable.com/lo0xa,1511230388,883
7eddlj,"Guy at Lakers game smells his rancid Ranch dressing while eating his chicken tenders, eats it anyways..Hilarity ensues.",16683,https://streamable.com/75og0,1511221787,729
7e9pmf,"LeBron on Reggie Jackson interrupting Butler's FT: ""I've done it before. I've won a playoff series doing that before actually. So I'm all for it.""",2839,https://streamable.com/agnk2,1511192691,421
7e5ziy,Nikola Jokic and Mike Malone both get ejected - SSN,1792,https://streamable.com/96ofn,1511148834,507
7e5xfq,Mudiay stops a 5-1 Lakers fastbreak - SSN,2495,https://streamable.com/ppe7l,1511148227,137
7e5ni8,Reggie Jackson inturrupts Jimmy Butler's FT attempt causing him to miss the game tying FT,2620,https://streamable.com/5l89m,1511145527,306
7e46dm,DeMar DeRozan throws it down and closes the game,1604,https://streamable.com/rejft,1511131484,144
7e3w0s,Kerr breaks out a slinky as he waits for reporters to finish tweeting the news that Casspi will start in place of Durant,2305,https://streamable.com/bi2gr,1511129044,214
7e1eai,Marc Gasol t'd up for kicking Capela's shoe out of bounds (ft. Lil Jon),1838,https://streamable.com/y6eia,1511107211,295
7dy5qj,"WATCH: Kevin Durant ""we didn't want to lose to these guys, especially Joel, he would've went straight to twitter and talked shit""",3675,https://streamable.com/jpfsj,1511063601,374
7dxxp9,Sexual Tension in the Philly Broadcast Booth,2347,https://streamable.com/x218m,1511061050,284
7dxl82,Jim and Bob don’t get the joke,1449,https://streamable.com/ss0nd,1511057370,145
7dxenr,"After bricking 3s after 3s, a Philly fan channels his inner Covington and drills the half-court shot to win a Chick-Fil-A biscuit for the whole crow",4307,https://streamable.com/g5oay,1511055426,388
