id,title,score,url,created_utc,num_comments
7ikrxm,Kyrie Irving's game tying 3 just rims out,1009,https://streamable.com/q7yb5,1512795323,154
7ikrch,Manu Ginobilli go ahead basket with 5 seconds left,8814,https://streamable.com/dm70u,1512795101,688
7ikly5,Jaylen Brown flies for the putback dunk over Pau Gasol,1622,https://streamable.com/bx2ey,1512793185,142
7ikamw,"Z-Bo talking about Boogie: “In my hood, bullies get bullied.”",1545,https://streamable.com/p2gow,1512789621,351
7ijxb1,Victor Oladipo puts Love on skates and sinks the three in crunch time,1563,https://streamable.com/qc0vu,1512786193,233
7ij8rw,"Dwight gets faked out of his shoes, recovers for the block, and takes it coast-to-coast",2951,https://streamable.com/dozy2,1512778902,243
7ii0w9,Lillard glow in the dark rollerskating with his Mom (yes for real),1119,https://streamable.com/6b9sw,1512767463,100
7ihijn,John Collins makes 400 dollars by jumping into the training facility pool while it's snowing,1186,https://streamable.com/80dti,1512763037,208
7icjol,Embiid runs into Lonzo's dad after the game,3052,https://streamable.com/tuovv,1512708251,625
7icijz,John Wall interviewing Bradley Beal after his 37 point performance,1100,https://streamable.com/0ov6h,1512707962,142
7ic303,Brandon Ingram with the three with 0.8 seconds left! - TNT,10972,https://streamable.com/t5m10,1512704386,1206
7ibgz8,"Ben Simmons with the ""Rondo-like"" fake and drive for 2",1149,https://streamable.com/m7rye,1512698165,86
7ibd99,Julius Randle drops the hammer over Embiid,1962,https://streamable.com/u445f,1512697157,271
7ibc78,Brandon Ingram throws down a reverse dunk,1281,https://streamable.com/87qsb,1512696874,108
7i94kg,LeBron arguing with Bulls fan on the bench,1256,https://streamable.com/2kdke,1512676295,566
7i6jum,Rondo takes out two Nuggets leaving Boogie open for the dunk,1458,https://streamable.com/xh5ka,1512654410,133
7i5zs8,"Jimmy Butler on playing 40 minutes: “Yeah we need to talk to Thibs, these 40 minutes are starting to add up.”",2896,https://streamable.com/gedrc,1512648386,455
7i4eu0,Jimmy Butler is not impressed by Taj's half court heave to end the half,2901,https://streamable.com/p7zlq,1512626222,210
7i3ysi,Steve Kerr And Mike Brown Are Hyped After Nick Young's Ridiculous Pump Fake Step Back Jimbo,1338,https://streamable.com/5shtr,1512620869,121
7i3hwn,Korver with back-to-back-to-back 3's in 60 seconds to give the Cavs the lead,1575,https://streamable.com/me6sl,1512615967,189
7i36u2,Oladipo gets a steal and hits a game-winning three! - FS,3319,https://streamable.com/w6qkv,1512612879,381
7i36sd,"Bron says, ""I run this b***h!""",1834,https://streamable.com/5o1w3,1512612869,471
7i36gq,Bron dagger!,9375,https://streamable.com/8whn4,1512612796,1301
