id,title,score,url,created_utc,num_comments
7k8jsw,LeBron is not happy about /u/IT-3 revealing his conversation with Lonzo to the public,1056,https://streamable.com/xpvgk,1513448429,274
7k87to,Chris Paul and Trevor Ariza are so in sync it's almost creepy,4257,https://streamable.com/yva6q,1513445030,171
7k83g4,"CP3 to Harden: ""Man I ain't never had help. I ain't never had help."" Harden to CP3: ""ᕕ(ʘᨎʘ)ᕗ""",1426,https://streamable.com/rpxar,1513443848,220
7k4pth,Westbrook and Embiid with some banter after the 3OT thriller,2874,https://streamable.com/z92oy,1513394142,604
7k4orr,Embiid another monster block on Russ,1012,https://streamable.com/lpxlp,1513393786,84
7k4nj4,Westbrook with the coast to coast thunderous slam!,1566,https://streamable.com/yyr14,1513393374,221
7k4mnx,JVG not happy with Embiid no call at end of OT2,1077,https://streamable.com/l32cb,1513393107,174
7k4kn9,Boogie goes behind the back and destroys a Plumlee,1272,https://streamable.com/u0ibx,1513392400,70
7k4izp,Embiid with a clutch block on Westbrook with 10 seconds left in OT,1750,https://streamable.com/hoqlu,1513391857,157
7k4gdt,"Paul George says ""Yes OT tonight""",8123,https://streamable.com/iabxb,1513390994,540
7k4fzo,Melo can't believe that Westbrook won't pass him the ball,3353,https://streamable.com/qbsw3,1513390850,720
7k41i4,DeRozan soars and dunks with his left hand off the Lowry lob,1208,https://streamable.com/agdmn,1513386359,68
7k417z,Andre Roberson gorgeous three-pointer,2575,https://streamable.com/87zeu,1513386275,255
7k0uzk,Ron 'DPOY' Baker 3 straight 4th quarter defensive plays to win the Knicks the game against Brooklyn [credit @TheKnicksWall],1644,https://streamable.com/v4qch,1513356236,209
7k0el0,One Year Ago Today We Lost The Great Craig Sager,4276,https://streamable.com/alndm,1513352101,135
7jzj6c,"A mic on the court caught most of LeBron and Lonzo's conversation last night: ""Find your zone and just stay fucking locked in. The media is going to ask you what I told you right now (but so what). Just be aggressive every single day. (Inaudible)..it's white noise. That's all it is. Alright?""",11723,https://streamable.com/whixj,1513342659,1199
7jxvtw,Klay Thompson 4 straight 3s in fourth quarter against Dallas,1515,https://streamable.com/0z3sm,1513317885,212
7jxpfv,"Fan is hit by ball, KD comes over and kisses her on forehead",1969,https://streamable.com/dxjor,1513315613,510
7jxf0x,"LeBron: ""[Lonzo] has said over and over since he was growing up who was his favorite player, and it was me and I was humbled by that. Wishing him a happy bday was a salute back to him..I see all the stupid noise that happens. I can't buy a place in LA, can't live in LA. It's funny noise.""",1971,https://streamable.com/wy9ml,1513312219,393
7jx3mb,LeBron has some words for Lonzo,3812,https://streamable.com/zasik,1513308630,602
7jwvue,[Inside the NBA] Chuck with the cheap shot,1453,https://streamable.com/a6p0z,1513306269,142
7jwt7c,Lonzo Ball full court pass to Ingram,2577,https://streamable.com/0c5ya,1513305498,207
7jwn2k,Fan at Hawks game hits half court shot for $10K,2301,https://streamable.com/k2wp4,1513303665,259
7jwmv9,Brook Lopez (80% FT%) airballs 2 freethrows,2692,https://streamable.com/l65mu,1513303601,227
7jwmmj,LeBron throws the hammer down as Brook Lopez clears the runway,1030,https://streamable.com/9jqd5,1513303534,126
7jwe6h,Lebron getting slapped across the face with no foul,1369,https://streamable.com/tjzi1,1513301115,280
7jueni,"Joel Embiid explains his Instagram response to Towns: ""They call me 'Tro-el Embiid,' so I don't let things go by.""",1278,https://streamable.com/4xzy8,1513283220,126
7jttyc,I think we will see murder in live TV,19483,https://streamable.com/7setx,1513278475,984
7jtbpj,"Scottie Pippen asked about LeBron vs. Jordan: ""[LeBron] will probably never catch him, in terms of MVPs, but in terms of statistics, LeBron is right there. When you look across the board, not just scoring, check his assists, check his rebounds. He is probably ahead of Jordan.""",1191,https://streamable.com/umg6p,1513274465,659
7jsmee,Salah Mejri tried to kick Patty Mills while walking off the court,2489,https://streamable.com/ljsoj,1513268496,673
