id,title,score,url,created_utc,num_comments
79l1a2,JR Smith blank staring for 18 seconds,1014,https://streamable.com/5cljk,1509331552,119
79kmi7,KD with the Space Jam dunk!,1690,https://streamable.com/kqz0q,1509326729,145
79jry4,Victor Oladipo hit the 3 over LaMarcus Aldridge to give the Pacers the lead with 10.3 seconds left,2196,https://streamable.com/zrfxs,1509317575,323
79jq6f,Steph came to the arena in costume 😂😂,6721,https://streamable.com/uczx3,1509317057,319
79ik7k,Anthony Davis and DeMarcus Cousins visit a haunted house,12202,https://streamable.com/0451j,1509305548,467
79ea05,Donovan Mitchell flies for the unbelievable putback slam,4542,https://streamable.com/3dld7,1509245411,303
79e2gl,"""Wessell Russbrook""",11440,https://streamable.com/z4dpa,1509242601,443
79dsz1,Ben Simmons with a ridiculous wrap-around pass to Embiid,2543,https://streamable.com/dek38,1509239122,289
79dfdg,Beautiful ball movement by the Pelicans,4642,https://streamable.com/xt67c,1509234440,265
79bfha,Gortat holds Klay for the last 1.1 seconds of the game,2942,https://streamable.com/g251g,1509212388,354
79acde,Reporter nervously forgets question while talking to KD.,4378,https://streamable.com/il8zc,1509200519,302
798ck8,Kevon Looney puts Kelly Oubre Jr on a poster! - NBATV,1664,https://streamable.com/uyomh,1509166393,158
7989nb,Steph gets John Wall to take the bait and makes him pay!,5790,https://streamable.com/vewnp,1509165140,412
7984b1,"Fan shouts ""Fuck you mother fucker!"" at Bradley Beal",1422,https://streamable.com/m2a2d,1509163021,308
7983rl,John Wall tells Steph Curry to stop flopping,1420,https://streamable.com/7cwtx,1509162796,511
7981v0,Kelly Oubre Jr. Retroactive suspension?,1985,https://www.reddit.com/r/nba/comments/7981v0/kelly_oubre_jr_retroactive_suspension/,1509162042,641
7980z9,Draymond Green / Bradley Beal scuffle,8827,https://streamable.com/corf5,1509161698,2316
7980o3,Warriors putting in A LOT of work for a basket,1039,https://streamable.com/ytzyf,1509161581,38
797ndr,Popovich mistakes Ross for Simmons and puts him in a headlock,4026,https://streamable.com/rvte9,1509156559,298
