id,title,score,url,created_utc,num_comments
7n2sbw,"LeBron talks about how difficult it was to sneak into clubs as an NBA rookie because everyone knew his real age. Asked about having a fake ID: ""Nah, I ain't never had one of those. I wish. Who was I gonna be? Shit. Use my dad's card? Ha! Funny.""",1293,https://streamable.com/3lwdp,1514655216,209
7mztiy,KCP tries to throw the ball off the backboard. Misses the backboard entirely.,1748,https://streamable.com/hcmxx,1514611701,214
7mz7gi,Giannis's Game winner incorrectly not ruled out of bounds,4070,https://streamable.com/lk9gs,1514604127,856
7mz6x7,Westbrook ties it with 4.7 seconds left!,1108,https://streamable.com/vgr2v,1514603949,120
7mz0xd,Russell Westbrook crushes Thon Maker with a huge rim shaker!,11182,https://streamable.com/644z3,1514601947,674
7myr11,Brogdon dunks on Westbrook,1020,https://streamable.com/sfwfk,1514598808,90
7myc7o,Tomáš Satoranský dunk on Zhou Qi,1187,https://streamable.com/1wxtg,1514594413,158
7mxjss,Spurs' Unreal Ball Movement,2176,https://streamable.com/qu2x5,1514586566,148
7mwwq0,"IT asked if he thinks he might get a good reception in Boston: ""Might? Well it better be good. Nah, it will be good. If I'm able to play it's gonna be a really special game for me. I gave my heart to that city and they showed genuine love back. That's how we feel about each other.""",5571,https://streamable.com/3az61,1514580287,353
7mv71p,"Tony Parker on Frank Ntilikina: ""He's obviously a great defender. Offense will come, since it's his 1st year so he needs to go around the league and get used to all the PGs. I don't know if New York will be patient (laughs), but I think he can be succesful in this league.""",1885,https://streamable.com/1moa7,1514564118,232
7mukrk,KG's live reaction to the end of the Celtics-Rockets game,3786,https://streamable.com/9t9x0,1514557521,337
7mub18,Jeremy Lin gets fanmail asking him to sign an Atlanta Hawks Paul Millsap basketball card,2038,https://streamable.com/cc5kl,1514554139,246
7msyy4,"TNT crew watches video of IT's sons making fun of Shaq. Chuck: ""Next time I see you little kid, I'm gonna punch you in your left eye."" Shaq: (Takes off belt and starts slapping the table with it)",1553,https://streamable.com/k4jeh,1514533634,298
7msljo,"Nurkic: ""Aboudadabudabu"" lmmfao",1008,https://streamable.com/2ivxh,1514528422,122
7msjdo,"Gregg Popovich says ""Big Booty""",3502,https://streamable.com/qlan1,1514527650,177
7mrwgn,"Overshadowed by Harden's back-to-back offensive fouls, there was also this gem of a 3-point attempt with the Rockets holding a 2 point lead with 30 seconds left and 14 seconds left on the shot clock.",1856,https://streamable.com/s3tpp,1514520087,450
7mrt0a,Harden gives away Celtics a free win FULL SEQUENCE,8497,https://streamable.com/b9fe0,1514519024,1528
7mrss4,Harden commits another offensive foul on Smart to seal the game! - TNT,1796,https://streamable.com/pkb0e,1514518950,266
7mrrxp,"Celtics bring it within a single point, then Harden fouls Smart!",1503,https://streamable.com/ck57l,1514518686,280
7mquwd,The Magic 4 on 1 fastbreak,3642,https://streamable.com/6wp2r,1514508860,247
7mp59u,Bill Nye calls out Kyire on his Flat-Earth theories,1472,https://streamable.com/t9lc6,1514492610,620
7mnu5q,Joakim Noah and Kyle O’Quinn argue about Bar Mitzvahs,1141,https://streamable.com/kowi1,1514480877,159
7mkbef,"Jimmy Butler on what kind of gear he reached in overtime: ""A gear where I don't pass, obviously""",1388,https://streamable.com/isa1s,1514434871,104
7mk44j,"Jimmy Butler has a small reminder for Jamal Murray... That he can't ""fuck with him""",2211,https://streamable.com/nopqk,1514432553,281
