id,title,score,url,created_utc,num_comments
7937tq,Impressive lock down on Giannis by a rookie,1497,https://streamable.com/tppzq,1509110781,214
791qeo,"Chuck on Kyrie's comments on the gym floor of the Mecca: ""This is the same dude that says he believes in flat earth? ... And Ernie I got one worse than flat earth theory, this is the same dude that don't want to play with LeBron. His credibility is SHOT""",3408,https://streamable.com/n2vk6,1509088942,562
79127z,Blake Griffin wins the game with the buzzer beater 3 pointer,10596,https://streamable.com/zx0bi,1509078928,1271
790fya,Lauri Markkanen hits the dagger three to put the Bulls up 4,1126,https://streamable.com/qbmly,1509071128,214
790fsh,Kyrie Irving freezes Giannis with the hesitation and floats the lay up just out of his reach,1554,https://streamable.com/76imc,1509071082,138
7907sv,"Draymond, tired of kicking his legs so high, whips the ball at Kyle Lowry's balls",2109,https://streamable.com/maykb,1509068572,361
790546,Klay Thompson attempts to start a race.,4605,https://streamable.com/7sryj,1509067696,360
78zzr8,Irving gets free and floats it in with some wicked handle on Brogdon - TNT,3096,https://streamable.com/ej6cb,1509066005,309
78zxfg,Baynes contests Giannis' insane dunk attempt and goes down hard,2006,https://streamable.com/lb5a3,1509065249,375
78zulw,Only the highest quality of basketball being played in the Bulls-Hawks game,2572,https://streamable.com/ff1kw,1509064384,225
78tfkq,[Highlight] KD's pullup 3 to tie the game late because it needed to be posted.,1038,https://streamable.com/qkv32,1508994181,155
78tedl,Curry channeling China Klay after the whistle,4125,https://streamable.com/cecp7,1508993722,216
78tdve,[HIGHLIGHT] Durant to Curry for the DEEP three to take the lead!,2219,https://streamable.com/fqibs,1508993524,362
78t513,John Wall explodes past Lonzo,2848,https://streamable.com/wn9qu,1508990350,331
78sas3,Eric Gordon beats the 6ers at the buzzer,11534,https://streamable.com/flyqg,1508980843,980
