id,title,score,url,created_utc,num_comments
7fk1vz,Referee's terrible foul call against Jordan Bell,1096,https://streamable.com/vpwz0,1511664413,209
7fjmk3,Kyrie Irving drops Darren Collison and gets the easy layup,2118,https://streamable.com/3q366,1511659923,189
7fgsmr,Jayson Tatum looks at the wrong camera.,15844,https://streamable.com/bgf93,1511632858,414
7fdctp,Looks like Jordan Bell makes a money gesture and says 3.5 after the and 1.,1677,https://streamable.com/ratfd,1511589331,186
7fcp6c,Westbrook badly misses two threes down the stretch of the fourth quarter,2173,https://streamable.com/rees7,1511581528,402
7fcnpy,Westbrook misses game-winning three,1117,https://streamable.com/30dqv,1511581049,380
7fcacr,Kerr practices his shuffling as he announces that Casspi and Bell will start in place of Durant and Green,1561,https://streamable.com/swj37,1511576850,210
7fc8sv,LeBron with the LeFuckYou3 from 40 feet,15162,https://streamable.com/jq5kb,1511576361,927
7fc52f,Dwight Howard makes a gesture,3147,https://streamable.com/c3i2m,1511575195,302
7fbwpr,Marcus Smart gets up and destroys Bismack Biyombo’s hook shot,1042,https://streamable.com/g68pw,1511572694,87
7f5nzg,"From yesterday's Knicks-Raptors game, Ref takes a slide and Tim Hardaway calls him safe",1172,https://streamable.com/yvu27,1511505770,65
7f201q,Steph Curry makes a tough finger roll with a squash. Denzel Washington in disbelief.,1706,https://streamable.com/im5rs,1511466022,199
7ex3h9,Devin Booker with the tough buzzer beater to force overtime,3306,https://streamable.com/n98qn,1511411836,274
7ex2wt,Lonzo Ball throws down the one-handed alley-oop,2158,https://streamable.com/6zxnc,1511411654,139
7ex0lh,Stephen Curry and Kevin Durant on the bench laughing at Westbrook's failed attempt to get a triple double (credit to u/Metsvault),2287,https://streamable.com/83flx,1511410957,1163
7ewpeu,Harrison Barnes sinks the winning 3 pointer with 0.5 seconds left.,4117,https://streamable.com/at64r,1511407677,395
7ewh9y,"Melo gets pissed at Russ for stealing his rebound, drains a 3 at the other end",1390,https://streamable.com/fj7zi,1511405319,145
