id,title,score,url,created_utc,num_comments
7k4pth,Westbrook and Embiid with some banter after the 3OT thriller,2241,https://streamable.com/z92oy,1513394142,556
7k4nj4,Westbrook with the coast to coast thunderous slam!,1263,https://streamable.com/yyr14,1513393374,185
7k4izp,Embiid with a clutch block on Westbrook with 10 seconds left in OT,1401,https://streamable.com/hoqlu,1513391857,149
7k4gdt,"Paul George says ""Yes OT tonight""",6854,https://streamable.com/iabxb,1513390994,473
7k4fzo,Melo can't believe that Westbrook won't pass him the ball,2440,https://streamable.com/qbsw3,1513390850,547
7k417z,Andre Roberson gorgeous three-pointer,2026,https://streamable.com/87zeu,1513386275,238
7k0uzk,Ron 'DPOY' Baker 3 straight 4th quarter defensive plays to win the Knicks the game against Brooklyn [credit @TheKnicksWall],1608,https://streamable.com/v4qch,1513356236,205
7k0el0,One Year Ago Today We Lost The Great Craig Sager,4173,https://streamable.com/alndm,1513352101,133
7jzj6c,"A mic on the court caught most of LeBron and Lonzo's conversation last night: ""Find your zone and just stay fucking locked in. The media is going to ask you what I told you right now (but so what). Just be aggressive every single day. (Inaudible)..it's white noise. That's all it is. Alright?""",11591,https://streamable.com/whixj,1513342659,1193
7jxvtw,Klay Thompson 4 straight 3s in fourth quarter against Dallas,1512,https://streamable.com/0z3sm,1513317885,209
7jxpfv,"Fan is hit by ball, KD comes over and kisses her on forehead",1969,https://streamable.com/dxjor,1513315613,511
7jxf0x,"LeBron: ""[Lonzo] has said over and over since he was growing up who was his favorite player, and it was me and I was humbled by that. Wishing him a happy bday was a salute back to him..I see all the stupid noise that happens. I can't buy a place in LA, can't live in LA. It's funny noise.""",1962,https://streamable.com/wy9ml,1513312219,392
7jx3mb,LeBron has some words for Lonzo,3817,https://streamable.com/zasik,1513308630,602
7jwvue,[Inside the NBA] Chuck with the cheap shot,1447,https://streamable.com/a6p0z,1513306269,142
7jwt7c,Lonzo Ball full court pass to Ingram,2573,https://streamable.com/0c5ya,1513305498,208
7jwn2k,Fan at Hawks game hits half court shot for $10K,2299,https://streamable.com/k2wp4,1513303665,259
7jwmv9,Brook Lopez (80% FT%) airballs 2 freethrows,2688,https://streamable.com/l65mu,1513303601,228
7jwmmj,LeBron throws the hammer down as Brook Lopez clears the runway,1033,https://streamable.com/9jqd5,1513303534,126
7jwe6h,Lebron getting slapped across the face with no foul,1371,https://streamable.com/tjzi1,1513301115,279
7jueni,"Joel Embiid explains his Instagram response to Towns: ""They call me 'Tro-el Embiid,' so I don't let things go by.""",1273,https://streamable.com/4xzy8,1513283220,126
7jttyc,I think we will see murder in live TV,19462,https://streamable.com/7setx,1513278475,982
7jtbpj,"Scottie Pippen asked about LeBron vs. Jordan: ""[LeBron] will probably never catch him, in terms of MVPs, but in terms of statistics, LeBron is right there. When you look across the board, not just scoring, check his assists, check his rebounds. He is probably ahead of Jordan.""",1187,https://streamable.com/umg6p,1513274465,658
7jsmee,Salah Mejri tried to kick Patty Mills while walking off the court,2490,https://streamable.com/ljsoj,1513268496,670
7jp44e,Udonis Haslem faints after Wayne Ellington's sixth 3 pointer in a row,2188,https://streamable.com/lj74z,1513224362,128
