id,title,score,url,created_utc,num_comments
784gt7,Carmelo puts OKC up by 1 before Wiggins wins it at the buzzer,24131,https://streamable.com/3t2tl,1508721935,1754
7844f7,Andre Roberson tries to compete with Fultz,1560,https://streamable.com/hijqb,1508718181,314
783y2g,Karl-Anthony Towns fucking hammers it down,1839,https://streamable.com/02831,1508716369,183
781lb8,"Josh Jackson shooting gesture at a fan and telling him/her ""f*** you""",1864,https://streamable.com/gmhhq,1508693283,468
78034h,Grizzlies DJ channels Tommy Wiseau after Gasol's basket,1002,https://streamable.com/usdoz,1508677610,59
77y0va,Joe Ingles is becoming one of the premier trash talkers of the league,1093,https://streamable.com/tttwu,1508643298,137
77xv8z,Giannis with the clutch block to preserve the Bucs' lead!,1172,https://streamable.com/wj2ca,1508641337,137
77xuxn,Giannis forces the turnover and then gets the go ahead dunk on the run out with 11 seconds left,1352,https://streamable.com/ynxoz,1508641230,102
77xqvj,Steph Curry and Kevin Durrant get ejected on the same play,1953,https://streamable.com/ibryo,1508639814,367
77xq40,Curry tossing his mouthpiece (h/t:@vineydelnegro),1553,https://streamable.com/vxko1,1508639548,333
77xpsi,KD's reaction to getting ejected (h/t:@vineydelnegro),2293,https://streamable.com/ethqm,1508639439,590
77xh86,Marc Gasol nasty move on Klay Thompson followed by a 3,4023,https://streamable.com/hutup,1508636464,284
77xb99,Markelle Fultz horrible free throw attempt,3410,https://streamable.com/olcno,1508634438,933
77x3vz,James Johnson dunks Victor Oladipo into oblivion,4054,https://streamable.com/q4luu,1508631929,255
77t7j7,De'Aaron Fox with Kameha shot,3541,https://streamable.com/bc9m8,1508590707,523
77r9s5,"Lakers Corey Brewer calling for the ball for a good 15 seconds, but to no avail",2749,https://streamable.com/n3v7g,1508558119,253
77r5ls,"DRose comments on the personal foul by Monroe that led to his ankle sprain: ""I think I'm the only person in the league that isn't getting that call for a flagrant. For sure I'm the only player. Go back and look at the history, it's there.""",1395,https://streamable.com/2u6xl,1508556569,327
