id,title,score,url,created_utc,num_comments
7vc4do,Joel Embiid dropped by on Philadelphia's FOX29 live news station outside after a Superbowl win,6750,https://streamable.com/i16y9,1517803092,317
7vbl7b,[SI] Steph Curry gets booed at the Super Bowl,2534,https://streamable.com/wmij5,1517797645,522
7va8wi,Giannis doesn't want a fan to be wearing a BBB hoodie so he gives him his own hoodie.,2742,https://streamable.com/5x3as,1517784115,274
7v8zrg,"Ref calls a 3-point shooting foul against the Knicks; Hawks shoot 2 free-throws instead of 3; Knicks get fouled on a made basket on the other end; refs realize Hawks only shot 2 free-throw, debate, then erase the Knicks and-1 basket",1618,https://streamable.com/j09l0,1517773239,201
7v8ug2,Al Horford drains the game winner against Portland,8407,https://streamable.com/cnunb,1517771967,712
7v8u0w,Bazemore's anti-tank missile with 6.7 seconds left,3185,https://streamable.com/r6idv,1517771868,178
7v8s7d,Refs rewind the game 17 seconds after they forget to give Bazemore a free throw,1631,https://streamable.com/qojrr,1517771439,219
7v8gss,Antetokounmpo doesn't care if you're already dead,1635,https://streamable.com/cxdvq,1517768742,146
7v819u,OG Anunoby blows a wide open dunk... and then totally redeems himself!,1502,https://streamable.com/gajek,1517764996,70
7v4s0i,"LeBron James: “I’m lost for words, actually. Going 0-8 on national television. They should take us off every nationally televised game for the rest of the season.",4887,https://streamable.com/w0s7i,1517720149,614
7v4mib,Intentional Missed Dunk Assist to Jokic,1652,https://streamable.com/404qf,1517718271,171
7v4c46,Chris Paul makes a playground pass to Nene before Cleveland boos their team's effort,1539,https://streamable.com/yspzh,1517714934,140
7v46ru,"""And we'll take a timeout... Fans even tired of booing, here in Cleveland..."" (Cavs down by 35)",1934,https://streamable.com/fpk6o,1517713212,264
7v43de,"It's hard to tell, but I think LeBron James is a tad perturbed.",3737,https://streamable.com/ntusz,1517712149,605
7v3z82,Isaiah Thomas falls down after a turnover and his teammates almost forget to pick him up,1491,https://streamable.com/alyyl,1517710841,359
7v3x6a,Gerald Green blocks LeBron,2076,https://streamable.com/mvvun,1517710206,148
7v3g3j,Classic Lance rebound + gallop + no look,1579,https://streamable.com/utfv9,1517705204,121
7v2q0j,Bulls start the game strong,1568,https://streamable.com/0y1xc,1517697994,131
7v0f4v,"Gary ""Gary Harris"" Harris",2881,https://streamable.com/6xumb,1517676627,273
7uzj3w,"Chuck:"" Dan D'Antoni is offensive genius. He turns Steve Nash in to a good player to a hall of famer."" Kenny: ""And a MVP"". Ernie: ""Twice over"". Chuck: "" C'mon Shaq let go"". Funny moment in the end of the video.",1696,https://streamable.com/petm1,1517667421,601
7uyk46,Bogdan Bogdanovic with a vicious foul on Kevin Durant!,1483,https://streamable.com/0n9hh,1517652613,270
7uxirl,Utah with beautiful ball movement for a Very Solid Play,2494,https://streamable.com/8umcu,1517635989,151
