id,title,score,url,created_utc,num_comments
7wqixs,Dirk vs Isaiah Thomas,1476,https://streamable.com/ars97,1518320687,160
7wqcbb,Klay Thompson throws it down!,2240,https://streamable.com/w3vx4,1518318565,200
7wq34l,Isaiah Thomas crossover and three! - SSN,1427,https://streamable.com/ftvd9,1518315697,231
7wq2so,Dirk with his first dunk of the season!,1334,https://streamable.com/dct54,1518315600,104
7wpyhn,Isaiah with his first shot as a laker,7996,https://streamable.com/poyp4,1518314287,561
7wpnep,Ben Simmons fakes the behind-the-back and swings in for 2,1145,https://streamable.com/0ftta,1518310934,155
7wpinv,Nets giving Rondo a chance to experience 2010 again,1910,https://streamable.com/jbm5o,1518309551,192
7wnuy1,Jordan Clarkson asked if he'll miss being around Lonzo's dad,2928,https://streamable.com/c2fd9,1518293426,291
7wnb3e,"Tobias Harris on beating Pistons, his former team: ""It's like seeing your ex-girlfriend for the first time with her new man and you've got a new girl.""",1526,https://streamable.com/0lrri,1518288431,96
7wn046,Joe Ingles explodes to the rim and finishes over Dwight,2012,https://streamable.com/oinzz,1518285683,157
7wmqy9,DeAndre Jordan on if he feels wanted by the Clippers: “I don’t know”,1596,https://streamable.com/1xcgc,1518283412,279
7wmii2,"Larry Nance Jr. looking pretty excited to be on the Cavs..Hawks player: ""You going to the playoffs?"" Larry: ""Upgrade. UPGRADE.""",3289,https://streamable.com/v79gc,1518281271,518
7wjiyw,"Lillard deep three for this 50th point of the night, shooting 8/12 from three, with time left in the third quarter.",1935,https://streamable.com/sp5rr,1518239604,167
7wjbox,[ESPN] Thibs gets called for a technical foul for shouting at his own player,4537,https://streamable.com/qyw3b,1518237139,566
7wj1kj,Superfan travels from Taiwan to watch Vince Carter play. Vince meets him to throw down an alley oop from him,8516,https://streamable.com/lhwel,1518233831,462
7wiwob,Bam Adebayo with a ridiculous block as he catches the ball in the mid-air,1151,https://streamable.com/axpv7,1518232271,70
7wiuu9,Donovan Mitchell with the huge fastbreak slam,2028,https://streamable.com/nf2j2,1518231709,194
7wipb4,Kyle Korver 4 straight threes,2883,https://streamable.com/m58u8,1518230095,235
7wim0k,Blake Griffin immediately walks off court following loss to Clippers.,1118,https://streamable.com/yeer0,1518229135,147
7wifdl,Blake with the big block on Montrezl Harrell's dunk attempt,2086,https://streamable.com/cka7p,1518227210,136
7widfv,Wade's first points in a Heat uniform ;),2396,https://streamable.com/jtsg6,1518226653,140
7wibk3,DWade checks in for the first time in a while,5211,https://streamable.com/6ld0y,1518226156,376
7wiai8,"Hawks fans chanting ""LeBron will leave you"" to Tristan Thompson at the FT line.",4805,https://streamable.com/4pu6j,1518225850,413
7wi9an,Lebron with the casual pass,2033,https://streamable.com/is9si,1518225496,140
7wht48,KAT and Zach Lavine re-unite prior to the Wolves-Bulls game,1181,https://streamable.com/4bsg9,1518221166,81
7wfy89,[OC] Film Study: The Raptors run a Spanish pick and roll to perfection against the Knicks,2889,https://www.reddit.com/r/nba/comments/7wfy89/oc_film_study_the_raptors_run_a_spanish_pick_and/,1518204767,143
