id,title,score,url,created_utc,num_comments
7r6iws,"After MCW is unable to continue, Scott Brooks chooses Dwight Howard to shoot two free throws in garbage time. Dwight drains them, blows a kiss to Scott Brooks, and shows his big balls",1832,https://streamable.com/a42c3,1516242802,231
7r624n,Lauri Markkanen block off Steph's head,8766,https://streamable.com/iykf1,1516238343,493
7r61ad,Jordan Bell Gets Injured During the First Play of the Game :-(,1049,https://streamable.com/jlfwk,1516238125,195
7r5oyn,"Steve Kerr when asked if there are any secret hallways in the United Center: ""Is there one that gets to Fred Hoiberg's locker room?"" 'cause if I get pissed at him tonight I'm going right down the hallway.""",1097,https://streamable.com/0o11v,1516234995,76
7qyj3n,Referees swallow their whistles when Dallas is trying to intentionally foul in the final ten seconds.,2520,https://streamable.com/b5qlq,1516163648,478
7qy9xx,"Blake on why he posted that Joker gif last night: ""I was watching Dark Knight last night and that was one of my favorite scenes. I just wanted to show my appreciation""",1403,https://streamable.com/3dzcd,1516160969,265
7qxq30,Jaylen Brown flexes on an unhappy Boogie after the and-1,1410,https://streamable.com/tuwej,1516155508,193
7qxenc,Kyle Kuzma with the on-point Ingram/Slenderman comparison,3203,https://streamable.com/e8evp,1516152456,319
7qxeeq,Jayson Tatum with the filthy crossover,2349,https://streamable.com/3psmu,1516152395,291
7qx6pl,I heard you're into fights. I present to you Arron Afflalo!,14664,https://streamable.com/m7t5r,1516150403,2103
7qx14i,DeMar DeRozan getting lonely,1260,https://streamable.com/ovit2,1516148943,167
7qwjg4,[NBA] Patty Mills signs a ball for his new friend Chris at the NBA Store #ThisIsWhyWePlay,1303,https://streamable.com/6rv2r,1516144661,131
7qtkbv,"KD: ""IT hasn't played in 7 months, you gotta give him some time. I know exactly how that feels..Everyone knows it's going to take a while to get into a comfortable groove here. It's a new system, so I don't think this game was any indication of what's going to happen with this team down the line.""",1779,https://streamable.com/m7xhx,1516121121,231
7qrxqm,"Giannis on his football-like pass: ""I could be a pitcher"". Sums up Europeans' knowlegde on American football and baseball.",2239,https://streamable.com/ubcog,1516105009,319
7qqyme,Blake Griffin on what he said to Mike D'Antoni and Trevor Ariza,1146,https://streamable.com/yv7wm,1516091324,90
7qqmpg,Shaq and Charles roasting the Rockets-Clippers beef,5356,https://streamable.com/lbvqv,1516086594,348
7qqion,Reggie Miller being annoying,1270,https://streamable.com/rct9v,1516085069,164
7qqfpk,"[FIXED] Griffin, after a wardrobe malfunction, pegs Gordon with the ball from out of bounds, and gets the crowd fired up.",1465,https://streamable.com/g3oqo,1516083974,192
7qqd06,"Rivers talks shit to Ariza from the bench, Griffin comes over to back Rivers up, gets ejected. Ariza would be ejected shortly after this.",1051,https://streamable.com/aeqyq,1516083004,191
7qqax7,"Mike D'Antoni to Blake Griffin: ""That's bull shit! ... Fuck you!""",2533,https://streamable.com/674ph,1516082301,393
7qpjs4,Draymond yells at a LeBron Free throw attempt to be short.... LeBron comes up short on the free throw,1287,https://streamable.com/rg0jb,1516073781,144
7qpfuy,Russell Westbrook gets ejected for two techs in quick succession,1355,https://streamable.com/50gj8,1516072710,429
