id,title,score,url,created_utc,num_comments
868kat,Kelly Olynyk nutmeggs Kyle O'Quinn for the Richardson dunk.,1571,https://streamable.com/di8wl,1521689344,85
868gwr,Malik Beasley submits his Shaqtin nomination with the worst turnover of the year,1101,https://streamable.com/x1le4,1521688348,87
867xe7,VanVleet meets his idol,2995,https://streamable.com/gzcoi,1521683339,416
867ref,LeBron zips the pass to Kevin Love for the wide open 3 for his 17th assist of the night,2949,https://streamable.com/j40j5,1521681853,272
867qxe,76ers trolling behind sideline reporter,2685,https://streamable.com/c35v8,1521681729,308
867knv,Myles Turner cranks it WAY back on a slam and sends the Pacers bench into a frenzy,1762,https://streamable.com/eaw9a,1521680165,104
8614ch,"""Ain't gonna be no more layups""",2557,https://streamable.com/iyibo,1521629084,443
85zlxz,"Dennis Scott: ""... When you see the big guys switch on you the way they do"" -- James Harden replies with, ""Barbeque chicken.""",1741,https://streamable.com/7p8ps,1521608684,106
85zjf5,James Harden hits a tough side step three on two defenders! - TNT,1473,https://streamable.com/vnnk8,1521607826,239
85yqql,Marcus Morris with the clutch trey to take the lead!,6718,https://streamable.com/gxp4h,1521599588,625
85yp3o,Jayson Tatum sends Corey Brewer back to OKC,2039,https://streamable.com/hxwtw,1521599168,119
85yi0g,Steven Adams finds himself a scratching post,2595,https://streamable.com/revla,1521597287,151
85y7xg,"Gerald Green on his fine: ""I owe them some money now! I owe the Rockets money... My shit (monthly check) gon' say negative a-thousand this month ... ain't this sumthin ...""",1254,https://streamable.com/ckgho,1521594718,161
85xrsr,Russell Westbrook sees a ghost,1901,https://streamable.com/dcz9q,1521590835,185
85stoy,Carter doing his best Griffin impersonation... and it’s spot on!,5023,https://streamable.com/vx9gg,1521553654,350
