id,title,score,url,created_utc,num_comments
7uou8b,Jamal Murray breaks Steven Adams' ankles,1990,https://streamable.com/ny40f,1517545601,352
7uo6ex,Blake Griffin gets ambushed post game by Andre Drummond and Reggie Jackson,1055,https://streamable.com/gb7ns,1517538694,191
7unqgg,The TNT guys can't believe the Atlanta Hawks gave Dwight Howard a tribute video after playing with them for only a year,1449,https://streamable.com/qqf7o,1517534243,157
7ug34i,Nikola Jokic Can't Dunk,5555,https://streamable.com/lzd5b,1517458088,364
7ug2pe,Gruesome injury to Suns' Isaiah Canaan,10998,https://streamable.com/jnneu,1517457968,1719
7uft37,Boos in the Q after Isaiah Thomas misses his 6th three (0/6 3pt),1710,https://streamable.com/nr0j6,1517455294,642
7ufrvi,The Cavs run the same Channing Frye cut play 4 straight times until it stops working,2916,https://streamable.com/n6fl6,1517454970,209
7ufp8n,Terry Rozier notches a triple double in his first career start,3288,https://www.reddit.com/r/nba/comments/7ufp8n/terry_rozier_notches_a_triple_double_in_his_first/,1517454263,363
7ufk5t,Dwight Howard puts Muscala on a POSTER,2420,https://streamable.com/2jwzy,1517452934,194
7uf8dw,Jaylen Brown destroys Kristaps Porzingis with the huge poster,4508,https://streamable.com/u7upy,1517449767,489
7uf70m,"Ben Simmons goes baseline, splits the defense, and throws down a hard reverse slam!",2189,https://streamable.com/iapd3,1517449406,147
7uf1c0,Klay’s new ANTA commercial,5208,https://streamable.com/vyhb6,1517447873,452
7uewrd,Dennis Schroder commits the Iverson on D Howard,1811,https://streamable.com/ts2gq,1517446698,129
7ue1hj,[Fronseca]Markelle Fultz really working on the basics ahead of #Sixers vs #Nets tonight.,1064,https://streamable.com/9a55u,1517439007,213
7ucwjh,"Mike Conley still loopy from a successful surgery, sings ""Carry on my Wayward Son""",1831,https://streamable.com/r0su7,1517430026,177
7uavhc,"Markelle Fultz's Jump Shot: Dissecting his jumper via the lens of his injury, pain science, &amp; neuro-motor control",3480,https://www.reddit.com/r/nba/comments/7uavhc/markelle_fultzs_jump_shot_dissecting_his_jumper/,1517414274,432
