id,title,score,url,created_utc,num_comments
7toy8s,Westbrook dribbling out the rest of the game purposely looking at Joel Embiid 💀,2286,https://streamable.com/fn3ak,1517190799,439
7totlz,"Embiid hits Russ in the head with his elbow, then slaps him right in the face. No foul is called, and Westbrook is issued a technical for arguing the no-call.",2682,https://streamable.com/sb628,1517189530,469
7to3x9,Embiid dunks on Westbrook,12869,https://streamable.com/144w6,1517182711,941
7tnrx3,"Dance cam was on these Rockets fans and, fortunately, they came prepared.",3272,https://streamable.com/rd2oz,1517179626,274
7tnoec,Amazing sequence from the Bulls vs Bucks game,1122,https://streamable.com/9ihgz,1517178715,99
7tmxh5,Average redditor will be helping Rockets' sideline reporter today,1150,https://streamable.com/ej120,1517172003,94
7tmkxp,"Nikola Jokic's ""goofy jumper"" - his goofy-footed, off-balance take on the Dirk fadeaway jumpshot, which he ""invented"" after he hurt his ankle and tried shooting off his right leg.",1560,https://streamable.com/m7ohr,1517169000,197
7tl45l,"[Spears] Pregame Celtics-Warriors, Kevin Durant punched a ball into the air that hit a fan in the face. KD profusely apologized, brought the fan to the locker room later, signed some shoes.",5416,https://streamable.com/wv6jj,1517156190,511
7ti57k,Kenny Atkinson ready to throw hands with the ref and gets ejected.,1516,https://streamable.com/c5z66,1517113845,314
7thxgc,Curry with the deep three,3690,https://streamable.com/mtfsp,1517111290,378
7thq1x,This is the Denver Nuggets season in a nutshell,2813,https://streamable.com/lx20o,1517108839,134
7thcsh,Kyrie Irving with the shifty move on Curry!,3095,https://streamable.com/p0mfu,1517104760,380
7tgl48,Roberson goes down hard,2505,https://streamable.com/efeuh,1517096745,373
7tfh8a,"Derrick Rose says a bathroom break cost him playing time in fourth quarter. Says it ""blows his mind"" that other players don't use the bathroom more often during games.",3433,https://streamable.com/qa5gp,1517086127,514
7tciv0,Embiid talks about DeMarcus Cousins after hearing his injury from reporter.,2916,https://streamable.com/cuzoz,1517057315,238
7ta3q3,2 fans courtside react to Lou Williams,2723,https://streamable.com/hlrpg,1517024817,365
7ta1ml,"Kevin Love in the locker room: ""I don't like you Jeff!""",4216,https://streamable.com/h0495,1517024132,401
7ta1io,Porzingis gets drilled in the face,3943,https://streamable.com/gr79p,1517024100,223
