id,title,score,url,created_utc,num_comments
7o0xgh,Terrance Ferguson busts out the massive windmill on his break-out night!,2211,https://streamable.com/xi0c1,1515044539,284
7o0d22,Curry game winner vs Dallas,10060,https://streamable.com/bx03w,1515038181,1180
7o0d08,Harrison Barnes ties it before Steph Curry drains the three and wins the game,1626,https://streamable.com/cq21k,1515038167,194
7o0cxe,Klay with the tough layup,1181,https://streamable.com/gdy0v,1515038142,96
7o06dz,"Marcus Smart hugs Isaiah Thomas, goes to pat his head, then catches himself because IT hates it.",3442,https://streamable.com/cr1ti,1515036207,285
7nzywb,Jaylen Brown throws down the beautiful double-clutch reverse dunk on the fastbreak,1582,https://streamable.com/terw8,1515034064,133
7nz0ud,"IT asked if he watches Celtics games: ""I watch them a lot. I like how they play. I love Brad Stevens. I love Marcus Smart even though he flops all the time. I love Rozier. I love the coaching staff.""",3305,https://streamable.com/rcn24,1515025015,188
7nxa21,"Paul George: ""You ask 80 or 70 percent of the guys in the league, they would love to go back home and play for their city. That's all I stated. I would love to go back home and play for my city.""",2117,https://streamable.com/mcx54,1515010049,496
7nuut6,Suns execute the late-game elevator doors play for Booker to cut the Hawks lead from 5 to 2,1742,https://streamable.com/qcn6x,1514988571,208
7ns9zi,"Down by 3 with 6.5 seconds left, Dennis Schröder goes for the lay-up",1014,https://streamable.com/zxgi4,1514954194,141
7ns8ia,Marquese Chriss game winning block on Taurean Prince,2158,https://streamable.com/obs9n,1514953729,260
7nrhtf,Manu Ginobli makes a basket,13805,https://streamable.com/bv8hi,1514946041,866
7nr2vm,Nurkic flops so hard from LeBron bump that he bangs his head on Crowder,1585,https://streamable.com/j9lki,1514942021,315
7nr1kv,Michael Beasley's jumper spins around 6 times before finally dropping,3269,https://streamable.com/siru0,1514941680,204
7nqt9d,Isaiah Thomas first bucket for the Cavs,1334,https://streamable.com/5sq4u,1514939530,52
7nqryu,Cleveland welcomes Isaiah Thomas,2082,https://streamable.com/dcu2c,1514939206,122
7nolma,Courtney Lee is a Good Actor.,1437,https://streamable.com/x9p16,1514920556,130
7nnyra,13 examples of James Harden take-downs and flops,5064,https://www.reddit.com/r/nba/comments/7nnyra/13_examples_of_james_harden_takedowns_and_flops/,1514915106,1572
7nk6e5,"After tonight's game vs. Raptors, thousands of Greeks serenaded Giannis Antetokounmpo in Toronto! 🇬🇷💪",1360,https://streamable.com/mh3x5,1514867850,167
7nk247,JV interrupting DeMars post game interview,1419,https://streamable.com/6udug,1514866409,78
