id,title,score,url,created_utc,num_comments
827bt8,"LeBron said winning an Oscar hasn’t been a goal of his, but now that Kobe has one and he’s in the movie business...",1415,https://streamable.com/uo4jq,1520268663,232
823c2g,Skal with the dagger to the hearts of Kings fans who are still alive!,1263,https://streamable.com/04hao,1520223709,157
82336g,Embiid with the confident pull up 3,3572,https://streamable.com/m3dkd,1520221053,396
822rce,Kobe Bryant wins best short animated film ‘Dear Basketball’ Oscar nod as start of a career as a storyteller - ABC,2354,https://streamable.com/ruad8,1520217638,316
821hq8,"Death, Taxes, and JV 3s",2914,https://streamable.com/x7c59,1520205565,230
821bwn,Taurean Prince puts a dagger into Atlanta Hawks fans hearts,2368,https://streamable.com/t8j1h,1520204168,229
8205ke,Robert Sacre competes in dunk contest in Japan,5975,https://streamable.com/4bvun,1520194052,612
81vif6,Lonzo Ball with another clutch three to put the Lakers up three with under a minute to go! - SSN,4240,https://streamable.com/ehuiz,1520137039,489
81vi3h,Lonzo Ball hits a clutch three to put the Lakers up two! - SSN,1371,https://streamable.com/ookva,1520136930,82
81vhzu,Isaiah Thomas grabs a booster seat for the bench,1209,https://streamable.com/00i16,1520136896,152
81vgiq,Smart almost makes a prayer at the buzzer - ABC,1092,https://streamable.com/09pd5,1520136422,207
81vfb2,Kyrie Irving tries to miss a freethrow but makes it anyway - ABC,1609,https://streamable.com/vp5s9,1520136025,133
81v7el,Harden holds onto Jaylen Brown and Brown gets called for his 4th foul,2580,https://streamable.com/dszgu,1520133487,920
81v76l,The Sacramento Kings Introduce Jazz starting Lineup in the sexiest way possible,4583,https://streamable.com/72yta,1520133407,259
81uxug,Kyrie the Magician,1623,https://streamable.com/5gros,1520130534,131
81ujb5,Larry Nance Jr. destroys Mason Plumlee!,12423,https://streamable.com/2a0fh,1520126166,864
81ugtr,When Lebron Gives You A Hug,1292,https://streamable.com/gxxse,1520125432,73
81uez2,Jr Smith bowling pass to the ref,5317,https://streamable.com/5xawh,1520124881,300
81uccf,JR Smith is reunited with Richard Jefferson and can't contain his excitement,2365,https://streamable.com/a4wng,1520124149,163
81rt4k,Fultz looking like he’s about to fight TJ McConnell after he yells in his ear,3100,https://streamable.com/pril6,1520100479,198
81rov5,Utah fan is absolutely stunned by Jae Crowder's potty mouth,4620,https://streamable.com/ucw0x,1520099437,611
81qyqb,DeMar Derozan talks about his mental health - Streamable,7804,https://streamable.com/c681t,1520092854,393
81ppb9,Bjelica pulls down shorts in the middle of game.,1223,https://streamable.com/jv2yt,1520077826,111
