id,title,score,url,created_utc,num_comments
7xk4jz,"LeBron yells ""Timeout"" in between PG's free throws Thunder player responds: ""We got the ball already!"" LeBron says: ""It don't matter, timeout"". Ref: Gives timeout to LeBron",1293,https://streamable.com/nf3wg,1518632898,247
7xj3zh,"Larry Nance Senior says he called the Cavs and asked them to give his retired '22' jersey to his son. Junior refused out of respect, but Senior says he will try to convince him to change his mind after this season: ""I would be proud if he wore it, hopefully I can talk him into it.""",6592,https://streamable.com/bvy96,1518624907,494
7xgwg4,"Larry Nance on LeBron: ""he's not 'probably' the best player of this era. He is.""",2213,https://streamable.com/05sv2,1518600943,666
7xfad0,Kevin Garnett's Legendary Area 51 Segment,4260,https://streamable.com/rpn1u,1518580139,387
7xf7z1,Hennygod with an amazing play to ice the game,4114,https://streamable.com/b68dl,1518579441,252
7xf6kk,Larry to Jordan for the Swish!,1282,https://streamable.com/yoqr9,1518579040,198
7xf1p6,Beautiful ball movement by the Cavs bench leads to a wide-open 3,1688,https://streamable.com/v631z,1518577662,259
7xez3k,Twolves fan shows the crowd a lil too much,4391,https://streamable.com/8zism,1518576933,343
7xesyz,Vince Carter goes back in time,2797,https://streamable.com/6o70m,1518575172,259
7xeqht,LeBron blows by Melo with the post spin move and dunks all over Álex Abrines,1045,https://streamable.com/w6dj3,1518574506,145
7xeiyg,"Meanwhile, in Toronto...",12116,https://streamable.com/zbchl,1518572448,690
7xef32,Kyle Lowry and DeMar DeRozan connects with the lob and vicious finish,1168,https://streamable.com/25qu8,1518571392,64
7xeapo,Kyle lowry drains the insane circus three pointer at the end of the first half,2631,https://streamable.com/29zzv,1518570227,151
7xe0jq,"Ty Lue asked about Steve Kerr letting the players coach last night: “I wouldn’t do that. They already say LeBron is coaching the team, anyway. So, if I give him the clipboard they’re really going to say that.”",14749,https://streamable.com/r6lgb,1518567628,591
7xb4lv,"Chris Broussard on Undisputed: ""I was talking to somebody yesterday close to Isaiah, and they said, 'Isaiah Thomas has absolutely no love at all for LeBron... He felt like LeBron talked down to him when he was there.""",1788,https://streamable.com/dr5k4,1518543855,584
7xarak,"LeBron gets 'offended' when reporter suggests Trae Young still has a decision to make about going pro: ""What decision? That's like saying am I waking up this morning, that ain't no decision. Brushing my teeth. Ain't no decision. He better go pro.""",3773,https://streamable.com/tdiz1,1518540873,811
7x730y,"Draymond to KD: ""F**k you.""",3738,https://streamable.com/px1go,1518498125,292
7x6yb9,Donovan Mitchell doing it all in Crunch Time,1500,https://streamable.com/lbtdn,1518496672,309
7x6sji,Steve Kerr let's Andre coach,5739,https://streamable.com/okj2n,1518494951,708
7x6h7p,Zach LaVine steals the inbound and dunks the ball to make it 103-101 with 12 seconds left!,1631,https://streamable.com/ga3v2,1518491734,154
7x6eie,Joel Embiid on why he doesn’t need a burner account: “I’m a savage. I don’t care”,3457,https://streamable.com/f2dcm,1518490982,260
7x68fk,Joe Ingles obliterating the rim on a fast break,2005,https://streamable.com/glg3z,1518489296,181
7x689k,TJ McConell gets a shower after his first career triple double,2261,https://streamable.com/t1n79,1518489245,201
7x5yr0,"Robert Covington dunks on Beasley, Embiid gets a tech",1456,https://streamable.com/32kr4,1518486669,139
7x5tl0,Jahlil Okafor stoutly defends the key,3123,https://streamable.com/12ld0,1518485274,377
7x3khb,"Cedi Osman on his missed dunk: ""The last two nights I was a trending (Twitter) topic in Turkey..For me, seriously, I'm just having a lot of fun. I got a mention from Shaqtin a Fool that was saying to me, 'Welcome.' ..I made it. So it's all good.""",6043,https://streamable.com/hxntn,1518465971,361
7x2umq,"Lebron: “We got some catching up to do, not only with Boston, but Toronto and Philadelphia and all the other teams”",1369,https://streamable.com/wkufc,1518460302,339
7wybew,Donovan Mitchell's three big plays to hold off a strong Portland comeback,1461,https://streamable.com/gmbjn,1518410114,165
7wxjwy,"Paul George getting ""We love Paul"" chants",1128,https://streamable.com/gqa5x,1518401886,280
7wxco4,Jimmy Butler with the Balletic Save of the Ball,2699,https://streamable.com/nk38w,1518399859,156
