id,title,score,url,created_utc,num_comments
7ytqq4,Damian Lillard - “I’m as good as any point guard in the league. It’s that simple.”,1351,https://streamable.com/fybc0,1519106883,567
7ysj6j,"""What up big fella..."" -- Curry says nonchalantly",7141,https://streamable.com/xai1r,1519094351,501
7yr3w6,Kyrie Irving's fake crossover in slo-mo,1067,https://streamable.com/8wj8a,1519081761,200
7yqjcm,[Highlight] Dwane Casey listens intently and nods as LeBron James vocalizes the plan for the last play of the All-Star Game,1211,https://streamable.com/rso30,1519077208,111
7ypj0j,Joel Embiid ponders who the greatest really is,2991,https://streamable.com/10q6n,1519069953,417
7ynqh7,"Klay, Lebron, Steph, and others react to Fergie's rendition of the National Anthem",20763,https://streamable.com/rw211,1519056967,1521
7yn28f,Chris Webber and Reggie Miller suddenly change their minds after watching the replay,2090,https://streamable.com/9dryu,1519051264,199
7ykfl7,"Embiid on what he got out of the All Star Game: ""Before the game, I kinda thought I was a top 5 top 10 in the league. Coming in before the game I wanted confirmation of it. I feel like I can hang with them. I had a lot of fun""",1207,https://streamable.com/8dpq8,1519017991,326
7yk3k0,LeBron James gets crowned as the MVP of the All-Star Game,2075,https://streamable.com/do5aa,1519014266,250
7yk2iz,"Giannis Antetokoumpo video bombs Westbrook during his interview, ""He travels all the time."" - TNT",1587,https://streamable.com/mfotv,1519013953,80
7yk1pw,[Highlight] Team LeBron suffocates Team Steph for the last play of the game,4867,https://streamable.com/4qz3y,1519013720,680
7yk06q,[Highlight] LeBron is fired up after the referees call the out-of-bounds on Kevin Durant,1738,https://streamable.com/v3fii,1519013276,239
7yjzb1,LeBron James with the clutch three as he ties it! - TNT,1099,https://streamable.com/qunqc,1519013030,79
7yjtm1,"DeMarcus Cousins to Anthony Davis: ""If you score 50 &amp; win MVP, that's mine.""",1133,https://streamable.com/jvhjq,1519011443,41
7yjn0i,Klay doesn't know where to go!,4391,https://streamable.com/tsgfc,1519009560,279
7yjmg4,Kyrie and LeBron laughing their asses off on the bench,4120,https://streamable.com/zgygz,1519009393,492
7yjm80,"Charles on Fergie's national anthem: ""I need a cigarette after that""",8874,https://streamable.com/nuyx3,1519009319,443
7yji5k,Jimmy Butler playing patty cake with a fan pre-game,3404,https://streamable.com/ecfv2,1519008176,130
7yjgz3,LeBron laughs on Harden's face after his team forces a turnover,3911,https://streamable.com/wfof8,1519007844,263
7yjgr7,Marv Albert thinks it's the 4th quarter,1788,https://streamable.com/7nxlk,1519007793,106
7yjesd,Embiid with the deep three then the rejection!,3131,https://streamable.com/d52n6,1519007234,117
7yje38,[Highlight] LeBron to Westbrook back to LeBron for the reverse slam,2784,https://streamable.com/sov5f,1519007032,220
7yjc2y,"[HIGHLIGHT] Giannis ""goaltend"" on Kemba.",1264,https://streamable.com/alr8a,1519006437,63
7yj3wg,Draymond Green's reaction to Fergie's anthem,4890,https://streamable.com/pbn9c,1519004159,236
7yiy6k,Russ and Kyrie dancing in the tunnel playing catch with a round globe before the game,1451,https://streamable.com/76pfg,1519002643,52
7yiarm,Klay Thompson’s security doesn’t recognize Rasheed Wallace,1722,https://streamable.com/hx56s,1518996445,148
7yiac2,Oladipo singing like an angel for Inside the NBA's talent competition and the crew reacts,1487,https://streamable.com/h03k7,1518996325,121
7yhv9y,Robin Lopez customizing shoes for Inside the NBA talent competition and the crew is impressed,1235,https://streamable.com/q74re,1518992407,77
7yhk5f,"Bill Walton singles out LeBron, KD and Steph: “They are the epitome of what it means to live in the shadow of Bill Russell… When they stand up, I stand with them.”",2138,https://streamable.com/8esdc,1518989779,245
7yhg2h,Dwight's impersonations for the Inside the NBA talent competition + reactions from the crew,1152,https://streamable.com/5bpzw,1518988805,103
7yh2bv,[@TheCrossover] Steph drops some gems to Giannis,1526,https://streamable.com/j2enw,1518985682,211
7ygiwg,Nate Robinson Gets Upset at Charles Barkley,1270,https://streamable.com/zfmto,1518981528,200
7ye608,JJ Reddick uses racial slur (c***k) when congratulating Chinese fans on the Year of Dog. (00:18),6877,https://streamable.com/rfjc6,1518959789,1480
7yc437,"Donovan Mitchell on why he included his sister, Jordan in his second dunk: ""Growing up she's been to so many games. She's missed so many parties with friends. It's tough sometimes being a popular athlete's sibling. Lot of people don't know that. She's done a lot.. I'm glad I could give this to her""",2534,https://streamable.com/ihcmc,1518928526,214
7ybu2x,"Chuck to KG: ""Did you go to the Shaquillle O'Neal of kids school? You got 12 kids too? Just because you played basketball doesn't mean you have to form a basketball team.""",2512,https://streamable.com/h908w,1518925271,158
7ybswr,Vince and Donovan dunk side by side comparison,1262,https://streamable.com/tv1pm,1518924901,179
7ybozi,[HIGHLIGHT] Larry Nance JR bounces ball of backboard dunk.,3972,https://streamable.com/m5f66,1518923697,417
7ybo3v,[HIGHLIGHT] Larry Nance (1984) v. Larry Nance Jr. (2018),8012,https://streamable.com/t3cnq,1518923420,263
7ybm6d,NBA 2018 Dunk Contest: Dennis Smith Jr. with an electrifying dunk! - TNT,1324,https://streamable.com/mt7wu,1518922865,97
