id,title,score,url,created_utc,num_comments
7t1n6b,De'Aaron Fox explosive putback slam to put the Kings up one with under five seconds left! - FSF,1073,https://streamable.com/riqhz,1516935063,179
7t0yp2,"Chuck goes in on the Cavs for coming at Kevin Love ""To try to blame that guy because y'all stink, that ain't right and I ain't having it.""",1656,https://streamable.com/loiom,1516928367,150
7t0t21,"Chuck responds to guy on twitter saying ""Charles Barkley would pick Krispy Kreme donuts with the first pick"".",4496,https://streamable.com/otwxa,1516926885,239
7t0qck,"Kenny Smith: ""Who was the last pick?"" Shaq: ""Horford."" - TNT",1407,https://streamable.com/sbpr5,1516926182,264
7t0p5r,"Ernie tries to get LeBron to reveal his 1st pick but fails, LeBron says ""It definitely should have been televised.""",1676,https://streamable.com/zj0oc,1516925873,211
7sy09u,"Shannon Sharpe on IT: ""He couldn't guard a piggy bank with an AK""",6869,https://streamable.com/lvncm,1516903780,754
7svvfo,Frank Ntilikina reacts to being named a participant in the Rising Star game,1655,https://streamable.com/kz0wb,1516884914,215
7su6cx,"Blake to ref after getting a tech: “So I gotta pay money cause you can’t fucking catch?""",3323,https://streamable.com/a6mdz,1516860938,539
7stjkp,CORRECTION: Kevin Love WAS helped up after his fall in San Antonio,17677,https://streamable.com/85sy4,1516853716,1573
7st8pt,Robin Lopez in a late All-Star announcement,5052,https://streamable.com/i2ea6,1516851126,337
7ssv4z,"The Hawks broadcast has some weird, bordering uncomfortable, dead ball camera cuts",1045,https://streamable.com/c4ams,1516847996,134
7ssj2w,Embiid grabs ass to console Jerian Grant after unintentionally elbowing him in the face,1532,https://streamable.com/eut87,1516845798,128
7ss8f6,Ben Simmons notches a triple double 50 seconds into the 2nd half,3058,https://streamable.com/a03fs,1516843366,344
7ss2g3,LeBron reacts to people congratulating him for reaching 30k points,1458,https://streamable.com/mshbo,1516841808,244
7sp9em,Suns Coach Jay Triano hilariously impersonating a rack to help Devin Booker practice for the All Star 3 point shootout.,2544,https://streamable.com/ylv7b,1516819132,130
7soa36,The moment that KAT's parents found out he's going to be an all-star.,1660,https://streamable.com/ad115,1516811549,124
7sns5r,James Worthy's reaction to the Lakers winning against Boston.,3878,https://streamable.com/98rs5,1516807390,291
7sluep,[Anthony Slater] Klay Thompson will request a trade if Steph doesn't pick him and wishes the picks were televised to laugh at whoever is picked last.,4307,https://streamable.com/me9zc,1516784444,354
7slgpq,JR swish with the hesi-pullup jimbo,1698,https://streamable.com/pk6p6,1516778773,171
7skzw0,Kuzma behind the back to Nance for the slam!,1987,https://streamable.com/pt8va,1516771697,206
