id,title,score,url,created_utc,num_comments
7pg3te,"I bring to you, the 2017-18 Orlando Magic season",15178,https://streamable.com/n0zwt,1515596530,825
7pe3sq,"Vince Carter once said he’ll retire when he can’t dunk anymore, looks like he’s gonna be around a little while longer",1930,https://streamable.com/gh69a,1515570276,166
7pcqmw,Aaron Gordon engages BEAST MODE on the offensive glass,1314,https://streamable.com/p3xk2,1515554218,113
7pcmek,DeRozan pushes Dragic and swipes at him after the loss to the Heat,2614,https://streamable.com/z3x6c,1515553060,903
7pcltv,Ellington game-winning layup! - TSN,1397,https://streamable.com/7w8tv,1515552897,214
7pcaao,James Johnson and Serge Ibaka very physical scuffle. Both ejected,4983,https://streamable.com/75owo,1515549781,978
7pakkk,"John Wall on why Bradley Beal should be an All-Star: ""He's been the MVP of our team.""",1216,https://streamable.com/tdlig,1515534502,135
7p4vmf,Curry pulls up from deep,3064,https://streamable.com/bscgw,1515474691,512
7p4s0r,Jokic fakes Draymond out of his shoes,1500,https://streamable.com/b3fqa,1515473591,149
7p4oef,Jamal Murray takes Iggy for a dance.,1331,https://streamable.com/l8m2u,1515472437,135
7p4a8s,"Spencer Dinwiddie looks into the camera and says, ""this is exactly what I was talking about,"" after not getting a call on his game-winning attempt",1156,https://streamable.com/14rvm,1515468345,149
7p46s9,Kyle Lowry lands awkwardly. Gets carried off to the locker room,1694,https://streamable.com/elfqh,1515467378,326
7p3zqf,Gerald Green takes flight!,1096,https://streamable.com/fqbzb,1515465435,108
7p3yqf,Flagrant 2 foul: Isaiah Thomas hits Wiggins in the throat.,5635,https://streamable.com/3lqfx,1515465155,1184
7p3swz,Jimmy Butler with the dagger 3 to end the 2nd Quarter! 69-42 for Minnesota!,1730,https://streamable.com/w6c7n,1515463586,135
7p3sba,"Tyus Jones picks Wade's pocket and slams it down, preventing a LeBron chasedown",9229,https://streamable.com/13g6y,1515463427,516
7p3q9r,LeBron with a disrespectful block on Tyus Jones,1347,https://streamable.com/frl2p,1515462888,168
7ozir6,Did you see that Isaiah Thomas after a trade had a conversation with Adrian Wojnarowski?,1513,https://streamable.com/ykzu8,1515427983,243
7ow2z9,CJ McCollum wins the game for the Blazers,1203,https://streamable.com/qhqv5,1515385729,97
7ovjxu,Steven Adams flies high for the alley-oop from Westbrook,1574,https://streamable.com/tl8hb,1515380241,102
7ovimh,Jimmy Butler finds out that the Rams lost during KAT interview,2667,https://streamable.com/b6ka6,1515379890,205
7ov5su,An unacceptable minute and a half from DeMarcus Cousins after not getting a call,3059,https://streamable.com/8qr8z,1515376343,952
7ouvao,"Rick Carlisle: ""Printing an article where the father of an NBA player has an opinion that's printed as anything like legitimate erodes trust. It erodes the trust that we've built with ESPN. Our coaches are upset because Luke Walton does not deserve that. """,20257,https://streamable.com/egyfu,1515373388,1653
7oucw4,[MacBride] Steph Curry made sure this Warriors fan had a special day. 13-Year-old Jaylen Winzer has bone cancer. He and his family went to the game in LA. Steph gave Jaylen his game jersey and warm-up shoes.,1619,https://streamable.com/jrztt,1515368419,221
7otpav,Donovan Mitchell throws down a nasty one handed alley oop,3034,https://streamable.com/8ddo1,1515362408,239
7osp9l,"Lonzo Ball speaks on his fathers recents comments about Luke Walton and how he'll ""play for anyone""",2340,https://streamable.com/ujmu8,1515353380,906
