id,title,score,url,created_utc,num_comments
7p4vmf,Curry pulls up from deep,2817,https://streamable.com/bscgw,1515474691,473
7p4s0r,Jokic fakes Draymond out of his shoes,1351,https://streamable.com/b3fqa,1515473591,139
7p4oef,Jamal Murray takes Iggy for a dance.,1235,https://streamable.com/l8m2u,1515472437,127
7p4a8s,"Spencer Dinwiddie looks into the camera and says, ""this is exactly what I was talking about,"" after not getting a call on his game-winning attempt",1105,https://streamable.com/14rvm,1515468345,149
7p46s9,Kyle Lowry lands awkwardly. Gets carried off to the locker room,1658,https://streamable.com/elfqh,1515467378,321
7p3zqf,Gerald Green takes flight!,1051,https://streamable.com/fqbzb,1515465435,108
7p3yqf,Flagrant 2 foul: Isaiah Thomas hits Wiggins in the throat.,5448,https://streamable.com/3lqfx,1515465155,1166
7p3swz,Jimmy Butler with the dagger 3 to end the 2nd Quarter! 69-42 for Minnesota!,1701,https://streamable.com/w6c7n,1515463586,135
7p3sba,"Tyus Jones picks Wade's pocket and slams it down, preventing a LeBron chasedown",9061,https://streamable.com/13g6y,1515463427,507
7p3q9r,LeBron with a disrespectful block on Tyus Jones,1331,https://streamable.com/frl2p,1515462888,168
7ozir6,Did you see that Isaiah Thomas after a trade had a conversation with Adrian Wojnarowski?,1512,https://streamable.com/ykzu8,1515427983,246
7ow2z9,CJ McCollum wins the game for the Blazers,1207,https://streamable.com/qhqv5,1515385729,95
7ovjxu,Steven Adams flies high for the alley-oop from Westbrook,1572,https://streamable.com/tl8hb,1515380241,104
7ovimh,Jimmy Butler finds out that the Rams lost during KAT interview,2654,https://streamable.com/b6ka6,1515379890,200
7ov5su,An unacceptable minute and a half from DeMarcus Cousins after not getting a call,3053,https://streamable.com/8qr8z,1515376343,950
7ouvao,"Rick Carlisle: ""Printing an article where the father of an NBA player has an opinion that's printed as anything like legitimate erodes trust. It erodes the trust that we've built with ESPN. Our coaches are upset because Luke Walton does not deserve that. """,20252,https://streamable.com/egyfu,1515373388,1656
7oucw4,[MacBride] Steph Curry made sure this Warriors fan had a special day. 13-Year-old Jaylen Winzer has bone cancer. He and his family went to the game in LA. Steph gave Jaylen his game jersey and warm-up shoes.,1617,https://streamable.com/jrztt,1515368419,222
7otpav,Donovan Mitchell throws down a nasty one handed alley oop,3022,https://streamable.com/8ddo1,1515362408,239
7osp9l,"Lonzo Ball speaks on his fathers recents comments about Luke Walton and how he'll ""play for anyone""",2338,https://streamable.com/ujmu8,1515353380,907
7orjtl,Klay attempts to speak japanese,2018,https://streamable.com/4ce1m,1515343077,244
7or94y,(x-post from /r/suns) How the Suns' Offense Has Changed Under Interim Coach Jay Triano (or how Triano has the ideas to make the Suns' offense great again but not the current player personnel),1790,https://www.reddit.com/r/nba/comments/7or94y/xpost_from_rsuns_how_the_suns_offense_has_changed/,1515340140,74
7oo2xl,Matthew Dellavedova gets ejected on a Flagrant 2,2299,https://streamable.com/bpol9,1515294054,805
7onq6s,"Cedi Osman with the outlet pass to King of Outlet Passes, Kevin Love, for the And 1!",1158,https://streamable.com/6yzgo,1515290254,154
