id,title,score,url,created_utc,num_comments
83cjbp,Drake was in Ariza's ear during the final play,1079,https://streamable.com/53cy2,1520651503,231
83c2bv,Refs in TOR HOU half time game miss obvious taunting tech,3069,https://streamable.com/ocyt4,1520646500,169
83bvhg,"Bucks win tip, Giannis snaps the ball to Bledsoe who does a push-up for...some reason",2082,https://streamable.com/byu44,1520644637,225
833x0b,McGee Posterizes Bertans into Oblivion.,1213,https://streamable.com/j7hld,1520568676,81
833pob,Nick Collison dunks it and the OKC bench goes crazy,1526,https://streamable.com/cdwtx,1520566576,209
833hor,Wade turns back the clock and finishes the alley-oop from J-Rich,1335,https://streamable.com/8wsf6,1520564361,157
833g6x,Jaylen Brown comes down hard on his back/neck after a dunk. Walks off.,10891,https://streamable.com/5ry4b,1520563941,1338
8339it,Hassan Whiteside gently dunks on Joel Embiid,1593,https://streamable.com/4x66k,1520562179,270
8333l9,Marcus Smart putback dunk (h/t:@celtics),2220,https://streamable.com/066uv,1520560621,93
832wbd,Ben Simmons is ready to revolutionize the three point shot,2550,https://streamable.com/bp040,1520558691,311
82zhf2,Jr. Smith Has Scored Less Points Than Kyle Korver With 500 More Minutes Played &amp; 41 More Attempts,1322,https://www.reddit.com/r/nba/comments/82zhf2/jr_smith_has_scored_less_points_than_kyle_korver/,1520531965,123
82y5s5,"LeBron when asked about Cavs possibly slipping to the 6th seed during their current road trip: ""It doesn't matter to me if I'm a 6th seed, 3 seed, 2 seed, 8 seed...If I come into your building for a Game 1, it will be very challenging""",5997,https://streamable.com/yvaq8,1520521817,964
82xqpa,Side by side comparison of DeMar &amp; Kobe - turnaround pump fake jumper,2230,https://streamable.com/gvx9a,1520518314,236
82vb1y,LeBron 9 straight points in the last 2 mins to ice the game,2168,https://streamable.com/bdb2a,1520488756,403
82v9oj,LeBron swishes the ridiculous fade away dagger.,4638,https://streamable.com/bwxxo,1520488313,449
82v3m7,Lonzo hustles to prevent a breakaway dunk,2879,https://streamable.com/v2onp,1520486300,193
82ul99,DeRozan drives and finds VanVleet in the corner with a clutch two to put the Raptors up two! - TSN,3099,https://streamable.com/s446y,1520480879,277
82ujy3,Raptors and Pistons with some great basketball to end regulation,1117,https://streamable.com/y5k5g,1520480541,69
82uhx1,This ref emphatically calls a blocking foul,5161,https://streamable.com/jsnrg,1520480007,344
82ugf8,DeRozan with the clutch posterization! - TSN,16428,https://streamable.com/62tv2,1520479614,1323
82ufu2,DeRozan hits a clutch tough shot with under 20 seconds left - TSN,1179,https://streamable.com/2pl9o,1520479453,46
82txm4,Harden from DEEP to cap off a 21 point half!,1646,https://streamable.com/zpo85,1520474631,307
