id,title,score,url,created_utc,num_comments
7y4w5l,"All-Star media question: “What’s your go-to line If you see an attractive female that you like?” Joel Embiid: “Who wants to sex The Process""",3996,https://streamable.com/884xl,1518846267,198
7y4chj,Mitchell alley-oop to Collins!,3899,https://streamable.com/dthb7,1518839270,175
7y4b65,Brown with the between-the-legs dunk!,1077,https://streamable.com/geosj,1518838821,76
7y45s0,Embiid with the spin and the slam!,1564,https://streamable.com/2je0z,1518836996,197
7y41r2,Bogdanovic with three 3's in a row! - TNT,2933,https://streamable.com/vxuod,1518835724,199
7y41bo,Bogdanovic very deep 3.,1311,https://streamable.com/02ana,1518835588,65
7y3w01,Mitchell to himself!,15030,https://streamable.com/km11r,1518833951,527
7y3unm,"Rising Star Announcer: ""The hands of the NBA are in great hand"". I just can't stop laughing at his face when he realises.",1324,https://streamable.com/56vp9,1518833541,93
7y3r2p,Quavo blocks Rachel Demita,4539,https://streamable.com/og36i,1518832483,487
7y3pj6,Rachel Demita with the fake and 3.,1217,https://streamable.com/ixsap,1518832019,105
7y2f5l,"Kevin Love on his modelling career: ""I'm a fall guy""",2266,https://streamable.com/paxlk,1518819571,210
7y1sef,"Kareem on which big today can fit in any era, “Anthony Davis — because he can do everything...”",1475,https://streamable.com/697sk,1518813978,190
7xzvnb,"Adam Silver says it was Curry who prevented All-Star draft from being televised: ""He was the one who said, ‘Give us a break. We changed the format for the first time. Let’s see how it goes, and we can talk about televising it.’”",4057,https://streamable.com/s310j,1518798564,592
7xzo8x,"[Road Trippin Clip] LeBron on if his All Star team is cursed: ""When the injuries started happening..I was like what the hell is going on with my team.."" And on changes to the draft process: ""We should have all showed up at All Star practice, everybody stand at half court, and take your teams.""",2085,https://streamable.com/ju6w6,1518796895,140
7xzmo2,"[Bishop] Laura Ingraham says LeBron James should ""shut up and dribble"" and leave political comments to people who didn't leave high school a year early.",18528,https://www.reddit.com/r/nba/comments/7xzmo2/bishop_laura_ingraham_says_lebron_james_should/,1518796518,5058
7xzg53,"LeBron James and Kevin Durant think the players need to do a better job with the all-star game. LeBron: ""We do got to do a better job on Sunday... it's our obligation to go out and kill each other on the basketball floor.""",2771,https://streamable.com/pgm7r,1518794948,279
7xw9o1,Jimmy Butler with two clutch blocks! - TNT,2105,https://streamable.com/gv9lo,1518754588,204
7xw67u,Kevin Harlan loves Lil Uzi Vert,2572,https://streamable.com/a0kln,1518753494,381
7xvscy,"""I dare you, I dare you Thomas""",1765,https://streamable.com/uidkl,1518749359,331
7xvs1m,This pass gave Jokic the most assists ever in a game for a Center since Wilt (15),1001,https://streamable.com/pptxu,1518749272,85
7xvo6r,Jokic with the Disgusting Behind the Back Assist to Juancho,2594,https://streamable.com/hkyle,1518748145,166
7xvcjt,Al Jefferson with the Statue of Liberty pump fake,5209,https://streamable.com/nxpsa,1518744883,274
7xu9tw,Grant Hill confirms the story about why Orlando didn't get Tim Duncan,2082,https://streamable.com/q51ul,1518734822,430
7xrpt9,"Shaq on certain superstars joining already Championship caliber teams: ""I told my boy the other day, if you could do that I would have went to Chicago and just played with Mike. I didn't know that's how you do it.""",3266,https://streamable.com/0t14f,1518713994,1121
7xr1ou,Charles Barkley talks about playing a game whilst drunk after thinking he got traded to the Lakers.,7851,https://streamable.com/bmpuj,1518708273,832
7xood2,Evan Turner comes calling for his $100 mid Draymond Green interview after Ohio State's win over Michigan State,1725,https://streamable.com/2elpo,1518676776,199
7xocbp,Ref blows the whistle on Ben Simmons for a shot clock violation before the buzzer goes off,1647,https://streamable.com/uuccj,1518672335,184
7xo0hu,Donovan Mitchell dagger against the Suns,2198,https://streamable.com/8pcte,1518668455,435
