id,title,score,url,created_utc,num_comments
867xe7,VanVleet meets his idol,2071,https://streamable.com/gzcoi,1521683339,308
867ref,LeBron zips the pass to Kevin Love for the wide open 3 for his 17th assist of the night,2325,https://streamable.com/j40j5,1521681853,220
867qxe,76ers trolling behind sideline reporter,1935,https://streamable.com/c35v8,1521681729,238
867knv,Myles Turner cranks it WAY back on a slam and sends the Pacers bench into a frenzy,1298,https://streamable.com/eaw9a,1521680165,85
8614ch,"""Ain't gonna be no more layups""",2539,https://streamable.com/iyibo,1521629084,441
85zlxz,"Dennis Scott: ""... When you see the big guys switch on you the way they do"" -- James Harden replies with, ""Barbeque chicken.""",1736,https://streamable.com/7p8ps,1521608684,106
85zjf5,James Harden hits a tough side step three on two defenders! - TNT,1469,https://streamable.com/vnnk8,1521607826,239
85yqql,Marcus Morris with the clutch trey to take the lead!,6719,https://streamable.com/gxp4h,1521599588,625
85yp3o,Jayson Tatum sends Corey Brewer back to OKC,2040,https://streamable.com/hxwtw,1521599168,119
85yi0g,Steven Adams finds himself a scratching post,2597,https://streamable.com/revla,1521597287,151
85y7xg,"Gerald Green on his fine: ""I owe them some money now! I owe the Rockets money... My shit (monthly check) gon' say negative a-thousand this month ... ain't this sumthin ...""",1258,https://streamable.com/ckgho,1521594718,161
85xrsr,Russell Westbrook sees a ghost,1900,https://streamable.com/dcz9q,1521590835,185
85stoy,Carter doing his best Griffin impersonation... and it’s spot on!,5018,https://streamable.com/vx9gg,1521553654,351
85oyq3,LeBron gets the rebounds and runs the length of the court for the dunk,1057,https://streamable.com/1dxn4,1521509313,97
85ou5o,Kevin Love starts backstroking on the court after his miss,13305,https://streamable.com/1hecl,1521508157,560
85oe2w,Giannis with the nasty alley oop dunk,1726,https://streamable.com/08itr,1521504378,130
85oauf,"Isiah Thomas: ""I'm picking LeBron James over Michael Jordan""",1952,https://streamable.com/odknp,1521503558,841
85o7nc,Thon Maker does not like soup,1165,https://streamable.com/3xja7,1521502818,84
85m767,"[ESPN] Per Dave McMenamin, Ty Lue has been coughing up blood, in addition to the chest pains.",2300,https://streamable.com/odg7g,1521487267,363
85lq02,Kuzma tells Lonzo to get a plate. Lonzo informs him that he is in fact using a plate.,3855,https://streamable.com/xl02g,1521483757,558
85lb9i,Jordan Clarkson in awkward Heineken commercial for Philippine market,2602,https://streamable.com/oscnd,1521480780,351
