id,title,score,url,created_utc,num_comments
7rf557,Embiid denies Rihanna,8465,https://streamable.com/ltj1v,1516328879,857
7refu3,LeBron behind the back pass,2507,https://streamable.com/rno53,1516322181,310
7rdzu2,DeMar DeRozan ecstatic about being named starter for the All-Star Game,1721,https://streamable.com/0o2tn,1516318207,178
7rbxc1,[OC] Why Jason Kidd should remain the Bucks Head Coach,2098,https://www.reddit.com/r/nba/comments/7rbxc1/oc_why_jason_kidd_should_remain_the_bucks_head/,1516301357,203
7rateo,"Embiid, Saric and Timothé Luwawu-Cabarrot playing ️soccer with a basketball after shootaround.",2034,https://streamable.com/a1oky,1516292622,426
7r7906,Donovan Mitchell splits the defense and throws it down,1563,https://streamable.com/lxzzu,1516250268,261
7r6t6w,Referees in the Knicks game are really screwing the Knicks. This came after a crap foul call on Porziņģis. Refs are really out here trying to get their asses kicked.,2659,https://streamable.com/0hz94,1516245573,602
7r6rsd,"Gregg Popovich: ""Oh, you mean those typical NBA fights where they go, 'Let me at him. I would've kicked his ass. Somebody hold me back.' The NBA fights are the silliest things I've ever seen in my life. Except there was that one in the stands a few years ago, that one was ugly.""",5451,https://streamable.com/7uz0t,1516245194,602
7r6r6n,Dunn takes a spill after a dunk - face first.,2091,https://streamable.com/odwt7,1516245021,312
7r6net,Kent Bazemore hits the game winner over Anthony Davis,1037,https://streamable.com/yoc09,1516244030,140
7r6iws,"After MCW is unable to continue, Scott Brooks chooses Dwight Howard to shoot two free throws in garbage time. Dwight drains them, blows a kiss to Scott Brooks, and shows his big balls",5193,https://streamable.com/a42c3,1516242802,526
7r67ry,Great effort from the Bulls at the end of the quarter,1311,https://streamable.com/5hkar,1516239793,89
7r63v1,"Gregg Popovich on Kawhi Leonard: “We said indefinite just so that I wouldn't have to keep answering your questions every day.""",2348,https://streamable.com/1acwu,1516238780,294
7r624n,Lauri Markkanen block off Steph's head,17648,https://streamable.com/iykf1,1516238343,793
7r61ad,Jordan Bell Gets Injured During the First Play of the Game :-(,1705,https://streamable.com/jlfwk,1516238125,242
7r5oyn,"Steve Kerr when asked if there are any secret hallways in the United Center: ""Is there one that gets to Fred Hoiberg's locker room?"" 'cause if I get pissed at him tonight I'm going right down the hallway.""",1973,https://streamable.com/0o11v,1516234995,116
