id,title,score,url,created_utc,num_comments,views,week
7grh6m,LeBron James with the Rejection!,18958,https://streamable.com/zvfri,1512091872,1170,663299,2017-48
7h5293,Amazing defensive effort by the Suns,22852,https://streamable.com/7w48t,1512246626,1137,491303,2017-48
7g0rgw,This Celtics fan on the Jumbotron had me shook,8027,https://streamable.com/n95cb,1511836482,394,437188,2017-48
7gilac,Dwight Howard crosses up Poeltl and puts Ibaka on a poster,12329,https://streamable.com/umcia,1512005635,672,402393,2017-48
7gis93,Sixers Cameraman gets caught spying on a girl at the game. Awkwardly zooms into basket and goes blurry,4137,https://streamable.com/ehwcr,1512007373,410,188770,2017-48
7hdtre,Shaun Livingston gets thrown out from the game,5455,https://streamable.com/iz7dp,1512349188,1262,166137,2017-48
7h0lbn,Donovan Mitchell cannot hide his smile as he becomes the first rookie to score 40-plus points since Blake Griffin did it in 2011,12615,https://streamable.com/j1spt,1512188558,821,158480,2017-48
7gi3x9,Elfrid Payton breaking Brodie's ankles!,3471,https://streamable.com/uqgkx,1512001226,254,139985,2017-48
7h4q36,"Devin Booker blocks Kyrie's meaningless shot after the buzzer, then keeps the ball away from him",2364,https://streamable.com/pyh7p,1512243364,349,139353,2017-48
7h7rol,Jamal Murray dribbles past Lonzo Ball and Randle takes offense,2151,https://streamable.com/lsead,1512276168,780,136887,2017-48
7h7jd0,Gary Garris Harris 360 Fingeroll Past Larry Nance,9358,https://streamable.com/7ca4y,1512273200,310,135312,2017-48
7g06m7,Lebron cleans up his mess and ends the half with a buzzer beater.,3662,https://streamable.com/pcp1e,1511831176,348,133025,2017-48
7gzxy2,Kevin Durant gets ejected from the game,2926,https://streamable.com/4pwrk,1512180657,822,126000,2017-48
7gru4b,Ben Simmons reverse dunk putback,3839,https://streamable.com/ok4kj,1512095284,282,117435,2017-48
7gsbws,"LeBron hits the LeFuckYou3 over Blazemore. Later, celebrates with a familiar fan sitting courtside.",1890,https://streamable.com/36ira,1512100058,305,112492,2017-48
7gj0ds,Westbrook looks broken.,2918,https://streamable.com/qah0x,1512009483,999,109540,2017-48
7g13ul,LeBron smiling at Embiid after knocking down the jumper in his face.,1944,https://streamable.com/xn3uz,1511839629,278,107625,2017-48
7hdxa6,Bam Adebayo locks down Stephen Curry on the perimeter,2234,https://streamable.com/vh5xh,1512350170,199,105049,2017-48
7gj2mn,the Wolves-Pelicans halftime show is REALLY REALLY weird.,3176,https://streamable.com/3kmyd,1512010043,478,95164,2017-48
7fzvv6,JJ Reddick doesn't want to guard LeBron,1695,https://streamable.com/3lg3x,1511828486,145,80833,2017-48
7hebdb,"Joffrey Lauvergne gets his finger dislocated, Popovich doesn't want to see any of that",2078,https://streamable.com/ge6lf,1512354193,120,80376,2017-48
7g0khc,"Wade blocks Embiid, on the other end LeBron James squares Embiid up on the perimeter and drills it - FS",2159,https://streamable.com/hbrbw,1511834713,279,79131,2017-48
7grbhj,Bron with the monster dunk,1779,https://streamable.com/xj6nr,1512090396,170,74854,2017-48
7gjz35,Lonzo Ball with back to back 3 pointers followed by a layup,1888,https://streamable.com/9hhes,1512019025,305,71564,2017-48
7gsfzl,Giannis destroys Lillard’s layup with the chasedown to end the half,1952,https://streamable.com/mrk5i,1512101151,135,70643,2017-48
7girh7,Anthony Davis gets his 2nd tech and gets ejected,2118,https://streamable.com/ksemw,1512007173,416,66401,2017-48
7h7cfv,Embiid and Drummond hug it out at the end of the game,2709,https://streamable.com/cmybt,1512270871,239,64919,2017-48
7gf0mx,Isaiah Thomas had a framed LeBron James jersey in his house while he was still a Celtic,2148,https://streamable.com/qpchr,1511976945,266,64508,2017-48
7gs0qn,Lebron ices the game with a block on Dennis,2113,https://streamable.com/ti6vu,1512097077,247,59773,2017-48
7hetc8,Harden nonchalantly throws a 48 foot alley oop to Eric Gordon,1275,https://streamable.com/yt1p5,1512359588,133,58270,2017-48
